{"id": 32, "time": "2026-09-30T23:21:59+02:00", "name": "048-final", "run": "balance/runs/048-final.json", "rev": "79571fb", "dirty": true, "code": "751a9ee536", "bot": "be2688243a", "first": 1, "seeds": 96, "turns": 20000, "changed": ["StrDiv: 60 \u2192 45", "PotionHeal: 0.5 \u2192 0.65", "ManaPerEne: 1.2 \u2192 1.7", "GoldPerLvl: 3 \u2192 2", "QuestGoldPerLvl: 250 \u2192 100"], "rules": {"AffixLvlScale": 1, "ArmorCap": 0.5, "ArmorK": 50, "ArmorPerLvl": 10, "BoltCostLvl": 0.667, "BoltEnePow": 1, "BoltMul": 1, "BossHpLin": 0.22, "BudgetMul": 7, "ChampBase": 8, "ChampDmg": 1.3, "ChampHp": 2.2, "ChampPerDepth": 3, "DmgLin": 0.24, "DmgQuad": 0.02, "DropChance": 12, "GambleBonus": 1, "GamblePerDepth": 30, "GamblePrice": 120, "GoldChance": 30, "GoldPerLvl": 2, "HPPerLvl": 4, "HealCost": 0.5, "HpLin": 0.32, "HpQuad": 0.05, "ManaPerEne": 1.7, "ManaPerLvl": 2, "ManaPotion": 0.4, "MonArmorK": 120, "MonArmorPerLvl": 2, "MonToHitPerLvl": 3, "NovaMul": 1, "PackMul": 1, "PotionHeal": 0.65, "PotionPrice": 20, "PotionPricePerLvl": 4, "QuestGoldPerLvl": 100, "RareBonus": 0.2, "RerollPerDepth": 10, "RerollPrice": 50, "ScrollPrice": 40, "ScrollPricePerLvl": 6, "SellDiv": 12, "StrDiv": 45, "ToHitPerLvl": 0, "XPBase": 35, "XPExp": 1.8}, "score": 18.008336146174194, "scoreCI": [15.811084010914676, 21.752343573283827], "key": {"abyssDeath": 7, "caster.clvl": 13, "caster.deepest": 7, "caster.gold": 3.2772727272727273, "caster.king": 0.8645833333333334, "caster.oracle": 0, "fighter.clvl": 12, "fighter.deepest": 7, "fighter.gold": 5.140909090909091, "fighter.king": 0.7395833333333334, "fighter.oracle": 0, "gap": 0.125, "stuck": 0}, "change": "rules: PotionHeal 0.5 -> 0.65", "why": "the sampler bands see no potions, deaths do: median potions left at death is 0 for both builds. Paired at 96 seeds on #33: caster deepest +0.29 (sure), clvl +0.39, potions per level -0.43/-1.05 (sure), fighter unchanged (king 0.75 -> 0.74); score +1.35 (noise) from the gold band, as fewer potions bought means more surplus. Kept for the caster's progress and fewer town trips; validated on fresh seeds in #36", "decision": "keep", "base": "balance/runs/047-base.json", "vsBase": "+1.35 (-2.67\u2026+4.87)", "best": "16.66", "bestRun": "balance/runs/047-base.json"}
{"id": 33, "time": "2026-09-30T23:21:59+02:00", "name": "049-val-defaults", "run": "balance/runs/049-val-defaults.json", "rev": "79571fb", "dirty": true, "code": "751a9ee536", "bot": "be2688243a", "first": 1001, "seeds": 96, "turns": 20000, "changed": null, "rules": {"AffixLvlScale": 1, "ArmorCap": 0.5, "ArmorK": 50, "ArmorPerLvl": 10, "BoltCostLvl": 0.667, "BoltEnePow": 1, "BoltMul": 1, "BossHpLin": 0.22, "BudgetMul": 7, "ChampBase": 8, "ChampDmg": 1.3, "ChampHp": 2.2, "ChampPerDepth": 3, "DmgLin": 0.24, "DmgQuad": 0.02, "DropChance": 12, "GambleBonus": 1, "GamblePerDepth": 30, "GamblePrice": 120, "GoldChance": 30, "GoldPerLvl": 3, "HPPerLvl": 4, "HealCost": 0.5, "HpLin": 0.32, "HpQuad": 0.05, "ManaPerEne": 1.2, "ManaPerLvl": 2, "ManaPotion": 0.4, "MonArmorK": 120, "MonArmorPerLvl": 2, "MonToHitPerLvl": 3, "NovaMul": 1, "PackMul": 1, "PotionHeal": 0.5, "PotionPrice": 20, "PotionPricePerLvl": 4, "QuestGoldPerLvl": 250, "RareBonus": 0.2, "RerollPerDepth": 10, "RerollPrice": 50, "ScrollPrice": 40, "ScrollPricePerLvl": 6, "SellDiv": 12, "StrDiv": 60, "ToHitPerLvl": 0, "XPBase": 35, "XPExp": 1.8}, "score": 19.61724982937259, "scoreCI": [18.577083730805445, 22.213799884832344], "key": {"abyssDeath": 7, "caster.clvl": 13, "caster.deepest": 7, "caster.gold": 3.9863636363636363, "caster.king": 0.7916666666666666, "caster.oracle": 0, "fighter.clvl": 12, "fighter.deepest": 7, "fighter.gold": 5.813852813852814, "fighter.king": 0.6666666666666666, "fighter.oracle": 0, "gap": 0.125, "stuck": 0}, "change": "validation: DefaultRules on fresh seeds 1001-1096, current code and bot", "why": "the control for the pick; not comparable in score with seeds 1-96", "decision": "baseline", "base": "balance/runs/047-base.json", "vsBase": "+NaN (+NaN\u2026+NaN)", "best": "16.66", "bestRun": "balance/runs/047-base.json"}
{"id": 34, "time": "2026-09-30T23:22:00+02:00", "name": "050-val-final", "run": "balance/runs/050-val-final.json", "rev": "79571fb", "dirty": true, "code": "751a9ee536", "bot": "be2688243a", "first": 1001, "seeds": 96, "turns": 20000, "changed": ["StrDiv: 60 \u2192 45", "PotionHeal: 0.5 \u2192 0.65", "ManaPerEne: 1.2 \u2192 1.7", "GoldPerLvl: 3 \u2192 2", "QuestGoldPerLvl: 250 \u2192 100"], "rules": {"AffixLvlScale": 1, "ArmorCap": 0.5, "ArmorK": 50, "ArmorPerLvl": 10, "BoltCostLvl": 0.667, "BoltEnePow": 1, "BoltMul": 1, "BossHpLin": 0.22, "BudgetMul": 7, "ChampBase": 8, "ChampDmg": 1.3, "ChampHp": 2.2, "ChampPerDepth": 3, "DmgLin": 0.24, "DmgQuad": 0.02, "DropChance": 12, "GambleBonus": 1, "GamblePerDepth": 30, "GamblePrice": 120, "GoldChance": 30, "GoldPerLvl": 2, "HPPerLvl": 4, "HealCost": 0.5, "HpLin": 0.32, "HpQuad": 0.05, "ManaPerEne": 1.7, "ManaPerLvl": 2, "ManaPotion": 0.4, "MonArmorK": 120, "MonArmorPerLvl": 2, "MonToHitPerLvl": 3, "NovaMul": 1, "PackMul": 1, "PotionHeal": 0.65, "PotionPrice": 20, "PotionPricePerLvl": 4, "QuestGoldPerLvl": 100, "RareBonus": 0.2, "RerollPerDepth": 10, "RerollPrice": 50, "ScrollPrice": 40, "ScrollPricePerLvl": 6, "SellDiv": 12, "StrDiv": 45, "ToHitPerLvl": 0, "XPBase": 35, "XPExp": 1.8}, "score": null, "scoreCI": [0, 0], "fail": "3 stuck runs", "key": {"abyssDeath": 10, "caster.clvl": 13, "caster.deepest": 7, "caster.gold": 3.2441558441558445, "caster.king": 0.8854166666666666, "caster.oracle": 0.010416666666666666, "fighter.clvl": 13, "fighter.deepest": 7, "fighter.gold": 5.1328282828282825, "fighter.king": 0.71875, "fighter.oracle": 0.010416666666666666, "gap": 0.16666666666666663, "stuck": 3}, "change": "validation: the pick (ManaPerEne 1.7, QuestGoldPerLvl 100, GoldPerLvl 2, StrDiv 45, PotionHeal 0.65) on fresh seeds 1001-1096", "why": "vs #35 paired: fighter deepest +0.57, clvl +1.06 (sure), king 0.67 -> 0.72, grotto3 0 -> 4, Oracle 1; caster deepest +0.62, clvl +1.03 (sure), king 0.79 -> 0.89, grotto3 2 -> 7, trips -2.2 (sure); gold bands 5.8/4.0 -> 5.1/3.2. 3 stuck runs of 192 make it a hard fail by the letter; traced separately", "decision": "keep", "base": "balance/runs/049-val-defaults.json", "vsBase": "+NaN (+NaN\u2026+NaN)", "best": "16.66", "bestRun": "balance/runs/047-base.json"}
{"id": 35, "time": "2026-09-30T23:24:34+02:00", "name": "051-final", "run": "balance/runs/051-final.json", "rev": "79571fb", "dirty": true, "code": "0b7d223830", "bot": "eca7852e31", "first": 1, "seeds": 96, "turns": 20000, "changed": ["StrDiv: 60 \u2192 45", "PotionHeal: 0.5 \u2192 0.65", "ManaPerEne: 1.2 \u2192 1.7", "GoldPerLvl: 3 \u2192 2", "QuestGoldPerLvl: 250 \u2192 100"], "rules": {"AffixLvlScale": 1, "ArmorCap": 0.5, "ArmorK": 50, "ArmorPerLvl": 10, "BoltCostLvl": 0.667, "BoltEnePow": 1, "BoltMul": 1, "BossHpLin": 0.22, "BudgetMul": 7, "ChampBase": 8, "ChampDmg": 1.3, "ChampHp": 2.2, "ChampPerDepth": 3, "DmgLin": 0.24, "DmgQuad": 0.02, "DropChance": 12, "GambleBonus": 1, "GamblePerDepth": 30, "GamblePrice": 120, "GoldChance": 30, "GoldPerLvl": 2, "HPPerLvl": 4, "HealCost": 0.5, "HpLin": 0.32, "HpQuad": 0.05, "ManaPerEne": 1.7, "ManaPerLvl": 2, "ManaPotion": 0.4, "MonArmorK": 120, "MonArmorPerLvl": 2, "MonToHitPerLvl": 3, "NovaMul": 1, "PackMul": 1, "PotionHeal": 0.65, "PotionPrice": 20, "PotionPricePerLvl": 4, "QuestGoldPerLvl": 100, "RareBonus": 0.2, "RerollPerDepth": 10, "RerollPrice": 50, "ScrollPrice": 40, "ScrollPricePerLvl": 6, "SellDiv": 12, "StrDiv": 45, "ToHitPerLvl": 0, "XPBase": 35, "XPExp": 1.8}, "score": 18.008336146174194, "scoreCI": [15.811084010914676, 21.752343573283827], "key": {"abyssDeath": 7, "caster.clvl": 13, "caster.deepest": 7, "caster.gold": 3.2772727272727273, "caster.king": 0.8645833333333334, "caster.oracle": 0, "fighter.clvl": 12, "fighter.deepest": 7, "fighter.gold": 5.140909090909091, "fighter.king": 0.7395833333333334, "fighter.oracle": 0, "gap": 0.125, "stuck": 0}, "change": "bot: drink only when the heal pool has room (the game refuses a drink past full life without a turn)", "why": "hp() (#4) counts one turn of drain, so at 49% life with a full pool the bot asked for a potion every call and never took a turn: 2 of the 3 stuck runs of #36. Bit-identical on seeds 1-96 (score 18.01, no seed differs)", "decision": "keep", "base": "balance/runs/048-final.json", "vsBase": "+0.00 (+0.00\u2026+0.00)", "best": "16.66", "bestRun": "balance/runs/047-base.json"}
{"id": 36, "time": "2026-09-30T23:24:34+02:00", "name": "053-val-defaults", "run": "balance/runs/053-val-defaults.json", "rev": "79571fb", "dirty": true, "code": "0b7d223830", "bot": "eca7852e31", "first": 1001, "seeds": 96, "turns": 20000, "changed": null, "rules": {"AffixLvlScale": 1, "ArmorCap": 0.5, "ArmorK": 50, "ArmorPerLvl": 10, "BoltCostLvl": 0.667, "BoltEnePow": 1, "BoltMul": 1, "BossHpLin": 0.22, "BudgetMul": 7, "ChampBase": 8, "ChampDmg": 1.3, "ChampHp": 2.2, "ChampPerDepth": 3, "DmgLin": 0.24, "DmgQuad": 0.02, "DropChance": 12, "GambleBonus": 1, "GamblePerDepth": 30, "GamblePrice": 120, "GoldChance": 30, "GoldPerLvl": 3, "HPPerLvl": 4, "HealCost": 0.5, "HpLin": 0.32, "HpQuad": 0.05, "ManaPerEne": 1.2, "ManaPerLvl": 2, "ManaPotion": 0.4, "MonArmorK": 120, "MonArmorPerLvl": 2, "MonToHitPerLvl": 3, "NovaMul": 1, "PackMul": 1, "PotionHeal": 0.5, "PotionPrice": 20, "PotionPricePerLvl": 4, "QuestGoldPerLvl": 250, "RareBonus": 0.2, "RerollPerDepth": 10, "RerollPrice": 50, "ScrollPrice": 40, "ScrollPricePerLvl": 6, "SellDiv": 12, "StrDiv": 60, "ToHitPerLvl": 0, "XPBase": 35, "XPExp": 1.8}, "score": 19.61724982937259, "scoreCI": [18.577083730805445, 22.213799884832344], "key": {"abyssDeath": 7, "caster.clvl": 13, "caster.deepest": 7, "caster.gold": 3.9863636363636363, "caster.king": 0.7916666666666666, "caster.oracle": 0, "fighter.clvl": 12, "fighter.deepest": 7, "fighter.gold": 5.813852813852814, "fighter.king": 0.6666666666666666, "fighter.oracle": 0, "gap": 0.125, "stuck": 0}, "change": "validation control: DefaultRules, final code and bot, seeds 1001-1096", "why": "the pair for #39", "decision": "baseline", "base": "balance/runs/047-base.json", "vsBase": "+NaN (+NaN\u2026+NaN)", "best": "16.66", "bestRun": "balance/runs/047-base.json"}
{"id": 37, "time": "2026-09-30T23:24:35+02:00", "name": "052-val-final", "run": "balance/runs/052-val-final.json", "rev": "79571fb", "dirty": true, "code": "0b7d223830", "bot": "eca7852e31", "first": 1001, "seeds": 96, "turns": 20000, "changed": ["StrDiv: 60 \u2192 45", "PotionHeal: 0.5 \u2192 0.65", "ManaPerEne: 1.2 \u2192 1.7", "GoldPerLvl: 3 \u2192 2", "QuestGoldPerLvl: 250 \u2192 100"], "rules": {"AffixLvlScale": 1, "ArmorCap": 0.5, "ArmorK": 50, "ArmorPerLvl": 10, "BoltCostLvl": 0.667, "BoltEnePow": 1, "BoltMul": 1, "BossHpLin": 0.22, "BudgetMul": 7, "ChampBase": 8, "ChampDmg": 1.3, "ChampHp": 2.2, "ChampPerDepth": 3, "DmgLin": 0.24, "DmgQuad": 0.02, "DropChance": 12, "GambleBonus": 1, "GamblePerDepth": 30, "GamblePrice": 120, "GoldChance": 30, "GoldPerLvl": 2, "HPPerLvl": 4, "HealCost": 0.5, "HpLin": 0.32, "HpQuad": 0.05, "ManaPerEne": 1.7, "ManaPerLvl": 2, "ManaPotion": 0.4, "MonArmorK": 120, "MonArmorPerLvl": 2, "MonToHitPerLvl": 3, "NovaMul": 1, "PackMul": 1, "PotionHeal": 0.65, "PotionPrice": 20, "PotionPricePerLvl": 4, "QuestGoldPerLvl": 100, "RareBonus": 0.2, "RerollPerDepth": 10, "RerollPrice": 50, "ScrollPrice": 40, "ScrollPricePerLvl": 6, "SellDiv": 12, "StrDiv": 45, "ToHitPerLvl": 0, "XPBase": 35, "XPExp": 1.8}, "score": 14.524929451625868, "scoreCI": [14.022985404026103, 18.10007316590054], "key": {"abyssDeath": 10, "caster.clvl": 13, "caster.deepest": 7, "caster.gold": 3.2441558441558445, "caster.king": 0.8854166666666666, "caster.oracle": 0.010416666666666666, "fighter.clvl": 13, "fighter.deepest": 7, "fighter.gold": 5.1328282828282825, "fighter.king": 0.71875, "fighter.oracle": 0.010416666666666666, "gap": 0.16666666666666663, "stuck": 2}, "change": "validation: the pick on seeds 1001-1096 with the final bot (ManaPerEne 1.7, QuestGoldPerLvl 100, GoldPerLvl 2, StrDiv 45, PotionHeal 0.65)", "why": "vs #38 paired: score 19.62 -> 14.52 (-5.09, -7.62..-1.44, sure); fighter deepest +0.57, clvl +1.06 (sure), king 0.67 -> 0.72, grotto3 0 -> 4, Oracle 1; caster deepest +0.62, clvl +1.04 (sure), king 0.79 -> 0.89, grotto3 2 -> 7, trips -2.2 (sure), surplus -199 (sure); 2 stuck of 192. The recommended configuration", "decision": "keep", "base": "balance/runs/053-val-defaults.json", "vsBase": "-5.09 (-7.62\u2026-1.44)", "best": "14.52", "bestRun": "balance/runs/052-val-final.json"}
{"id":38,"time":"2026-10-01T07:49:12+02:00","name":"055-review-fixes","run":"balance/runs/055-review-fixes.json","rev":"914022d","dirty":true,"code":"5d32e97042","bot":"6184666a49","first":1,"seeds":96,"turns":20000,"changed":null,"rules":{"AffixLvlScale":1,"ArmorCap":0.5,"ArmorK":50,"ArmorPerLvl":10,"BoltCostLvl":0.667,"BoltEnePow":1,"BoltMul":1,"BossHpLin":0.22,"BudgetMul":7,"ChampBase":8,"ChampDmg":1.3,"ChampHp":2.2,"ChampPerDepth":3,"DmgLin":0.24,"DmgQuad":0.02,"DropChance":12,"GambleBonus":1,"GamblePerDepth":30,"GamblePrice":120,"GoldChance":30,"GoldPerLvl":2,"HPPerLvl":4,"HealCost":0.5,"HpLin":0.32,"HpQuad":0.05,"ManaPerEne":1.7,"ManaPerLvl":2,"ManaPotion":0.4,"MonArmorK":120,"MonArmorPerLvl":2,"MonToHitPerLvl":3,"NovaMul":1,"PackMul":1,"PotionHeal":0.65,"PotionPrice":20,"PotionPricePerLvl":4,"QuestGoldPerLvl":100,"RareBonus":0.2,"RerollPerDepth":10,"RerollPrice":50,"ScrollPrice":40,"ScrollPricePerLvl":6,"SellDiv":12,"StrDiv":45,"ToHitPerLvl":0,"XPBase":35,"XPExp":1.8},"score":18.015969414571245,"scoreCI":[15.817966007581695,21.71298466556189],"key":{"abyssDeath":7,"caster.clvl":13,"caster.deepest":7,"caster.gold":3.2772727272727273,"caster.king":0.875,"caster.oracle":0,"fighter.clvl":12,"fighter.deepest":7,"fighter.gold":5.140909090909091,"fighter.king":0.7395833333333334,"fighter.oracle":0,"gap":0.13541666666666663,"stuck":0},"change":"code review follow-ups: Level.Spent dropped (dead: neighbours are always seen; its only effect was the bot's permanent 'no way there' mark), frontier skips go in b.skip (cleared when more is seen), descend() resets the stall clock only on a known path, hurtPlayer ignores blows after death, hp() shares drainStep, retreat() dead clause gone","why":"seeds 1-96 vs #39's base: 1-3 seeds differ per build, score 18.01 -\u003e 18.02 (-0.13..+0.41); 0 stuck","decision":"keep","base":"balance/runs/051-final.json","vsBase":"+0.01 (-0.13…+0.41)","best":"14.52","bestRun":"balance/runs/052-val-final.json"}
{"id":39,"time":"2026-10-01T07:49:13+02:00","name":"056-review-fixes-val","run":"balance/runs/056-review-fixes-val.json","rev":"914022d","dirty":true,"code":"5d32e97042","bot":"6184666a49","first":1001,"seeds":96,"turns":20000,"changed":null,"rules":{"AffixLvlScale":1,"ArmorCap":0.5,"ArmorK":50,"ArmorPerLvl":10,"BoltCostLvl":0.667,"BoltEnePow":1,"BoltMul":1,"BossHpLin":0.22,"BudgetMul":7,"ChampBase":8,"ChampDmg":1.3,"ChampHp":2.2,"ChampPerDepth":3,"DmgLin":0.24,"DmgQuad":0.02,"DropChance":12,"GambleBonus":1,"GamblePerDepth":30,"GamblePrice":120,"GoldChance":30,"GoldPerLvl":2,"HPPerLvl":4,"HealCost":0.5,"HpLin":0.32,"HpQuad":0.05,"ManaPerEne":1.7,"ManaPerLvl":2,"ManaPotion":0.4,"MonArmorK":120,"MonArmorPerLvl":2,"MonToHitPerLvl":3,"NovaMul":1,"PackMul":1,"PotionHeal":0.65,"PotionPrice":20,"PotionPricePerLvl":4,"QuestGoldPerLvl":100,"RareBonus":0.2,"RerollPerDepth":10,"RerollPrice":50,"ScrollPrice":40,"ScrollPricePerLvl":6,"SellDiv":12,"StrDiv":45,"ToHitPerLvl":0,"XPBase":35,"XPExp":1.8},"score":14.807184715571267,"scoreCI":[14.1576504459721,18.453921232124664],"key":{"abyssDeath":10,"caster.clvl":13,"caster.deepest":7,"caster.gold":3.2565656565656567,"caster.king":0.90625,"caster.oracle":0.010416666666666666,"fighter.clvl":13,"fighter.deepest":7,"fighter.gold":5.1328282828282825,"fighter.king":0.71875,"fighter.oracle":0.010416666666666666,"gap":0.1875,"stuck":0},"change":"same fixes on seeds 1001-1096","why":"vs #40 paired: score 14.52 -\u003e 14.81 (-0.25..+0.88), the two runs that were stuck (fighter 1051, caster 1060) now die instead; 0 stuck of 192: the residual ~1% stuck class was the permanent frontier mark","decision":"keep","base":"balance/runs/052-val-final.json","vsBase":"+0.28 (-0.25…+0.88)","best":"14.52","bestRun":"balance/runs/052-val-final.json"}
{"id":40,"time":"2026-10-01T09:54:47+02:00","name":"057-baseline","run":"balance/runs/057-baseline.json","rev":"db71fc7","dirty":false,"code":"5d32e97042","bot":"6184666a49","first":1,"seeds":96,"turns":20000,"changed":null,"rules":{"AffixLvlScale":1,"ArmorCap":0.5,"ArmorK":50,"ArmorPerLvl":10,"BoltCostLvl":0.667,"BoltEnePow":1,"BoltMul":1,"BossHpLin":0.22,"BudgetMul":7,"ChampBase":8,"ChampDmg":1.3,"ChampHp":2.2,"ChampPerDepth":3,"DmgLin":0.24,"DmgQuad":0.02,"DropChance":12,"GambleBonus":1,"GamblePerDepth":30,"GamblePrice":120,"GoldChance":30,"GoldPerLvl":2,"HPPerLvl":4,"HealCost":0.5,"HpLin":0.32,"HpQuad":0.05,"ManaPerEne":1.7,"ManaPerLvl":2,"ManaPotion":0.4,"MonArmorK":120,"MonArmorPerLvl":2,"MonToHitPerLvl":3,"NovaMul":1,"PackMul":1,"PotionHeal":0.65,"PotionPrice":20,"PotionPricePerLvl":4,"QuestGoldPerLvl":100,"RareBonus":0.2,"RerollPerDepth":10,"RerollPrice":50,"ScrollPrice":40,"ScrollPricePerLvl":6,"SellDiv":12,"StrDiv":45,"ToHitPerLvl":0,"XPBase":35,"XPExp":1.8},"score":18.015969414571245,"scoreCI":[15.817966007581695,21.71298466556189],"key":{"abyssDeath":7,"caster.clvl":13,"caster.deepest":7,"caster.gold":3.2772727272727273,"caster.king":0.875,"caster.oracle":0,"fighter.clvl":12,"fighter.deepest":7,"fighter.gold":5.140909090909091,"fighter.king":0.7395833333333334,"fighter.oracle":0,"gap":0.13541666666666663,"stuck":0},"change":"none: defaults at db71fc7 (the 2026-09-30 pick applied)","why":"starting point of the 2026-10-01 pass; bit-identical to #38 (055)","decision":"baseline","base":"balance/runs/052-val-final.json","vsBase":"+NaN (+NaN…+NaN)","best":"14.52","bestRun":"balance/runs/052-val-final.json"}
{"id":41,"time":"2026-10-01T10:07:17+02:00","name":"058-bot-exit","run":"balance/runs/058-bot-exit.json","rev":"db71fc7","dirty":true,"code":"1dfc761f41","bot":"7f64bf4a0c","first":1,"seeds":96,"turns":20000,"changed":null,"rules":{"AffixLvlScale":1,"ArmorCap":0.5,"ArmorK":50,"ArmorPerLvl":10,"BoltCostLvl":0.667,"BoltEnePow":1,"BoltMul":1,"BossHpLin":0.22,"BudgetMul":7,"ChampBase":8,"ChampDmg":1.3,"ChampHp":2.2,"ChampPerDepth":3,"DmgLin":0.24,"DmgQuad":0.02,"DropChance":12,"GambleBonus":1,"GamblePerDepth":30,"GamblePrice":120,"GoldChance":30,"GoldPerLvl":2,"HPPerLvl":4,"HealCost":0.5,"HpLin":0.32,"HpQuad":0.05,"ManaPerEne":1.7,"ManaPerLvl":2,"ManaPotion":0.4,"MonArmorK":120,"MonArmorPerLvl":2,"MonToHitPerLvl":3,"NovaMul":1,"PackMul":1,"PotionHeal":0.65,"PotionPrice":20,"PotionPricePerLvl":4,"QuestGoldPerLvl":100,"RareBonus":0.2,"RerollPerDepth":10,"RerollPrice":50,"ScrollPrice":40,"ScrollPricePerLvl":6,"SellDiv":12,"StrDiv":45,"ToHitPerLvl":0,"XPBase":35,"XPExp":1.8},"score":null,"scoreCI":[0,0],"fail":"4 stuck runs","key":{"abyssDeath":10,"caster.clvl":13,"caster.deepest":7,"caster.gold":2.7113636363636364,"caster.king":0.8020833333333334,"caster.oracle":0.03125,"fighter.clvl":12,"fighter.deepest":6,"fighter.gold":4.506565656565657,"fighter.king":0.6145833333333334,"fighter.oracle":0,"gap":0.1875,"stuck":4},"change":"bot: pre-emptive portal at belt\u003c=3 (or caster mana pots\u003c=1) once 2 are adjacent, fight beside it; nook retreat dropped","why":"traces of three grotto deaths: the bot had backed into a 3-sided nook, 3 attackers filled it, the belt emptied and the portal read landed beyond them (adj 3 is the modal death of both builds). The pre-emptive read fires from the first fight (start kit: 3 potions, 1 scroll) and drains scrolls and gold: fighter king 0.74 -\u003e 0.61 (15 up/27 down), surplus/lvl -151/-146 (sure), 4 stuck; caster grotto3 2 -\u003e 9 shows the exit itself works","decision":"revert","base":"balance/runs/057-baseline.json","vsBase":"+NaN (+NaN…+NaN)","best":"14.52","bestRun":"balance/runs/052-val-final.json"}
