{"id":53,"time":"2026-10-01T10:22:38+02:00","name":"071-reserve2","run":"balance/runs/071-reserve2.json","rev":"db71fc7","dirty":true,"code":"cc50dd0d01","bot":"44e8f24ab7","first":1,"seeds":96,"turns":20000,"changed":null,"rules":{"AffixLvlScale":1,"ArmorCap":0.5,"ArmorK":50,"ArmorPerLvl":10,"BoltCostLvl":0.667,"BoltEnePow":1,"BoltMul":1,"BossHpLin":0.22,"BudgetMul":7,"ChampBase":8,"ChampDmg":1.3,"ChampHp":2.2,"ChampPerDepth":3,"DmgLin":0.24,"DmgQuad":0.02,"DropChance":12,"GambleBonus":1,"GamblePerDepth":30,"GamblePrice":120,"GoldChance":30,"GoldPerLvl":2,"HPPerLvl":4,"HealCost":0.5,"HpLin":0.32,"HpQuad":0.05,"ManaPerEne":1.7,"ManaPerLvl":2,"ManaPotion":0.4,"MonArmorK":120,"MonArmorPerLvl":2,"MonToHitPerLvl":3,"NovaMul":1,"PackMul":1,"PotionHeal":0.65,"PotionPrice":20,"PotionPricePerLvl":4,"QuestGoldPerLvl":100,"RareBonus":0.2,"RerollPerDepth":10,"RerollPrice":50,"ScrollPrice":40,"ScrollPricePerLvl":6,"SellDiv":12,"StrDiv":45,"ToHitPerLvl":0,"XPBase":35,"XPExp":1.8},"score":13.194424809075764,"scoreCI":[12.583452843082831,15.23882748419267],"key":{"abyssDeath":10,"caster.clvl":14,"caster.deepest":7,"caster.gold":2.7896103896103894,"caster.king":0.9270833333333334,"caster.oracle":0.0625,"fighter.clvl":13,"fighter.deepest":7,"fighter.gold":4.705555555555556,"fighter.king":0.78125,"fighter.oracle":0.010416666666666666,"gap":0.14583333333333337,"stuck":0},"change":"bot: reserve() keeps this trip's refill and the next one's (belt, 2 scrolls, mana) before buying gear or gambling","why":"trace of fighter seed 1 at grotto1: 3-5 kills a belt, a 330g gamble and a 120g reroll every trip, at 2g after five trips, restocked '0 healing, 0 mana, 0 scrolls' and died. Paired: score 13.32 -\u003e 13.19 (noise), broke deaths (0 scrolls, \u003c150g) 35 -\u003e 25 fighter, 51 -\u003e 35 caster; gear on arrival unchanged (grotto1 472 -\u003e 476 / 508 -\u003e 491), caster surplus/lvl -135 (sure) and gold band 3.08 -\u003e 2.79; equips/lvl -0.25 for the caster (taste). Kept as the player model: one who keeps dying broke keeps a reserve","decision":"keep","base":"balance/runs/061-escape-near.json","vsBase":"-0.13 (-2.72…+1.63)","best":"13.19","bestRun":"balance/runs/071-reserve2.json"}
{"id":54,"time":"2026-10-01T10:26:22+02:00","name":"073-wake10","run":"balance/runs/073-wake10.json","rev":"db71fc7","dirty":true,"code":"22ba7a8ac3","bot":"44e8f24ab7","first":1,"seeds":96,"turns":20000,"changed":["WakeRange: 16 → 10"],"rules":{"AffixLvlScale":1,"ArmorCap":0.5,"ArmorK":50,"ArmorPerLvl":10,"BoltCostLvl":0.667,"BoltEnePow":1,"BoltMul":1,"BossHpLin":0.22,"BudgetMul":7,"ChampBase":8,"ChampDmg":1.3,"ChampHp":2.2,"ChampPerDepth":3,"DmgLin":0.24,"DmgQuad":0.02,"DropChance":12,"GambleBonus":1,"GamblePerDepth":30,"GamblePrice":120,"GoldChance":30,"GoldPerLvl":2,"HPPerLvl":4,"HealCost":0.5,"HpLin":0.32,"HpQuad":0.05,"ManaPerEne":1.7,"ManaPerLvl":2,"ManaPotion":0.4,"MonArmorK":120,"MonArmorPerLvl":2,"MonToHitPerLvl":3,"NovaMul":1,"PackMul":1,"PotionHeal":0.65,"PotionPrice":20,"PotionPricePerLvl":4,"QuestGoldPerLvl":100,"RareBonus":0.2,"RerollPerDepth":10,"RerollPrice":50,"ScrollPrice":40,"ScrollPricePerLvl":6,"SellDiv":12,"StrDiv":45,"ToHitPerLvl":0,"WakeRange":10,"XPBase":35,"XPExp":1.8},"score":13.825384726393535,"scoreCI":[13.17842536404429,14.758092780401075],"key":{"abyssDeath":10,"caster.clvl":14,"caster.deepest":8,"caster.gold":2.7813131313131314,"caster.king":0.96875,"caster.oracle":0.0625,"fighter.clvl":13,"fighter.deepest":7,"fighter.gold":5.260606060606061,"fighter.king":0.8854166666666666,"fighter.oracle":0.020833333333333332,"gap":0.08333333333333337,"stuck":0},"change":"rules: WakeRange 16 -\u003e 10 (new knob: a monster with the hero in view this close wakes, and wakes its neighbours within 6; was a hard 16 in monsterTurn)","why":"deaths in the grotto came with 10-40 awake: in an open cave every pack within 16 cells and a line of sight joined the fight. Paired at 96 seeds: fighter deepest +0.73, clvl +1.09, kills +32, trips +1.7 (all sure), king 0.78 -\u003e 0.89; caster deepest +0.35, clvl +0.60, king 0.97; grotto3 arrivals 4 -\u003e 12 and 10 -\u003e 24, abyss 2/6; oracle 0.01/0.06 -\u003e 0.02/0.06. Score 13.19 -\u003e 13.83 (noise): the progress lands on the king band's ceiling (0.85) and fighter.gold 4.71 -\u003e 5.26 as income rises with depth. Kept as the pick for the grotto wall, against the letter of the keep rule on the gold band; validated on fresh seeds in #52-#53","decision":"keep","base":"balance/runs/071-reserve2.json","vsBase":"+0.63 (-1.67…+1.55)","best":"13.19","bestRun":"balance/runs/071-reserve2.json"}
{"id":55,"time":"2026-10-01T10:26:23+02:00","name":"074-wake12","run":"balance/runs/074-wake12.json","rev":"db71fc7","dirty":true,"code":"22ba7a8ac3","bot":"44e8f24ab7","first":1,"seeds":96,"turns":20000,"changed":["WakeRange: 16 → 12"],"rules":{"AffixLvlScale":1,"ArmorCap":0.5,"ArmorK":50,"ArmorPerLvl":10,"BoltCostLvl":0.667,"BoltEnePow":1,"BoltMul":1,"BossHpLin":0.22,"BudgetMul":7,"ChampBase":8,"ChampDmg":1.3,"ChampHp":2.2,"ChampPerDepth":3,"DmgLin":0.24,"DmgQuad":0.02,"DropChance":12,"GambleBonus":1,"GamblePerDepth":30,"GamblePrice":120,"GoldChance":30,"GoldPerLvl":2,"HPPerLvl":4,"HealCost":0.5,"HpLin":0.32,"HpQuad":0.05,"ManaPerEne":1.7,"ManaPerLvl":2,"ManaPotion":0.4,"MonArmorK":120,"MonArmorPerLvl":2,"MonToHitPerLvl":3,"NovaMul":1,"PackMul":1,"PotionHeal":0.65,"PotionPrice":20,"PotionPricePerLvl":4,"QuestGoldPerLvl":100,"RareBonus":0.2,"RerollPerDepth":10,"RerollPrice":50,"ScrollPrice":40,"ScrollPricePerLvl":6,"SellDiv":12,"StrDiv":45,"ToHitPerLvl":0,"WakeRange":12,"XPBase":35,"XPExp":1.8},"score":13.642351886278343,"scoreCI":[13.166655278636739,14.529653245542322],"key":{"abyssDeath":10,"caster.clvl":14,"caster.deepest":7,"caster.gold":2.9414141414141413,"caster.king":0.9895833333333334,"caster.oracle":0.052083333333333336,"fighter.clvl":14,"fighter.deepest":7,"fighter.gold":4.87020202020202,"fighter.king":0.8645833333333334,"fighter.oracle":0.020833333333333332,"gap":0.125,"stuck":0},"change":"rules: WakeRange 16 -\u003e 12","why":"half the effect of 10: fighter deepest +0.46 (sure), clvl +0.66, king 0.86; caster king 0.99 (sure), oracle 0.05; score 13.64 (noise). 10 moves more for the same cost","decision":"revert","base":"balance/runs/071-reserve2.json","vsBase":"+0.45 (-1.69…+1.43)","best":"13.19","bestRun":"balance/runs/071-reserve2.json"}
{"id":56,"time":"2026-10-01T10:26:23+02:00","name":"075-wake8","run":"balance/runs/075-wake8.json","rev":"db71fc7","dirty":true,"code":"22ba7a8ac3","bot":"44e8f24ab7","first":1,"seeds":96,"turns":20000,"changed":["WakeRange: 16 → 8"],"rules":{"AffixLvlScale":1,"ArmorCap":0.5,"ArmorK":50,"ArmorPerLvl":10,"BoltCostLvl":0.667,"BoltEnePow":1,"BoltMul":1,"BossHpLin":0.22,"BudgetMul":7,"ChampBase":8,"ChampDmg":1.3,"ChampHp":2.2,"ChampPerDepth":3,"DmgLin":0.24,"DmgQuad":0.02,"DropChance":12,"GambleBonus":1,"GamblePerDepth":30,"GamblePrice":120,"GoldChance":30,"GoldPerLvl":2,"HPPerLvl":4,"HealCost":0.5,"HpLin":0.32,"HpQuad":0.05,"ManaPerEne":1.7,"ManaPerLvl":2,"ManaPotion":0.4,"MonArmorK":120,"MonArmorPerLvl":2,"MonToHitPerLvl":3,"NovaMul":1,"PackMul":1,"PotionHeal":0.65,"PotionPrice":20,"PotionPricePerLvl":4,"QuestGoldPerLvl":100,"RareBonus":0.2,"RerollPerDepth":10,"RerollPrice":50,"ScrollPrice":40,"ScrollPricePerLvl":6,"SellDiv":12,"StrDiv":45,"ToHitPerLvl":0,"WakeRange":8,"XPBase":35,"XPExp":1.8},"score":13.29988993407531,"scoreCI":[12.607116546411536,14.220398795681998],"key":{"abyssDeath":10,"caster.clvl":14,"caster.deepest":7,"caster.gold":3.1474747474747478,"caster.king":0.9583333333333334,"caster.oracle":0.10416666666666667,"fighter.clvl":13,"fighter.deepest":7,"fighter.gold":5.113636363636363,"fighter.king":0.8854166666666666,"fighter.oracle":0.020833333333333332,"gap":0.08333333333333334,"stuck":2},"change":"rules: WakeRange 16 -\u003e 8 (the knob's floor)","why":"same as 10 within noise: fighter deepest +0.60, clvl +0.98 (sure), king 0.89; caster oracle 0.06 -\u003e 0.10 (9 up/5 down), king 0.96; score 13.30. No more than 10 buys, and 8 is a cell past the torch; 10 stays","decision":"revert","base":"balance/runs/071-reserve2.json","vsBase":"+0.11 (-2.03…+1.06)","best":"13.19","bestRun":"balance/runs/071-reserve2.json"}
{"id":57,"time":"2026-10-01T10:29:34+02:00","name":"076-wake10-champ","run":"balance/runs/076-wake10-champ.json","rev":"db71fc7","dirty":true,"code":"22ba7a8ac3","bot":"44e8f24ab7","first":1,"seeds":96,"turns":20000,"changed":["ChampHp: 2.2 → 1.8","WakeRange: 16 → 10"],"rules":{"AffixLvlScale":1,"ArmorCap":0.5,"ArmorK":50,"ArmorPerLvl":10,"BoltCostLvl":0.667,"BoltEnePow":1,"BoltMul":1,"BossHpLin":0.22,"BudgetMul":7,"ChampBase":8,"ChampDmg":1.3,"ChampHp":1.8,"ChampPerDepth":3,"DmgLin":0.24,"DmgQuad":0.02,"DropChance":12,"GambleBonus":1,"GamblePerDepth":30,"GamblePrice":120,"GoldChance":30,"GoldPerLvl":2,"HPPerLvl":4,"HealCost":0.5,"HpLin":0.32,"HpQuad":0.05,"ManaPerEne":1.7,"ManaPerLvl":2,"ManaPotion":0.4,"MonArmorK":120,"MonArmorPerLvl":2,"MonToHitPerLvl":3,"NovaMul":1,"PackMul":1,"PotionHeal":0.65,"PotionPrice":20,"PotionPricePerLvl":4,"QuestGoldPerLvl":100,"RareBonus":0.2,"RerollPerDepth":10,"RerollPrice":50,"ScrollPrice":40,"ScrollPricePerLvl":6,"SellDiv":12,"StrDiv":45,"ToHitPerLvl":0,"WakeRange":10,"XPBase":35,"XPExp":1.8},"score":null,"scoreCI":[0,0],"fail":"3 stuck runs","key":{"abyssDeath":10,"caster.clvl":14,"caster.deepest":8,"caster.gold":3.4318181818181817,"caster.king":0.9270833333333334,"caster.oracle":0.125,"fighter.clvl":14,"fighter.deepest":7,"fighter.gold":5.285714285714286,"fighter.king":0.875,"fighter.oracle":0.03125,"gap":0.09375,"stuck":3},"change":"rules: WakeRange 10 + ChampHp 1.8","why":"on top of WakeRange 10 the weaker champions add nothing for the fighter (deepest 7.23 -\u003e 7.23, king 0.89 -\u003e 0.88); caster oracle 0.06 -\u003e 0.12 (10 up/4 down), surplus +156 (sure); 3 stuck runs make it a hard fail (fighter 30 crypt1, 34 crypt4, caster 64 crypt2): traced as a bot class","decision":"revert","base":"balance/runs/073-wake10.json","vsBase":"+NaN (+NaN…+NaN)","best":"13.19","bestRun":"balance/runs/071-reserve2.json"}
{"id":58,"time":"2026-10-01T10:29:35+02:00","name":"079-val-oldbot","run":"balance/runs/079-val-oldbot.json","rev":"db71fc7","dirty":false,"code":"5d32e97042","bot":"6184666a49","first":2001,"seeds":96,"turns":20000,"changed":null,"rules":{"AffixLvlScale":1,"ArmorCap":0.5,"ArmorK":50,"ArmorPerLvl":10,"BoltCostLvl":0.667,"BoltEnePow":1,"BoltMul":1,"BossHpLin":0.22,"BudgetMul":7,"ChampBase":8,"ChampDmg":1.3,"ChampHp":2.2,"ChampPerDepth":3,"DmgLin":0.24,"DmgQuad":0.02,"DropChance":12,"GambleBonus":1,"GamblePerDepth":30,"GamblePrice":120,"GoldChance":30,"GoldPerLvl":2,"HPPerLvl":4,"HealCost":0.5,"HpLin":0.32,"HpQuad":0.05,"ManaPerEne":1.7,"ManaPerLvl":2,"ManaPotion":0.4,"MonArmorK":120,"MonArmorPerLvl":2,"MonToHitPerLvl":3,"NovaMul":1,"PackMul":1,"PotionHeal":0.65,"PotionPrice":20,"PotionPricePerLvl":4,"QuestGoldPerLvl":100,"RareBonus":0.2,"RerollPerDepth":10,"RerollPrice":50,"ScrollPrice":40,"ScrollPricePerLvl":6,"SellDiv":12,"StrDiv":45,"ToHitPerLvl":0,"XPBase":35,"XPExp":1.8},"score":16.079100905606918,"scoreCI":[14.588405783045284,18.86098255304166],"key":{"abyssDeath":7,"caster.clvl":13,"caster.deepest":7,"caster.gold":3.2323232323232327,"caster.king":0.8125,"caster.oracle":0,"fighter.clvl":13,"fighter.deepest":7,"fighter.gold":4.817676767676767,"fighter.king":0.65625,"fighter.oracle":0,"gap":0.15625,"stuck":1},"change":"validation control: the committed bot and code at db71fc7, defaults, fresh seeds 2001-2096","why":"the pair for #51: what the 2026-09-30 pick does on seeds no decision has touched","decision":"baseline","base":"balance/runs/071-reserve2.json","vsBase":"+NaN (+NaN…+NaN)","best":"13.19","bestRun":"balance/runs/071-reserve2.json"}
{"id":59,"time":"2026-10-01T10:29:35+02:00","name":"077-val-control","run":"balance/runs/077-val-control.json","rev":"db71fc7","dirty":true,"code":"22ba7a8ac3","bot":"44e8f24ab7","first":2001,"seeds":96,"turns":20000,"changed":null,"rules":{"AffixLvlScale":1,"ArmorCap":0.5,"ArmorK":50,"ArmorPerLvl":10,"BoltCostLvl":0.667,"BoltEnePow":1,"BoltMul":1,"BossHpLin":0.22,"BudgetMul":7,"ChampBase":8,"ChampDmg":1.3,"ChampHp":2.2,"ChampPerDepth":3,"DmgLin":0.24,"DmgQuad":0.02,"DropChance":12,"GambleBonus":1,"GamblePerDepth":30,"GamblePrice":120,"GoldChance":30,"GoldPerLvl":2,"HPPerLvl":4,"HealCost":0.5,"HpLin":0.32,"HpQuad":0.05,"ManaPerEne":1.7,"ManaPerLvl":2,"ManaPotion":0.4,"MonArmorK":120,"MonArmorPerLvl":2,"MonToHitPerLvl":3,"NovaMul":1,"PackMul":1,"PotionHeal":0.65,"PotionPrice":20,"PotionPricePerLvl":4,"QuestGoldPerLvl":100,"RareBonus":0.2,"RerollPerDepth":10,"RerollPrice":50,"ScrollPrice":40,"ScrollPricePerLvl":6,"SellDiv":12,"StrDiv":45,"ToHitPerLvl":0,"WakeRange":16,"XPBase":35,"XPExp":1.8},"score":13.580988691855044,"scoreCI":[13.036565078788389,15.195562854204901],"key":{"abyssDeath":10,"caster.clvl":14,"caster.deepest":7,"caster.gold":2.8549242424242425,"caster.king":0.9270833333333334,"caster.oracle":0.03125,"fighter.clvl":13,"fighter.deepest":7,"fighter.gold":4.600505050505051,"fighter.king":0.8229166666666666,"fighter.oracle":0,"gap":0.10416666666666674,"stuck":1},"change":"validation: this pass's bot and code (corridor-only retreat, portal nearest the hero, escape by fresh scroll, two-refill reserve, WakeRange knob at 16), defaults, seeds 2001-2096","why":"vs #50 paired: score 16.08 -\u003e 13.58 (-2.50, -5.52..-0.34, sure); fighter deepest +0.66, clvl +1.02, kills +33, king 0.66 -\u003e 0.82, trips +2.5 (all sure); caster deepest +0.76, clvl +1.27, king 0.81 -\u003e 0.93 (sure), oracle 0 -\u003e 0.03; gap 0.16 -\u003e 0.10; grotto3 arrivals 2/9 -\u003e 5/17, abyss 0/0 -\u003e 0/3; 1 stuck of 192 (caster 2044 grotto1, traced). The bot fixes hold on fresh seeds","decision":"keep","base":"balance/runs/079-val-oldbot.json","vsBase":"-2.50 (-5.52…-0.34)","best":"13.19","bestRun":"balance/runs/071-reserve2.json"}
{"id":60,"time":"2026-10-01T10:29:36+02:00","name":"078-val-wake10","run":"balance/runs/078-val-wake10.json","rev":"db71fc7","dirty":true,"code":"22ba7a8ac3","bot":"44e8f24ab7","first":2001,"seeds":96,"turns":20000,"changed":["WakeRange: 16 → 10"],"rules":{"AffixLvlScale":1,"ArmorCap":0.5,"ArmorK":50,"ArmorPerLvl":10,"BoltCostLvl":0.667,"BoltEnePow":1,"BoltMul":1,"BossHpLin":0.22,"BudgetMul":7,"ChampBase":8,"ChampDmg":1.3,"ChampHp":2.2,"ChampPerDepth":3,"DmgLin":0.24,"DmgQuad":0.02,"DropChance":12,"GambleBonus":1,"GamblePerDepth":30,"GamblePrice":120,"GoldChance":30,"GoldPerLvl":2,"HPPerLvl":4,"HealCost":0.5,"HpLin":0.32,"HpQuad":0.05,"ManaPerEne":1.7,"ManaPerLvl":2,"ManaPotion":0.4,"MonArmorK":120,"MonArmorPerLvl":2,"MonToHitPerLvl":3,"NovaMul":1,"PackMul":1,"PotionHeal":0.65,"PotionPrice":20,"PotionPricePerLvl":4,"QuestGoldPerLvl":100,"RareBonus":0.2,"RerollPerDepth":10,"RerollPrice":50,"ScrollPrice":40,"ScrollPricePerLvl":6,"SellDiv":12,"StrDiv":45,"ToHitPerLvl":0,"WakeRange":10,"XPBase":35,"XPExp":1.8},"score":13.463749769559108,"scoreCI":[12.836863133723824,14.501682765377502],"key":{"abyssDeath":10,"caster.clvl":14,"caster.deepest":8,"caster.gold":2.804924242424242,"caster.king":0.9895833333333334,"caster.oracle":0.052083333333333336,"fighter.clvl":13,"fighter.deepest":7,"fighter.gold":4.9818181818181815,"fighter.king":0.8541666666666666,"fighter.oracle":0.03125,"gap":0.13541666666666674,"stuck":0},"change":"validation: WakeRange 10 on seeds 2001-2096 with this pass's bot","why":"vs #51 paired: score 13.58 -\u003e 13.46 (noise); fighter deepest +0.35 (37 up/21 down), clvl +0.67, king 0.82 -\u003e 0.85, oracle 0 -\u003e 0.03; caster deepest +0.35 (sure), clvl +0.52, king 0.93 -\u003e 0.99 (sure, over the band), oracle 0.03 -\u003e 0.05; grotto3 arrivals 5/17 -\u003e 9/23, abyss 0/3 -\u003e 3/5; goldIn +1697/+1345 (sure), fighter.gold 4.60 -\u003e 4.98; 0 stuck. Holds in direction, smaller than on seeds 1-96; the king and gold bands take what the grotto gives back. Recommended with that caveat: it is a design choice (monsters notice the hero at 10 cells, not 16)","decision":"keep","base":"balance/runs/077-val-control.json","vsBase":"-0.12 (-1.63…+1.02)","best":"13.19","bestRun":"balance/runs/071-reserve2.json"}
{"id":61,"time":"2026-10-01T10:46:26+02:00","name":"080-sleeper-pass","run":"balance/runs/080-sleeper-pass.json","rev":"db71fc7","dirty":true,"code":"b28097eb10","bot":"e849de623e","first":1,"seeds":96,"turns":20000,"changed":null,"rules":{"AffixLvlScale":1,"ArmorCap":0.5,"ArmorK":50,"ArmorPerLvl":10,"BoltCostLvl":0.667,"BoltEnePow":1,"BoltMul":1,"BossHpLin":0.22,"BudgetMul":7,"ChampBase":8,"ChampDmg":1.3,"ChampHp":2.2,"ChampPerDepth":3,"DmgLin":0.24,"DmgQuad":0.02,"DropChance":12,"GambleBonus":1,"GamblePerDepth":30,"GamblePrice":120,"GoldChance":30,"GoldPerLvl":2,"HPPerLvl":4,"HealCost":0.5,"HpLin":0.32,"HpQuad":0.05,"ManaPerEne":1.7,"ManaPerLvl":2,"ManaPotion":0.4,"MonArmorK":120,"MonArmorPerLvl":2,"MonToHitPerLvl":3,"NovaMul":1,"PackMul":1,"PotionHeal":0.65,"PotionPrice":20,"PotionPricePerLvl":4,"QuestGoldPerLvl":100,"RareBonus":0.2,"RerollPerDepth":10,"RerollPrice":50,"ScrollPrice":40,"ScrollPricePerLvl":6,"SellDiv":12,"StrDiv":45,"ToHitPerLvl":0,"WakeRange":16,"XPBase":35,"XPExp":1.8},"score":12.868802968101612,"scoreCI":[12.513392188844971,16.02782638075867],"key":{"abyssDeath":10,"caster.clvl":13,"caster.deepest":7,"caster.gold":2.531601731601732,"caster.king":0.8958333333333334,"caster.oracle":0.010416666666666666,"fighter.clvl":13,"fighter.deepest":7,"fighter.gold":4.594444444444445,"fighter.king":0.84375,"fighter.oracle":0.010416666666666666,"gap":0.05208333333333337,"stuck":0},"change":"bot: a visible sleeping monster no longer blocks a path (walking into it is attacking it); prey lost from sight ignored 40 turns; an ignored monster adjacent is a threat","why":"fighter 30 (076 rules) wobbled between two corridor cells: a sleeping zombie 13 cells off showed from one cell only, and pass() treats a visible monster as a wall, so the frontier route flipped between west and an eastward detour. First version routed through sleeping NPCs in town (103 stuck); fixed. Then 0 stuck, score 12.87 (noise), fighter flat, but caster deepest -0.43 (24 up/34 down), oracle 0.06 -\u003e 0.01: routing through sleeping packs makes the caster engage what it used to walk around","decision":"revert","base":"balance/runs/071-reserve2.json","vsBase":"-0.33 (-2.05…+2.77)","best":"13.19","bestRun":"balance/runs/071-reserve2.json"}
{"id":62,"time":"2026-10-01T10:46:27+02:00","name":"081-sleeper-memory","run":"balance/runs/081-sleeper-memory.json","rev":"db71fc7","dirty":true,"code":"2ab7ebb31d","bot":"04b02aed3e","first":1,"seeds":96,"turns":20000,"changed":null,"rules":{"AffixLvlScale":1,"ArmorCap":0.5,"ArmorK":50,"ArmorPerLvl":10,"BoltCostLvl":0.667,"BoltEnePow":1,"BoltMul":1,"BossHpLin":0.22,"BudgetMul":7,"ChampBase":8,"ChampDmg":1.3,"ChampHp":2.2,"ChampPerDepth":3,"DmgLin":0.24,"DmgQuad":0.02,"DropChance":12,"GambleBonus":1,"GamblePerDepth":30,"GamblePrice":120,"GoldChance":30,"GoldPerLvl":2,"HPPerLvl":4,"HealCost":0.5,"HpLin":0.32,"HpQuad":0.05,"ManaPerEne":1.7,"ManaPerLvl":2,"ManaPotion":0.4,"MonArmorK":120,"MonArmorPerLvl":2,"MonToHitPerLvl":3,"NovaMul":1,"PackMul":1,"PotionHeal":0.65,"PotionPrice":20,"PotionPricePerLvl":4,"QuestGoldPerLvl":100,"RareBonus":0.2,"RerollPerDepth":10,"RerollPrice":50,"ScrollPrice":40,"ScrollPricePerLvl":6,"SellDiv":12,"StrDiv":45,"ToHitPerLvl":0,"WakeRange":16,"XPBase":35,"XPExp":1.8},"score":12.462981228475591,"scoreCI":[12.071935434590996,14.993222954317384],"key":{"abyssDeath":10,"caster.clvl":14,"caster.deepest":7,"caster.gold":2.531601731601732,"caster.king":0.8854166666666666,"caster.oracle":0.041666666666666664,"fighter.clvl":13,"fighter.deepest":7,"fighter.gold":4.594444444444445,"fighter.king":0.8125,"fighter.oracle":0.010416666666666666,"gap":0.07291666666666663,"stuck":1},"change":"bot: sleepers remembered where they lie and routed around from any cell (remember/known), plus the lost-prey ignore of #080","why":"caster deepest -0.42, clvl -0.65 again with the sleeper memory in place of the route-through: the caster's loss in #080 was the lost-prey ignore (it kites, so targets drop out of sight every other turn); 1 stuck","decision":"revert","base":"balance/runs/071-reserve2.json","vsBase":"-0.73 (-2.43…+2.13)","best":"13.19","bestRun":"balance/runs/071-reserve2.json"}
