{"id":96,"time":"2026-10-10T16:32:00+02:00","name":"121-cover","run":"balance/runs/121-cover.json","rev":"07dcbcc","dirty":true,"code":"2c2b9667dc","bot":"da648a5c00","first":1,"seeds":96,"turns":20000,"changed":null,"rules":{"AffixLvlScale":1,"ArmorCap":0.5,"ArmorK":50,"ArmorPerLvl":10,"BoltCostLvl":0.667,"BoltEnePow":1,"BoltMul":1,"BossHpLin":0.22,"BudgetMul":7,"ChampBase":8,"ChampDmg":1.3,"ChampHp":2.2,"ChampPerDepth":3,"DmgLin":0.24,"DmgQuad":0.02,"DropChance":12,"GambleBonus":1,"GamblePerDepth":30,"GamblePrice":120,"GoldChance":30,"GoldPerLvl":2,"HPPerLvl":4,"HealCost":0.5,"HpLin":0.32,"HpQuad":0.05,"ManaPerEne":1.7,"ManaPerLvl":2,"ManaPotion":0.4,"MonArmorK":120,"MonArmorPerLvl":2,"MonToHitPerLvl":3,"NovaMul":1,"PackMul":1,"PotionHeal":0.65,"PotionPrice":20,"PotionPricePerLvl":4,"QuestGoldPerLvl":100,"RareBonus":0.2,"RerollPerDepth":10,"RerollPrice":50,"ScrollPrice":40,"ScrollPricePerLvl":6,"SellDiv":12,"ShotMul":0.8,"StrDiv":45,"ToHitPerLvl":0,"WakeRange":10,"WandererDmg":1,"WandererHp":2.8,"XPBase":35,"XPExp":1.8},"score":12.544439369369002,"scoreCI":[11.615514789991845,13.805660263061881],"key":{"abyssDeath":11,"caster.clvl":19,"caster.deepest":9,"caster.gold":3.6936026936026938,"caster.king":0.96875,"caster.oracle":0.2604166666666667,"fighter.clvl":18,"fighter.deepest":8,"fighter.gold":7.455454545454546,"fighter.king":0.8854166666666666,"fighter.oracle":0.16666666666666666,"gap":0.09375000000000003,"stuck":1},"change":"bot: cover against ranged packs: with two or more shooters in line and nothing adjacent, step to the nearest cell out of their sight and hold there 8 turns, fighting what comes round","why":"the floor trial showed the bot playing the corner (six kills on one belt where it died in twenty turns) and still dying 44/48 on abyss1, 48/48 on the Kindling; in the eval every Kindling arrival still dies (16/16, 23/23), everything else is noise (score -0.06) and one run gets stuck; the depth-10 caves are not a bot blind spot the corner fixes","decision":"revert","base":"balance/runs/116-portal-blocked.json","vsBase":"-0.06 (-1.67…+1.56)","best":"12.60","bestRun":"balance/runs/116-portal-blocked.json"}
{"id":97,"time":"2026-10-10T16:33:25+02:00","name":"122-val-control","run":"balance/runs/122-val-control.json","rev":"07dcbcc","dirty":false,"code":"2665468546","bot":"82a412040b","first":1001,"seeds":96,"turns":20000,"changed":null,"rules":{"AffixLvlScale":1,"ArmorCap":0.5,"ArmorK":50,"ArmorPerLvl":10,"BoltCostLvl":0.667,"BoltEnePow":1,"BoltMul":1,"BossHpLin":0.22,"BudgetMul":7,"ChampBase":8,"ChampDmg":1.3,"ChampHp":2.2,"ChampPerDepth":3,"DmgLin":0.24,"DmgQuad":0.02,"DropChance":12,"GambleBonus":1,"GamblePerDepth":30,"GamblePrice":120,"GoldChance":30,"GoldPerLvl":2,"HPPerLvl":4,"HealCost":0.5,"HpLin":0.32,"HpQuad":0.05,"ManaPerEne":1.7,"ManaPerLvl":2,"ManaPotion":0.4,"MonArmorK":120,"MonArmorPerLvl":2,"MonToHitPerLvl":3,"NovaMul":1,"PackMul":1,"PotionHeal":0.65,"PotionPrice":20,"PotionPricePerLvl":4,"QuestGoldPerLvl":100,"RareBonus":0.2,"RerollPerDepth":10,"RerollPrice":50,"ScrollPrice":40,"ScrollPricePerLvl":6,"SellDiv":12,"StrDiv":45,"ToHitPerLvl":0,"WakeRange":10,"WandererDmg":1,"WandererHp":2.8,"XPBase":35,"XPExp":1.8},"score":13.907746942221728,"scoreCI":[12.813259633644758,15.158116219224173],"key":{"abyssDeath":11,"caster.clvl":19,"caster.deepest":8,"caster.gold":3.764848484848485,"caster.king":0.9479166666666666,"caster.oracle":0.15625,"fighter.clvl":18,"fighter.deepest":8,"fighter.gold":7.602424242424243,"fighter.king":0.8854166666666666,"fighter.oracle":0.16666666666666666,"gap":0.0625,"stuck":1},"change":"none: defaults at 07dcbcc on fresh seeds 1001-1096 (run from a worktree)","why":"control for the validation of this pass's pick","decision":"baseline","base":"balance/runs/116-portal-blocked.json","vsBase":"+NaN (+NaN…+NaN)","best":"12.60","bestRun":"balance/runs/116-portal-blocked.json"}
{"id":98,"time":"2026-10-10T16:33:26+02:00","name":"123-val-bot","run":"balance/runs/123-val-bot.json","rev":"07dcbcc","dirty":true,"code":"fafcf09542","bot":"0c6621d835","first":1001,"seeds":96,"turns":20000,"changed":null,"rules":{"AffixLvlScale":1,"ArmorCap":0.5,"ArmorK":50,"ArmorPerLvl":10,"BoltCostLvl":0.667,"BoltEnePow":1,"BoltMul":1,"BossHpLin":0.22,"BudgetMul":7,"ChampBase":8,"ChampDmg":1.3,"ChampHp":2.2,"ChampPerDepth":3,"DmgLin":0.24,"DmgQuad":0.02,"DropChance":12,"GambleBonus":1,"GamblePerDepth":30,"GamblePrice":120,"GoldChance":30,"GoldPerLvl":2,"HPPerLvl":4,"HealCost":0.5,"HpLin":0.32,"HpQuad":0.05,"ManaPerEne":1.7,"ManaPerLvl":2,"ManaPotion":0.4,"MonArmorK":120,"MonArmorPerLvl":2,"MonToHitPerLvl":3,"NovaMul":1,"PackMul":1,"PotionHeal":0.65,"PotionPrice":20,"PotionPricePerLvl":4,"QuestGoldPerLvl":100,"RareBonus":0.2,"RerollPerDepth":10,"RerollPrice":50,"ScrollPrice":40,"ScrollPricePerLvl":6,"SellDiv":12,"ShotMul":0.8,"StrDiv":45,"ToHitPerLvl":0,"WakeRange":10,"WandererDmg":1,"WandererHp":2.8,"XPBase":35,"XPExp":1.8},"score":13.26461903849684,"scoreCI":[11.97273888071734,14.23420893922143],"key":{"abyssDeath":11,"caster.clvl":19,"caster.deepest":9,"caster.gold":3.5103030303030307,"caster.king":0.9583333333333334,"caster.oracle":0.21875,"fighter.clvl":18,"fighter.deepest":8,"fighter.gold":7.7763636363636355,"fighter.king":0.8958333333333334,"fighter.oracle":0.17708333333333334,"gap":0.0625,"stuck":1},"change":"bot: the blocked-portal fix (#91) on fresh seeds 1001-1096","why":"holds: caster deepest +0.32 and clvl +0.51 (sure), oracle 0.16-\u003e0.22, trips +2.7 (sure); fighter flat (+0.09 deepest, 4/0); score 13.91-\u003e13.26 (noise, -1.37..+0.22)","decision":"keep","base":"balance/runs/122-val-control.json","vsBase":"-0.64 (-1.37…+0.22)","best":"12.60","bestRun":"balance/runs/116-portal-blocked.json"}
{"id":99,"time":"2026-10-10T16:34:36+02:00","name":"124-val-manapotion5","run":"balance/runs/124-val-manapotion5.json","rev":"07dcbcc","dirty":true,"code":"fafcf09542","bot":"0c6621d835","first":1001,"seeds":96,"turns":20000,"changed":["ManaPotion: 0.4 → 0.5"],"rules":{"AffixLvlScale":1,"ArmorCap":0.5,"ArmorK":50,"ArmorPerLvl":10,"BoltCostLvl":0.667,"BoltEnePow":1,"BoltMul":1,"BossHpLin":0.22,"BudgetMul":7,"ChampBase":8,"ChampDmg":1.3,"ChampHp":2.2,"ChampPerDepth":3,"DmgLin":0.24,"DmgQuad":0.02,"DropChance":12,"GambleBonus":1,"GamblePerDepth":30,"GamblePrice":120,"GoldChance":30,"GoldPerLvl":2,"HPPerLvl":4,"HealCost":0.5,"HpLin":0.32,"HpQuad":0.05,"ManaPerEne":1.7,"ManaPerLvl":2,"ManaPotion":0.5,"MonArmorK":120,"MonArmorPerLvl":2,"MonToHitPerLvl":3,"NovaMul":1,"PackMul":1,"PotionHeal":0.65,"PotionPrice":20,"PotionPricePerLvl":4,"QuestGoldPerLvl":100,"RareBonus":0.2,"RerollPerDepth":10,"RerollPrice":50,"ScrollPrice":40,"ScrollPricePerLvl":6,"SellDiv":12,"ShotMul":0.8,"StrDiv":45,"ToHitPerLvl":0,"WakeRange":10,"WandererDmg":1,"WandererHp":2.8,"XPBase":35,"XPExp":1.8},"score":13.844251879319982,"scoreCI":[12.66047149296958,16.03735689647204],"key":{"abyssDeath":11,"caster.clvl":19,"caster.deepest":9,"caster.gold":4.749831649831649,"caster.king":0.9583333333333334,"caster.oracle":0.3645833333333333,"fighter.clvl":18,"fighter.deepest":8,"fighter.gold":7.96909090909091,"fighter.king":0.9479166666666666,"fighter.oracle":0.1875,"gap":0.17708333333333331,"stuck":2},"change":"ManaPotion 0.4 -\u003e 0.5 on fresh seeds 1001-1096, the fixed bot: the pick","why":"holds: caster oracle 0.22-\u003e0.36 (sure, +0.03..+0.26) as 0.27-\u003e0.42 on seeds 1-96; caster surplus +342 (sure), gap 0.18; score +0.58 vs the bot alone and -0.06 vs the control (noise both): the caster's Oracle band against the gold band and the gap, a design trade the score cannot settle; best.json carries it, DefaultRules does not","decision":"keep","base":"balance/runs/123-val-bot.json","vsBase":"+0.58 (-1.00…+3.09)","best":"12.60","bestRun":"balance/runs/116-portal-blocked.json"}
