{"id":74,"time":"2026-10-03T22:05:57+02:00","name":"096-wanderer-slice3","run":"balance/runs/096-wanderer-slice3.json","rev":"8c0f950","dirty":true,"code":"8f758d918a","bot":"159d3bde9b","first":1,"seeds":96,"turns":20000,"changed":null,"rules":{"AffixLvlScale":1,"ArmorCap":0.5,"ArmorK":50,"ArmorPerLvl":10,"BoltCostLvl":0.667,"BoltEnePow":1,"BoltMul":1,"BossHpLin":0.22,"BudgetMul":7,"ChampBase":8,"ChampDmg":1.3,"ChampHp":2.2,"ChampPerDepth":3,"DmgLin":0.24,"DmgQuad":0.02,"DropChance":12,"GambleBonus":1,"GamblePerDepth":30,"GamblePrice":120,"GoldChance":30,"GoldPerLvl":2,"HPPerLvl":4,"HealCost":0.5,"HpLin":0.32,"HpQuad":0.05,"ManaPerEne":1.7,"ManaPerLvl":2,"ManaPotion":0.4,"MonArmorK":120,"MonArmorPerLvl":2,"MonToHitPerLvl":3,"NovaMul":1,"PackMul":1,"PotionHeal":0.65,"PotionPrice":20,"PotionPricePerLvl":4,"QuestGoldPerLvl":100,"RareBonus":0.2,"RerollPerDepth":10,"RerollPrice":50,"ScrollPrice":40,"ScrollPricePerLvl":6,"SellDiv":12,"StrDiv":45,"ToHitPerLvl":0,"WakeRange":10,"XPBase":35,"XPExp":1.8},"score":13.835662357395483,"scoreCI":[13.267642256465253,14.492054405808922],"key":{"abyssDeath":10,"caster.clvl":14,"caster.deepest":7,"caster.gold":2.783982683982684,"caster.king":0.9479166666666666,"caster.oracle":0.041666666666666664,"fighter.clvl":13,"fighter.deepest":7,"fighter.gold":5.24969696969697,"fighter.king":0.9166666666666666,"fighter.oracle":0.03125,"gap":0.03125,"stuck":0},"change":"Emberhold goes dark: the Last Wanderer hunts the townsfolk, the forge dies with Hadrik","why":"slice 3 of the final boss; no bot run reaches abyss3, so the metrics are unchanged by construction","decision":"keep","base":"balance/runs/095-wanderer-slice2.json","vsBase":"+0.00 (+0.00…+0.00)","best":"13.19","bestRun":"balance/runs/089-wobble.json"}
{"id":75,"time":"2026-10-03T23:27:52+02:00","name":"097-wanderer-slice4","run":"balance/runs/097-wanderer-slice4.json","rev":"e621af1","dirty":true,"code":"8dbab23dd6","bot":"747d270b9a","first":1,"seeds":96,"turns":20000,"changed":null,"rules":{"AffixLvlScale":1,"ArmorCap":0.5,"ArmorK":50,"ArmorPerLvl":10,"BoltCostLvl":0.667,"BoltEnePow":1,"BoltMul":1,"BossHpLin":0.22,"BudgetMul":7,"ChampBase":8,"ChampDmg":1.3,"ChampHp":2.2,"ChampPerDepth":3,"DmgLin":0.24,"DmgQuad":0.02,"DropChance":12,"GambleBonus":1,"GamblePerDepth":30,"GamblePrice":120,"GoldChance":30,"GoldPerLvl":2,"HPPerLvl":4,"HealCost":0.5,"HpLin":0.32,"HpQuad":0.05,"ManaPerEne":1.7,"ManaPerLvl":2,"ManaPotion":0.4,"MonArmorK":120,"MonArmorPerLvl":2,"MonToHitPerLvl":3,"NovaMul":1,"PackMul":1,"PotionHeal":0.65,"PotionPrice":20,"PotionPricePerLvl":4,"QuestGoldPerLvl":100,"RareBonus":0.2,"RerollPerDepth":10,"RerollPrice":50,"ScrollPrice":40,"ScrollPricePerLvl":6,"SellDiv":12,"StrDiv":45,"ToHitPerLvl":0,"WakeRange":10,"XPBase":35,"XPExp":1.8},"score":13.835662357395483,"scoreCI":[13.267642256465253,14.492054405808922],"key":{"abyssDeath":10,"caster.clvl":14,"caster.deepest":7,"caster.gold":2.783982683982684,"caster.king":0.9479166666666666,"caster.oracle":0.041666666666666664,"fighter.clvl":13,"fighter.deepest":7,"fighter.gold":5.24969696969697,"fighter.king":0.9166666666666666,"fighter.oracle":0.03125,"gap":0.03125,"stuck":0},"change":"the ending: choice over the Last Wanderer's body, survivors page, his shroud, third quest, foreshadowing lines; the bot keeps walking","why":"slice 4 of the final boss; no bot run reaches abyss3, so the metrics are unchanged by construction","decision":"keep","base":"balance/runs/096-wanderer-slice3.json","vsBase":"+0.00 (+0.00…+0.00)","best":"13.19","bestRun":"balance/runs/089-wobble.json"}
{"id":76,"time":"2026-10-03T23:39:11+02:00","name":"098-wanderer-hp3","run":"balance/runs/098-wanderer-hp3.json","rev":"7644350","dirty":true,"code":"e009e3d641","bot":"5cc1ee087a","first":1,"seeds":96,"turns":20000,"changed":null,"rules":{"AffixLvlScale":1,"ArmorCap":0.5,"ArmorK":50,"ArmorPerLvl":10,"BoltCostLvl":0.667,"BoltEnePow":1,"BoltMul":1,"BossHpLin":0.22,"BudgetMul":7,"ChampBase":8,"ChampDmg":1.3,"ChampHp":2.2,"ChampPerDepth":3,"DmgLin":0.24,"DmgQuad":0.02,"DropChance":12,"GambleBonus":1,"GamblePerDepth":30,"GamblePrice":120,"GoldChance":30,"GoldPerLvl":2,"HPPerLvl":4,"HealCost":0.5,"HpLin":0.32,"HpQuad":0.05,"ManaPerEne":1.7,"ManaPerLvl":2,"ManaPotion":0.4,"MonArmorK":120,"MonArmorPerLvl":2,"MonToHitPerLvl":3,"NovaMul":1,"PackMul":1,"PotionHeal":0.65,"PotionPrice":20,"PotionPricePerLvl":4,"QuestGoldPerLvl":100,"RareBonus":0.2,"RerollPerDepth":10,"RerollPrice":50,"ScrollPrice":40,"ScrollPricePerLvl":6,"SellDiv":12,"StrDiv":45,"ToHitPerLvl":0,"WakeRange":10,"WandererDmg":1,"WandererHp":3,"WandererRift":0.5,"XPBase":35,"XPExp":1.8},"score":13.835662357395483,"scoreCI":[13.267642256465253,14.492054405808922],"key":{"abyssDeath":10,"caster.clvl":14,"caster.deepest":7,"caster.gold":2.783982683982684,"caster.king":0.9479166666666666,"caster.oracle":0.041666666666666664,"fighter.clvl":13,"fighter.deepest":7,"fighter.gold":5.24969696969697,"fighter.king":0.9166666666666666,"fighter.oracle":0.03125,"gap":0.03125,"stuck":0},"change":"WandererHp 1 -\u003e 3 (new knobs WandererHp, WandererDmg, WandererRift); bot follows his red portal; Hearth trial (BOTHEARTH)","why":"no eval run reaches abyss3, so the Hearth trial measures him: par hero lvl 21, full belt, duel on a cleared floor. At 1x both builds won 100% on under 1 potion. At 3x, seeds 1-96 and fresh 1001-1096 agree: fighter 96/96 on 2.6 potions, caster 69/96 on the whole belt. Full floor: about 1 in 8 wins, deaths mostly to imp packs, the existing abyss wall. Eval unchanged by construction.","decision":"keep","base":"balance/runs/097-wanderer-slice4.json","vsBase":"+0.00 (+0.00…+0.00)","best":"13.19","bestRun":"balance/runs/089-wobble.json"}
{"id":77,"time":"2026-10-05T11:28:43+02:00","name":"099-wanderer-noportal","run":"balance/runs/099-wanderer-noportal.json","rev":"3fb0411","dirty":true,"code":"778e6fac1d","bot":"159d3bde9b","first":1,"seeds":96,"turns":20000,"changed":null,"rules":{"AffixLvlScale":1,"ArmorCap":0.5,"ArmorK":50,"ArmorPerLvl":10,"BoltCostLvl":0.667,"BoltEnePow":1,"BoltMul":1,"BossHpLin":0.22,"BudgetMul":7,"ChampBase":8,"ChampDmg":1.3,"ChampHp":2.2,"ChampPerDepth":3,"DmgLin":0.24,"DmgQuad":0.02,"DropChance":12,"GambleBonus":1,"GamblePerDepth":30,"GamblePrice":120,"GoldChance":30,"GoldPerLvl":2,"HPPerLvl":4,"HealCost":0.5,"HpLin":0.32,"HpQuad":0.05,"ManaPerEne":1.7,"ManaPerLvl":2,"ManaPotion":0.4,"MonArmorK":120,"MonArmorPerLvl":2,"MonToHitPerLvl":3,"NovaMul":1,"PackMul":1,"PotionHeal":0.65,"PotionPrice":20,"PotionPricePerLvl":4,"QuestGoldPerLvl":100,"RareBonus":0.2,"RerollPerDepth":10,"RerollPrice":50,"ScrollPrice":40,"ScrollPricePerLvl":6,"SellDiv":12,"StrDiv":45,"ToHitPerLvl":0,"WakeRange":10,"WandererDmg":1,"WandererHp":2.8,"XPBase":35,"XPExp":1.8},"score":13.835662357395483,"scoreCI":[13.267642256465253,14.492054405808922],"key":{"abyssDeath":10,"caster.clvl":14,"caster.deepest":7,"caster.gold":2.783982683982684,"caster.king":0.9479166666666666,"caster.oracle":0.041666666666666664,"fighter.clvl":13,"fighter.deepest":7,"fighter.gold":5.24969696969697,"fighter.king":0.9166666666666666,"fighter.oracle":0.03125,"gap":0.03125,"stuck":0},"change":"the Last Wanderer's own portal cut (and the WandererRift knob, the off-screen toll); WandererHp 3 -\u003e 2.8","why":"without his half-life portal the duel stays in the Hearth or follows a hero who portals home, so the caster fell to 60% at 3x. Hearth trial at 2.8, seeds 1-96 and 1001-1096: fighter 96/96 on 2.4 potions both times, caster 72/96 and 69/96; about half the casters portal home and he follows. Eval unchanged by construction.","decision":"keep","base":"balance/runs/098-wanderer-hp3.json","vsBase":"+0.00 (+0.00…+0.00)","best":"13.19","bestRun":"balance/runs/089-wobble.json"}
{"id":78,"time":"2026-10-05T13:51:20+02:00","name":"100-wanderer-review-fixes","run":"balance/runs/100-wanderer-review-fixes.json","rev":"549f938","dirty":true,"code":"e2acb1516a","bot":"896af5f7dd","first":1,"seeds":96,"turns":20000,"changed":null,"rules":{"AffixLvlScale":1,"ArmorCap":0.5,"ArmorK":50,"ArmorPerLvl":10,"BoltCostLvl":0.667,"BoltEnePow":1,"BoltMul":1,"BossHpLin":0.22,"BudgetMul":7,"ChampBase":8,"ChampDmg":1.3,"ChampHp":2.2,"ChampPerDepth":3,"DmgLin":0.24,"DmgQuad":0.02,"DropChance":12,"GambleBonus":1,"GamblePerDepth":30,"GamblePrice":120,"GoldChance":30,"GoldPerLvl":2,"HPPerLvl":4,"HealCost":0.5,"HpLin":0.32,"HpQuad":0.05,"ManaPerEne":1.7,"ManaPerLvl":2,"ManaPotion":0.4,"MonArmorK":120,"MonArmorPerLvl":2,"MonToHitPerLvl":3,"NovaMul":1,"PackMul":1,"PotionHeal":0.65,"PotionPrice":20,"PotionPricePerLvl":4,"QuestGoldPerLvl":100,"RareBonus":0.2,"RerollPerDepth":10,"RerollPrice":50,"ScrollPrice":40,"ScrollPricePerLvl":6,"SellDiv":12,"StrDiv":45,"ToHitPerLvl":0,"WakeRange":10,"WandererDmg":1,"WandererHp":2.8,"XPBase":35,"XPExp":1.8},"score":13.835662357395483,"scoreCI":[13.267642256465253,14.492054405808922],"key":{"abyssDeath":10,"caster.clvl":14,"caster.deepest":7,"caster.gold":2.783982683982684,"caster.king":0.9479166666666666,"caster.oracle":0.041666666666666664,"fighter.clvl":13,"fighter.deepest":7,"fighter.gold":5.24969696969697,"fighter.king":0.9166666666666666,"fighter.oracle":0.03125,"gap":0.03125,"stuck":0},"change":"review fixes: bot skips trade in a hunted town, townsfolk walk home, snuffed lamps draw cold, he collapses only a portal the hero came through, snuffing on his turn, -level town start restocks","why":"bug review of the branch; Hearth trial and eval identical to #77","decision":"keep","base":"balance/runs/099-wanderer-noportal.json","vsBase":"+0.00 (+0.00…+0.00)","best":"13.19","bestRun":"balance/runs/089-wobble.json"}
{"id":79,"time":"2026-10-08T13:50:19+02:00","name":"102-bigger-maps","run":"balance/runs/102-bigger-maps.json","rev":"025a61b","dirty":true,"code":"0b48da659c","bot":"896af5f7dd","first":1,"seeds":48,"turns":20000,"changed":null,"rules":{"AffixLvlScale":1,"ArmorCap":0.5,"ArmorK":50,"ArmorPerLvl":10,"BoltCostLvl":0.667,"BoltEnePow":1,"BoltMul":1,"BossHpLin":0.22,"BudgetMul":7,"ChampBase":8,"ChampDmg":1.3,"ChampHp":2.2,"ChampPerDepth":3,"DmgLin":0.24,"DmgQuad":0.02,"DropChance":12,"GambleBonus":1,"GamblePerDepth":30,"GamblePrice":120,"GoldChance":30,"GoldPerLvl":2,"HPPerLvl":4,"HealCost":0.5,"HpLin":0.32,"HpQuad":0.05,"ManaPerEne":1.7,"ManaPerLvl":2,"ManaPotion":0.4,"MonArmorK":120,"MonArmorPerLvl":2,"MonToHitPerLvl":3,"NovaMul":1,"PackMul":1,"PotionHeal":0.65,"PotionPrice":20,"PotionPricePerLvl":4,"QuestGoldPerLvl":100,"RareBonus":0.2,"RerollPerDepth":10,"RerollPrice":50,"ScrollPrice":40,"ScrollPricePerLvl":6,"SellDiv":12,"StrDiv":45,"ToHitPerLvl":0,"WakeRange":10,"WandererDmg":1,"WandererHp":2.8,"XPBase":35,"XPExp":1.8},"score":15.161744366355,"scoreCI":[13.974232046863284,17.718526678501387],"key":{"abyssDeath":10,"caster.clvl":15,"caster.deepest":8,"caster.gold":3.3111111111111113,"caster.king":0.9791666666666666,"caster.oracle":0.08333333333333333,"fighter.clvl":14,"fighter.deepest":7,"fighter.gold":6.238383838383838,"fighter.king":0.9166666666666666,"fighter.oracle":0.020833333333333332,"gap":0.0625,"stuck":0},"change":"maps: Ashen Fields 150x90→180x108, Blackmarsh 130x80→156x96; packs, fires, ruins, stones scaled by area (fields 20→29 packs, marsh 24→35)","why":"user: bigger surface areas; score noise on seeds 1–48 (+0.69) and 1001–1048 (+1.47), more kills/turns, fighter gold surplus up a little","decision":"keep","base":"balance/runs/101-maps-base.json","vsBase":"+0.69 (-0.58…+3.42)","best":"13.19","bestRun":"balance/runs/089-wobble.json"}
{"id":80,"time":"2026-10-10T14:17:16+02:00","name":"105-route-base","run":"balance/runs/105-route-base.json","rev":"3157636","dirty":false,"code":"ddcebdc6a7","bot":"94fde9d5fd","first":1,"seeds":96,"turns":20000,"changed":null,"rules":{"AffixLvlScale":1,"ArmorCap":0.5,"ArmorK":50,"ArmorPerLvl":10,"BoltCostLvl":0.667,"BoltEnePow":1,"BoltMul":1,"BossHpLin":0.22,"BudgetMul":7,"ChampBase":8,"ChampDmg":1.3,"ChampHp":2.2,"ChampPerDepth":3,"DmgLin":0.24,"DmgQuad":0.02,"DropChance":12,"GambleBonus":1,"GamblePerDepth":30,"GamblePrice":120,"GoldChance":30,"GoldPerLvl":2,"HPPerLvl":4,"HealCost":0.5,"HpLin":0.32,"HpQuad":0.05,"ManaPerEne":1.7,"ManaPerLvl":2,"ManaPotion":0.4,"MonArmorK":120,"MonArmorPerLvl":2,"MonToHitPerLvl":3,"NovaMul":1,"PackMul":1,"PotionHeal":0.65,"PotionPrice":20,"PotionPricePerLvl":4,"QuestGoldPerLvl":100,"RareBonus":0.2,"RerollPerDepth":10,"RerollPrice":50,"ScrollPrice":40,"ScrollPricePerLvl":6,"SellDiv":12,"StrDiv":45,"ToHitPerLvl":0,"WakeRange":10,"WandererDmg":1,"WandererHp":2.8,"XPBase":35,"XPExp":1.8},"score":14.47128947959648,"scoreCI":[13.744541488704439,15.303746605622607],"key":{"abyssDeath":10,"caster.clvl":15,"caster.deepest":8,"caster.gold":3.073232323232323,"caster.king":0.96875,"caster.oracle":0.09375,"fighter.clvl":14,"fighter.deepest":7,"fighter.gold":5.75959595959596,"fighter.king":0.8854166666666666,"fighter.oracle":0.020833333333333332,"gap":0.08333333333333337,"stuck":1},"change":"baseline at 3157636: the Gravewardens' Barrow in the game, off the bot's route","why":"base for routing the bot along the quest line","decision":"baseline","base":"balance/runs/089-wobble.json","vsBase":"+1.28 (-0.63…+2.45)","best":"13.19","bestRun":"balance/runs/089-wobble.json"}
{"id":81,"time":"2026-10-10T14:17:17+02:00","name":"106-route","run":"balance/runs/106-route.json","rev":"3157636","dirty":true,"code":"506edf1b5a","bot":"fda3c76492","first":1,"seeds":96,"turns":20000,"changed":null,"rules":{"AffixLvlScale":1,"ArmorCap":0.5,"ArmorK":50,"ArmorPerLvl":10,"BoltCostLvl":0.667,"BoltEnePow":1,"BoltMul":1,"BossHpLin":0.22,"BudgetMul":7,"ChampBase":8,"ChampDmg":1.3,"ChampHp":2.2,"ChampPerDepth":3,"DmgLin":0.24,"DmgQuad":0.02,"DropChance":12,"GambleBonus":1,"GamblePerDepth":30,"GamblePrice":120,"GoldChance":30,"GoldPerLvl":2,"HPPerLvl":4,"HealCost":0.5,"HpLin":0.32,"HpQuad":0.05,"ManaPerEne":1.7,"ManaPerLvl":2,"ManaPotion":0.4,"MonArmorK":120,"MonArmorPerLvl":2,"MonToHitPerLvl":3,"NovaMul":1,"PackMul":1,"PotionHeal":0.65,"PotionPrice":20,"PotionPricePerLvl":4,"QuestGoldPerLvl":100,"RareBonus":0.2,"RerollPerDepth":10,"RerollPrice":50,"ScrollPrice":40,"ScrollPricePerLvl":6,"SellDiv":12,"StrDiv":45,"ToHitPerLvl":0,"WakeRange":10,"WandererDmg":1,"WandererHp":2.8,"XPBase":35,"XPExp":1.8},"score":13.375684226120839,"scoreCI":[12.08030434566902,14.838504534057462],"key":{"abyssDeath":10,"caster.clvl":19,"caster.deepest":8,"caster.gold":3.9528619528619524,"caster.king":0.96875,"caster.oracle":0.22916666666666666,"fighter.clvl":18,"fighter.deepest":8,"fighter.gold":7.795454545454546,"fighter.king":0.8854166666666666,"fighter.oracle":0.1875,"gap":0.08333333333333337,"stuck":0},"change":"bot: walks the quest line (route.go) instead of its own chain: the Buried Captain after the Bone King, then the marsh","why":"one route for the bot and docs/quests.md; the barrow lifts clvl at grotto1 13-\u003e17 and the Oracle 2%-\u003e19% (fighter), 9%-\u003e23% (caster); gold piles higher (5.8-\u003e7.8)","decision":"keep","base":"balance/runs/105-route-base.json","vsBase":"-1.10 (-2.32…+0.16)","best":"13.19","bestRun":"balance/runs/089-wobble.json"}
{"id":82,"time":"2026-10-10T15:02:15+02:00","name":"107-sanctum","run":"balance/runs/107-sanctum.json","rev":"78cf2c9","dirty":true,"code":"64ec0a627a","bot":"7beef44af5","first":1,"seeds":96,"turns":20000,"changed":null,"rules":{"AffixLvlScale":1,"ArmorCap":0.5,"ArmorK":50,"ArmorPerLvl":10,"BoltCostLvl":0.667,"BoltEnePow":1,"BoltMul":1,"BossHpLin":0.22,"BudgetMul":7,"ChampBase":8,"ChampDmg":1.3,"ChampHp":2.2,"ChampPerDepth":3,"DmgLin":0.24,"DmgQuad":0.02,"DropChance":12,"GambleBonus":1,"GamblePerDepth":30,"GamblePrice":120,"GoldChance":30,"GoldPerLvl":2,"HPPerLvl":4,"HealCost":0.5,"HpLin":0.32,"HpQuad":0.05,"ManaPerEne":1.7,"ManaPerLvl":2,"ManaPotion":0.4,"MonArmorK":120,"MonArmorPerLvl":2,"MonToHitPerLvl":3,"NovaMul":1,"PackMul":1,"PotionHeal":0.65,"PotionPrice":20,"PotionPricePerLvl":4,"QuestGoldPerLvl":100,"RareBonus":0.2,"RerollPerDepth":10,"RerollPrice":50,"ScrollPrice":40,"ScrollPricePerLvl":6,"SellDiv":12,"StrDiv":45,"ToHitPerLvl":0,"WakeRange":10,"WandererDmg":1,"WandererHp":2.8,"XPBase":35,"XPExp":1.8},"score":13.35177701799721,"scoreCI":[12.074989143317637,14.680204379701316],"key":{"abyssDeath":11,"caster.clvl":19,"caster.deepest":8,"caster.gold":3.8208754208754208,"caster.king":0.96875,"caster.oracle":0.19791666666666666,"fighter.clvl":18,"fighter.deepest":8,"fighter.gold":7.782491582491582,"fighter.king":0.8854166666666666,"fighter.oracle":0.1875,"gap":0.08333333333333337,"stuck":1},"change":"content: the Cinder Sanctum (sanctum1 lvl 10, sanctum2 lvl 11) under the town graveyard, after the Oracle on the quest line: Hadrik's coal (a bring-back quest) and Aldous's Cinder Prior","why":"score 13.38 -\u003e 13.35, noise; the post-Oracle runs that died on abyss1 (18/21) now die in the Sanctum (17/19), the same wall moved; one fighter stuck in town bumping Hadrik, who stood on his gift (seed 52)","decision":"keep","base":"balance/runs/106-route.json","vsBase":"-0.02 (-0.37…+0.39)","best":"13.19","bestRun":"balance/runs/089-wobble.json"}
{"id":83,"time":"2026-10-10T15:02:16+02:00","name":"108-sanctum-npcwait","run":"balance/runs/108-sanctum-npcwait.json","rev":"78cf2c9","dirty":true,"code":"505714bc8b","bot":"4ec19fd57f","first":1,"seeds":96,"turns":20000,"changed":null,"rules":{"AffixLvlScale":1,"ArmorCap":0.5,"ArmorK":50,"ArmorPerLvl":10,"BoltCostLvl":0.667,"BoltEnePow":1,"BoltMul":1,"BossHpLin":0.22,"BudgetMul":7,"ChampBase":8,"ChampDmg":1.3,"ChampHp":2.2,"ChampPerDepth":3,"DmgLin":0.24,"DmgQuad":0.02,"DropChance":12,"GambleBonus":1,"GamblePerDepth":30,"GamblePrice":120,"GoldChance":30,"GoldPerLvl":2,"HPPerLvl":4,"HealCost":0.5,"HpLin":0.32,"HpQuad":0.05,"ManaPerEne":1.7,"ManaPerLvl":2,"ManaPotion":0.4,"MonArmorK":120,"MonArmorPerLvl":2,"MonToHitPerLvl":3,"NovaMul":1,"PackMul":1,"PotionHeal":0.65,"PotionPrice":20,"PotionPricePerLvl":4,"QuestGoldPerLvl":100,"RareBonus":0.2,"RerollPerDepth":10,"RerollPrice":50,"ScrollPrice":40,"ScrollPricePerLvl":6,"SellDiv":12,"StrDiv":45,"ToHitPerLvl":0,"WakeRange":10,"WandererDmg":1,"WandererHp":2.8,"XPBase":35,"XPExp":1.8},"score":13.35177701799721,"scoreCI":[12.074989143317637,14.680204379701316],"key":{"abyssDeath":11,"caster.clvl":19,"caster.deepest":8,"caster.gold":3.8208754208754208,"caster.king":0.96875,"caster.oracle":0.19791666666666666,"fighter.clvl":18,"fighter.deepest":8,"fighter.gold":7.782491582491582,"fighter.king":0.8854166666666666,"fighter.oracle":0.1875,"gap":0.08333333333333337,"stuck":0},"change":"bot: waits a turn when a townsperson stands on its next step instead of walking into them (a talk spends no turn, so they never wandered off)","why":"score 13.35, noise vs #80; stuck 1 -\u003e 0; 14/10 runs take the coal and reach the Kindling, none kill the Prior: the Kindling is the wall abyss1 was","decision":"keep","base":"balance/runs/106-route.json","vsBase":"-0.02 (-0.37…+0.39)","best":"13.19","bestRun":"balance/runs/089-wobble.json"}
{"id":84,"time":"2026-10-10T16:07:55+02:00","name":"109-baseline","run":"balance/runs/109-baseline.json","rev":"07dcbcc","dirty":false,"code":"2665468546","bot":"82a412040b","first":1,"seeds":96,"turns":20000,"changed":null,"rules":{"AffixLvlScale":1,"ArmorCap":0.5,"ArmorK":50,"ArmorPerLvl":10,"BoltCostLvl":0.667,"BoltEnePow":1,"BoltMul":1,"BossHpLin":0.22,"BudgetMul":7,"ChampBase":8,"ChampDmg":1.3,"ChampHp":2.2,"ChampPerDepth":3,"DmgLin":0.24,"DmgQuad":0.02,"DropChance":12,"GambleBonus":1,"GamblePerDepth":30,"GamblePrice":120,"GoldChance":30,"GoldPerLvl":2,"HPPerLvl":4,"HealCost":0.5,"HpLin":0.32,"HpQuad":0.05,"ManaPerEne":1.7,"ManaPerLvl":2,"ManaPotion":0.4,"MonArmorK":120,"MonArmorPerLvl":2,"MonToHitPerLvl":3,"NovaMul":1,"PackMul":1,"PotionHeal":0.65,"PotionPrice":20,"PotionPricePerLvl":4,"QuestGoldPerLvl":100,"RareBonus":0.2,"RerollPerDepth":10,"RerollPrice":50,"ScrollPrice":40,"ScrollPricePerLvl":6,"SellDiv":12,"StrDiv":45,"ToHitPerLvl":0,"WakeRange":10,"WandererDmg":1,"WandererHp":2.8,"XPBase":35,"XPExp":1.8},"score":13.35177701799721,"scoreCI":[12.074989143317637,14.680204379701316],"key":{"abyssDeath":11,"caster.clvl":19,"caster.deepest":8,"caster.gold":3.8208754208754208,"caster.king":0.96875,"caster.oracle":0.19791666666666666,"fighter.clvl":18,"fighter.deepest":8,"fighter.gold":7.782491582491582,"fighter.king":0.8854166666666666,"fighter.oracle":0.1875,"gap":0.08333333333333337,"stuck":0},"change":"none: defaults at 07dcbcc (Sanctum merged, review fixes in)","why":"start of the 2026-10-10 pass; identical to #83 by seed: the review fixes changed no outcome","decision":"baseline","base":"balance/runs/089-wobble.json","vsBase":"+0.16 (-1.88…+1.52)","best":"13.19","bestRun":"balance/runs/089-wobble.json"}
