{"id": 12, "time": "2026-09-30T22:55:03+02:00", "name": "022-manaene", "run": "balance/runs/022-manaene.json", "rev": "79571fb", "dirty": true, "code": "87b8c1e18f", "bot": "afb91e0336", "first": 1, "seeds": 96, "turns": 20000, "changed": ["ManaPerEne: 1.2 \u2192 1.7"], "rules": {"AffixLvlScale": 1, "ArmorCap": 0.5, "ArmorK": 50, "ArmorPerLvl": 10, "BoltCostLvl": 0.667, "BoltEnePow": 1, "BoltMul": 1, "BossHpLin": 0.22, "BudgetMul": 7, "ChampBase": 8, "ChampDmg": 1.3, "ChampHp": 2.2, "ChampPerDepth": 3, "DmgLin": 0.24, "DmgQuad": 0.02, "DropChance": 12, "GambleBonus": 1, "GamblePerDepth": 30, "GamblePrice": 120, "GoldChance": 30, "GoldPerLvl": 3, "HPPerLvl": 4, "HealCost": 0.5, "HpLin": 0.32, "HpQuad": 0.05, "ManaPerEne": 1.7, "ManaPerLvl": 2, "ManaPotion": 0.4, "MonArmorK": 120, "MonArmorPerLvl": 2, "MonToHitPerLvl": 3, "NovaMul": 1, "PackMul": 1, "PotionHeal": 0.5, "PotionPrice": 20, "PotionPricePerLvl": 4, "QuestGoldPerLvl": 250, "RareBonus": 0.2, "RerollPerDepth": 10, "RerollPrice": 50, "ScrollPrice": 40, "ScrollPricePerLvl": 6, "StrDiv": 60, "ToHitPerLvl": 0, "XPBase": 35, "XPExp": 1.8}, "score": 19.748446222213847, "scoreCI": [18.684833634324885, 23.179379869475113], "key": {"abyssDeath": 10, "caster.clvl": 13, "caster.deepest": 7, "caster.gold": 5.040909090909091, "caster.king": 0.8229166666666666, "caster.oracle": 0.010416666666666666, "fighter.clvl": 12, "fighter.deepest": 6, "fighter.gold": 6.210303030303031, "fighter.king": 0.6354166666666666, "fighter.oracle": 0, "gap": 0.1875, "stuck": 1}, "change": "rules: ManaPerEne 1.2 -> 1.7 (new knob; MaxMP = 14 + ManaPerEne*ENE + ManaPerLvl*(lvl-1))", "why": "the caster's kills per mana pool fell from 3 at crypt1 to 1.7 at grotto1 (bolt cost grows with level, pool grows with Energy and level, monster life grows quadratically), so it spent 18-34 town trips a run on potions and died walking home dry. Energy-scaled mana reaches only the caster (fighter Ene 15: +12%). Paired at 96 seeds: caster trips -3.8 (sure), surplus/lvl +240 (sure), deepest +0.29, clvl +0.57, grotto3 1 -> 4; fighter unchanged; score 21.78 -> 19.75", "decision": "keep", "base": "balance/runs/021-base96-nopull.json", "vsBase": "-2.03 (-4.60\u2026+1.67)", "best": "19.75", "bestRun": "balance/runs/022-manaene.json"}
{"id": 13, "time": "2026-09-30T22:59:02+02:00", "name": "025-income", "run": "balance/runs/025-income.json", "rev": "79571fb", "dirty": true, "code": "8b4ebcc7e5", "bot": "28cc82d4ec", "first": 1, "seeds": 96, "turns": 20000, "changed": ["ManaPerEne: 1.2 \u2192 1.7", "GoldPerLvl: 3 \u2192 2", "QuestGoldPerLvl: 250 \u2192 100"], "rules": {"AffixLvlScale": 1, "ArmorCap": 0.5, "ArmorK": 50, "ArmorPerLvl": 10, "BoltCostLvl": 0.667, "BoltEnePow": 1, "BoltMul": 1, "BossHpLin": 0.22, "BudgetMul": 7, "ChampBase": 8, "ChampDmg": 1.3, "ChampHp": 2.2, "ChampPerDepth": 3, "DmgLin": 0.24, "DmgQuad": 0.02, "DropChance": 12, "GambleBonus": 1, "GamblePerDepth": 30, "GamblePrice": 120, "GoldChance": 30, "GoldPerLvl": 2, "HPPerLvl": 4, "HealCost": 0.5, "HpLin": 0.32, "HpQuad": 0.05, "ManaPerEne": 1.7, "ManaPerLvl": 2, "ManaPotion": 0.4, "MonArmorK": 120, "MonArmorPerLvl": 2, "MonToHitPerLvl": 3, "NovaMul": 1, "PackMul": 1, "PotionHeal": 0.5, "PotionPrice": 20, "PotionPricePerLvl": 4, "QuestGoldPerLvl": 100, "RareBonus": 0.2, "RerollPerDepth": 10, "RerollPrice": 50, "ScrollPrice": 40, "ScrollPricePerLvl": 6, "SellDiv": 12, "StrDiv": 60, "ToHitPerLvl": 0, "XPBase": 35, "XPExp": 1.8}, "score": 17.35287932110951, "scoreCI": [17.008704950405548, 21.203142897042884], "key": {"abyssDeath": 7, "caster.clvl": 13, "caster.deepest": 7, "caster.gold": 2.9681818181818183, "caster.king": 0.8125, "caster.oracle": 0, "fighter.clvl": 12, "fighter.deepest": 6, "fighter.gold": 4.713131313131313, "fighter.king": 0.6666666666666666, "fighter.oracle": 0, "gap": 0.14583333333333337, "stuck": 0}, "change": "rules: QuestGoldPerLvl 250 -> 100, GoldPerLvl 3 -> 2", "why": "income was 35-40% sells, 20-25% quest, 30% drops; surplus after consumables was 6.4/5.0 gambles a level (band 0.8-1.5). Paired at 96 seeds: score 20.46 -> 17.35 (-3.11, -5.42..+0.07), fighter.gold 6.4 -> 4.7, caster.gold 5.0 -> 3.0, gap 0.21 -> 0.15, fighter king 0.61 -> 0.67; combat measures unchanged: the bot buys less shop gear and dies no sooner", "decision": "keep", "base": "balance/runs/023-base-mana.json", "vsBase": "-3.11 (-5.42\u2026+0.07)", "best": "17.35", "bestRun": "balance/runs/025-income.json"}
{"id": 14, "time": "2026-09-30T22:59:03+02:00", "name": "024-champ-weaker", "run": "balance/runs/024-champ-weaker.json", "rev": "79571fb", "dirty": true, "code": "8b4ebcc7e5", "bot": "28cc82d4ec", "first": 1, "seeds": 96, "turns": 20000, "changed": ["ManaPerEne: 1.2 \u2192 1.7", "ChampHp: 2.2 \u2192 1.8", "ChampDmg: 1.3 \u2192 1.2"], "rules": {"AffixLvlScale": 1, "ArmorCap": 0.5, "ArmorK": 50, "ArmorPerLvl": 10, "BoltCostLvl": 0.667, "BoltEnePow": 1, "BoltMul": 1, "BossHpLin": 0.22, "BudgetMul": 7, "ChampBase": 8, "ChampDmg": 1.2, "ChampHp": 1.8, "ChampPerDepth": 3, "DmgLin": 0.24, "DmgQuad": 0.02, "DropChance": 12, "GambleBonus": 1, "GamblePerDepth": 30, "GamblePrice": 120, "GoldChance": 30, "GoldPerLvl": 3, "HPPerLvl": 4, "HealCost": 0.5, "HpLin": 0.32, "HpQuad": 0.05, "ManaPerEne": 1.7, "ManaPerLvl": 2, "ManaPotion": 0.4, "MonArmorK": 120, "MonArmorPerLvl": 2, "MonToHitPerLvl": 3, "NovaMul": 1, "PackMul": 1, "PotionHeal": 0.5, "PotionPrice": 20, "PotionPricePerLvl": 4, "QuestGoldPerLvl": 250, "RareBonus": 0.2, "RerollPerDepth": 10, "RerollPrice": 50, "ScrollPrice": 40, "ScrollPricePerLvl": 6, "SellDiv": 12, "StrDiv": 60, "ToHitPerLvl": 0, "XPBase": 35, "XPExp": 1.8}, "score": 22.849571149714485, "scoreCI": [20.884258385296505, 25.31805359912594], "key": {"abyssDeath": 7, "caster.clvl": 14, "caster.deepest": 7, "caster.gold": 5.0338383838383844, "caster.king": 0.90625, "caster.oracle": 0, "fighter.clvl": 12, "fighter.deepest": 7, "fighter.gold": 5.917171717171717, "fighter.king": 0.5729166666666666, "fighter.oracle": 0, "gap": 0.33333333333333337, "stuck": 2}, "change": "rules: ChampHp 2.2 -> 1.8, ChampDmg 1.3 -> 1.2 on #14", "why": "champions kill the fighter in the grotto, but weaker champions help the caster (king 0.82 -> 0.91, grotto1 69 -> 82) and not the fighter (0.61 -> 0.57): gap 0.21 -> 0.33, score +2.39; the fighter's grotto problem is elsewhere", "decision": "revert", "base": "balance/runs/023-base-mana.json", "vsBase": "+2.39 (-0.84\u2026+4.67)", "best": "17.35", "bestRun": "balance/runs/025-income.json"}
{"id": 15, "time": "2026-09-30T22:59:03+02:00", "name": "026-boltcurve", "run": "balance/runs/026-boltcurve.json", "rev": "79571fb", "dirty": true, "code": "8b4ebcc7e5", "bot": "28cc82d4ec", "first": 1, "seeds": 96, "turns": 20000, "changed": ["BoltMul: 1 \u2192 0.75", "BoltEnePow: 1 \u2192 1.2", "ManaPerEne: 1.2 \u2192 1.7"], "rules": {"AffixLvlScale": 1, "ArmorCap": 0.5, "ArmorK": 50, "ArmorPerLvl": 10, "BoltCostLvl": 0.667, "BoltEnePow": 1.2, "BoltMul": 0.75, "BossHpLin": 0.22, "BudgetMul": 7, "ChampBase": 8, "ChampDmg": 1.3, "ChampHp": 2.2, "ChampPerDepth": 3, "DmgLin": 0.24, "DmgQuad": 0.02, "DropChance": 12, "GambleBonus": 1, "GamblePerDepth": 30, "GamblePrice": 120, "GoldChance": 30, "GoldPerLvl": 3, "HPPerLvl": 4, "HealCost": 0.5, "HpLin": 0.32, "HpQuad": 0.05, "ManaPerEne": 1.7, "ManaPerLvl": 2, "ManaPotion": 0.4, "MonArmorK": 120, "MonArmorPerLvl": 2, "MonToHitPerLvl": 3, "NovaMul": 1, "PackMul": 1, "PotionHeal": 0.5, "PotionPrice": 20, "PotionPricePerLvl": 4, "QuestGoldPerLvl": 250, "RareBonus": 0.2, "RerollPerDepth": 10, "RerollPrice": 50, "ScrollPrice": 40, "ScrollPricePerLvl": 6, "SellDiv": 12, "StrDiv": 60, "ToHitPerLvl": 0, "XPBase": 35, "XPExp": 1.8}, "score": 22.26093165793228, "scoreCI": [20.654986067920504, 24.243457707038445], "key": {"abyssDeath": 10, "caster.clvl": 13, "caster.deepest": 7, "caster.gold": 5.72987012987013, "caster.king": 0.9166666666666666, "caster.oracle": 0.03125, "fighter.clvl": 12, "fighter.deepest": 6, "fighter.gold": 5.766161616161616, "fighter.king": 0.5833333333333334, "fighter.oracle": 0, "gap": 0.33333333333333326, "stuck": 0}, "change": "rules: BoltEnePow 1.2, BoltMul 0.75 on #14", "why": "meant to flatten the caster's curve (same at crypt2, stronger deep) but it is a buff from crypt4 on (kills.crypt4 2.5 -> 2.0): caster king 0.92, oracle 3, gap 0.33, score +1.80; the caster is already the stronger build", "decision": "revert", "base": "balance/runs/023-base-mana.json", "vsBase": "+1.80 (-1.79\u2026+3.87)", "best": "17.35", "bestRun": "balance/runs/025-income.json"}
{"id": 16, "time": "2026-09-30T22:59:04+02:00", "name": "027-income-sell", "run": "balance/runs/027-income-sell.json", "rev": "79571fb", "dirty": true, "code": "8b4ebcc7e5", "bot": "28cc82d4ec", "first": 1, "seeds": 96, "turns": 20000, "changed": ["ManaPerEne: 1.2 \u2192 1.7", "GoldPerLvl: 3 \u2192 2", "SellDiv: 12 \u2192 24", "QuestGoldPerLvl: 250 \u2192 100"], "rules": {"AffixLvlScale": 1, "ArmorCap": 0.5, "ArmorK": 50, "ArmorPerLvl": 10, "BoltCostLvl": 0.667, "BoltEnePow": 1, "BoltMul": 1, "BossHpLin": 0.22, "BudgetMul": 7, "ChampBase": 8, "ChampDmg": 1.3, "ChampHp": 2.2, "ChampPerDepth": 3, "DmgLin": 0.24, "DmgQuad": 0.02, "DropChance": 12, "GambleBonus": 1, "GamblePerDepth": 30, "GamblePrice": 120, "GoldChance": 30, "GoldPerLvl": 2, "HPPerLvl": 4, "HealCost": 0.5, "HpLin": 0.32, "HpQuad": 0.05, "ManaPerEne": 1.7, "ManaPerLvl": 2, "ManaPotion": 0.4, "MonArmorK": 120, "MonArmorPerLvl": 2, "MonToHitPerLvl": 3, "NovaMul": 1, "PackMul": 1, "PotionHeal": 0.5, "PotionPrice": 20, "PotionPricePerLvl": 4, "QuestGoldPerLvl": 100, "RareBonus": 0.2, "RerollPerDepth": 10, "RerollPrice": 50, "ScrollPrice": 40, "ScrollPricePerLvl": 6, "SellDiv": 24, "StrDiv": 60, "ToHitPerLvl": 0, "XPBase": 35, "XPExp": 1.8}, "score": null, "scoreCI": [0, 0], "fail": "3 stuck runs", "key": {"abyssDeath": 6, "caster.clvl": 12, "caster.deepest": 7, "caster.gold": 1.4252525252525252, "caster.king": 0.6979166666666666, "caster.oracle": 0, "fighter.clvl": 11, "fighter.deepest": 6, "fighter.gold": 2.9053030303030303, "fighter.king": 0.5729166666666666, "fighter.oracle": 0, "gap": 0.125, "stuck": 3}, "change": "rules: #15 income cut + SellDiv 12 -> 24 (new knob)", "why": "gold bands nearly met (2.9/1.4) but 3 runs stuck (hard fail) and the fighter weaker (king 0.55, grotto1 38): sells are the fighter's gear budget; look at the stuck runs before trying a smaller cut", "decision": "revert", "base": "balance/runs/023-base-mana.json", "vsBase": "+NaN (+NaN\u2026+NaN)", "best": "17.35", "bestRun": "balance/runs/025-income.json"}
{"id": 17, "time": "2026-09-30T23:09:12+02:00", "name": "029-monarmor", "run": "balance/runs/029-monarmor.json", "rev": "79571fb", "dirty": true, "code": "8b4ebcc7e5", "bot": "28cc82d4ec", "first": 1, "seeds": 96, "turns": 20000, "changed": ["ManaPerEne: 1.2 \u2192 1.7", "MonArmorK: 120 \u2192 200", "GoldPerLvl: 3 \u2192 2", "QuestGoldPerLvl: 250 \u2192 100"], "rules": {"AffixLvlScale": 1, "ArmorCap": 0.5, "ArmorK": 50, "ArmorPerLvl": 10, "BoltCostLvl": 0.667, "BoltEnePow": 1, "BoltMul": 1, "BossHpLin": 0.22, "BudgetMul": 7, "ChampBase": 8, "ChampDmg": 1.3, "ChampHp": 2.2, "ChampPerDepth": 3, "DmgLin": 0.24, "DmgQuad": 0.02, "DropChance": 12, "GambleBonus": 1, "GamblePerDepth": 30, "GamblePrice": 120, "GoldChance": 30, "GoldPerLvl": 2, "HPPerLvl": 4, "HealCost": 0.5, "HpLin": 0.32, "HpQuad": 0.05, "ManaPerEne": 1.7, "ManaPerLvl": 2, "ManaPotion": 0.4, "MonArmorK": 200, "MonArmorPerLvl": 2, "MonToHitPerLvl": 3, "NovaMul": 1, "PackMul": 1, "PotionHeal": 0.5, "PotionPrice": 20, "PotionPricePerLvl": 4, "QuestGoldPerLvl": 100, "RareBonus": 0.2, "RerollPerDepth": 10, "RerollPrice": 50, "ScrollPrice": 40, "ScrollPricePerLvl": 6, "SellDiv": 12, "StrDiv": 60, "ToHitPerLvl": 0, "XPBase": 35, "XPExp": 1.8}, "score": 18.96351132947858, "scoreCI": [15.31014007347936, 22.29406591536386], "key": {"abyssDeath": 7, "caster.clvl": 13, "caster.deepest": 7, "caster.gold": 3.0704545454545453, "caster.king": 0.8541666666666666, "caster.oracle": 0, "fighter.clvl": 12, "fighter.deepest": 6, "fighter.gold": 4.746464646464646, "fighter.king": 0.6666666666666666, "fighter.oracle": 0, "gap": 0.1875, "stuck": 1}, "change": "rules: MonArmorK 120 -> 200 on #15", "why": "monster armor only reduces melee, so a fighter-only lever; fighter king 0.67 -> 0.67, deepest +0.03: no effect at 96 seeds", "decision": "revert", "base": "balance/runs/025-income.json", "vsBase": "+1.61 (-2.42\u2026+4.21)", "best": "17.35", "bestRun": "balance/runs/025-income.json"}
{"id": 18, "time": "2026-09-30T23:09:13+02:00", "name": "030-tohit", "run": "balance/runs/030-tohit.json", "rev": "79571fb", "dirty": true, "code": "8b4ebcc7e5", "bot": "28cc82d4ec", "first": 1, "seeds": 96, "turns": 20000, "changed": ["ToHitPerLvl: 0 \u2192 1", "ManaPerEne: 1.2 \u2192 1.7", "GoldPerLvl: 3 \u2192 2", "QuestGoldPerLvl: 250 \u2192 100"], "rules": {"AffixLvlScale": 1, "ArmorCap": 0.5, "ArmorK": 50, "ArmorPerLvl": 10, "BoltCostLvl": 0.667, "BoltEnePow": 1, "BoltMul": 1, "BossHpLin": 0.22, "BudgetMul": 7, "ChampBase": 8, "ChampDmg": 1.3, "ChampHp": 2.2, "ChampPerDepth": 3, "DmgLin": 0.24, "DmgQuad": 0.02, "DropChance": 12, "GambleBonus": 1, "GamblePerDepth": 30, "GamblePrice": 120, "GoldChance": 30, "GoldPerLvl": 2, "HPPerLvl": 4, "HealCost": 0.5, "HpLin": 0.32, "HpQuad": 0.05, "ManaPerEne": 1.7, "ManaPerLvl": 2, "ManaPotion": 0.4, "MonArmorK": 120, "MonArmorPerLvl": 2, "MonToHitPerLvl": 3, "NovaMul": 1, "PackMul": 1, "PotionHeal": 0.5, "PotionPrice": 20, "PotionPricePerLvl": 4, "QuestGoldPerLvl": 100, "RareBonus": 0.2, "RerollPerDepth": 10, "RerollPrice": 50, "ScrollPrice": 40, "ScrollPricePerLvl": 6, "SellDiv": 12, "StrDiv": 60, "ToHitPerLvl": 1, "XPBase": 35, "XPExp": 1.8}, "score": 20.281557593166806, "scoreCI": [18.816264873769555, 23.46293903255307], "key": {"abyssDeath": 7, "caster.clvl": 13, "caster.deepest": 7, "caster.gold": 2.8945454545454545, "caster.king": 0.8020833333333334, "caster.oracle": 0, "fighter.clvl": 11, "fighter.deepest": 6, "fighter.gold": 4.8113636363636365, "fighter.king": 0.53125, "fighter.oracle": 0, "gap": 0.27083333333333337, "stuck": 0}, "change": "rules: ToHitPerLvl 0 -> 1 on #15", "why": "melee-only to-hit; fighter king 0.67 -> 0.53 (15 up/28 down, borderline sure), no other measure moved: at best nothing, likely one false 'sure' in thirty comparisons", "decision": "revert", "base": "balance/runs/025-income.json", "vsBase": "+2.93 (-0.56\u2026+5.24)", "best": "17.35", "bestRun": "balance/runs/025-income.json"}
{"id": 19, "time": "2026-09-30T23:09:13+02:00", "name": "031-base-stall", "run": "balance/runs/031-base-stall.json", "rev": "79571fb", "dirty": true, "code": "6aac3b95c7", "bot": "8c2e68f1cc", "first": 1, "seeds": 96, "turns": 20000, "changed": ["ManaPerEne: 1.2 \u2192 1.7", "GoldPerLvl: 3 \u2192 2", "QuestGoldPerLvl: 250 \u2192 100"], "rules": {"AffixLvlScale": 1, "ArmorCap": 0.5, "ArmorK": 50, "ArmorPerLvl": 10, "BoltCostLvl": 0.667, "BoltEnePow": 1, "BoltMul": 1, "BossHpLin": 0.22, "BudgetMul": 7, "ChampBase": 8, "ChampDmg": 1.3, "ChampHp": 2.2, "ChampPerDepth": 3, "DmgLin": 0.24, "DmgQuad": 0.02, "DropChance": 12, "GambleBonus": 1, "GamblePerDepth": 30, "GamblePrice": 120, "GoldChance": 30, "GoldPerLvl": 2, "HPPerLvl": 4, "HealCost": 0.5, "HpLin": 0.32, "HpQuad": 0.05, "ManaPerEne": 1.7, "ManaPerLvl": 2, "ManaPotion": 0.4, "MonArmorK": 120, "MonArmorPerLvl": 2, "MonToHitPerLvl": 3, "NovaMul": 1, "PackMul": 1, "PotionHeal": 0.5, "PotionPrice": 20, "PotionPricePerLvl": 4, "QuestGoldPerLvl": 100, "RareBonus": 0.2, "RerollPerDepth": 10, "RerollPrice": 50, "ScrollPrice": 40, "ScrollPricePerLvl": 6, "SellDiv": 12, "StrDiv": 60, "ToHitPerLvl": 0, "XPBase": 35, "XPExp": 1.8}, "score": null, "scoreCI": [0, 0], "fail": "70 stuck runs", "key": {"abyssDeath": 7, "caster.clvl": 12, "caster.deepest": 6, "caster.gold": 2.7464646464646467, "caster.king": 0.59375, "caster.oracle": 0, "fighter.clvl": 10, "fighter.deepest": 5, "fighter.gold": 3.878787878787879, "fighter.king": 0.3958333333333333, "fighter.oracle": 0, "gap": 0.19791666666666669, "stuck": 70}, "change": "bot: a level counts as explored after 40 turns without a new cell", "why": "meant for auto-explore shuttling between frontier cells whose unseen neighbours can never be lit (3 stuck runs in #17, all in the marsh with the grotto mouth seen and reachable); the rule also fired during long fights and errands: 34-36 stuck runs of 96, hard fail", "decision": "revert", "base": "balance/runs/025-income.json", "vsBase": "+NaN (+NaN\u2026+NaN)", "best": "17.35", "bestRun": "balance/runs/025-income.json"}
{"id": 20, "time": "2026-09-30T23:09:14+02:00", "name": "034-base-stale", "run": "balance/runs/034-base-stale.json", "rev": "79571fb", "dirty": true, "code": "f35b97cb21", "bot": "a5e2166859", "first": 1, "seeds": 96, "turns": 20000, "changed": ["ManaPerEne: 1.2 \u2192 1.7", "GoldPerLvl: 3 \u2192 2", "QuestGoldPerLvl: 250 \u2192 100"], "rules": {"AffixLvlScale": 1, "ArmorCap": 0.5, "ArmorK": 50, "ArmorPerLvl": 10, "BoltCostLvl": 0.667, "BoltEnePow": 1, "BoltMul": 1, "BossHpLin": 0.22, "BudgetMul": 7, "ChampBase": 8, "ChampDmg": 1.3, "ChampHp": 2.2, "ChampPerDepth": 3, "DmgLin": 0.24, "DmgQuad": 0.02, "DropChance": 12, "GambleBonus": 1, "GamblePerDepth": 30, "GamblePrice": 120, "GoldChance": 30, "GoldPerLvl": 2, "HPPerLvl": 4, "HealCost": 0.5, "HpLin": 0.32, "HpQuad": 0.05, "ManaPerEne": 1.7, "ManaPerLvl": 2, "ManaPotion": 0.4, "MonArmorK": 120, "MonArmorPerLvl": 2, "MonToHitPerLvl": 3, "NovaMul": 1, "PackMul": 1, "PotionHeal": 0.5, "PotionPrice": 20, "PotionPricePerLvl": 4, "QuestGoldPerLvl": 100, "RareBonus": 0.2, "RerollPerDepth": 10, "RerollPrice": 50, "ScrollPrice": 40, "ScrollPricePerLvl": 6, "SellDiv": 12, "StrDiv": 60, "ToHitPerLvl": 0, "XPBase": 35, "XPExp": 1.8}, "score": null, "scoreCI": [0, 0], "fail": "74 stuck runs", "key": {"abyssDeath": 7, "caster.clvl": 12, "caster.deepest": 6, "caster.gold": 2.683838383838384, "caster.king": 0.5729166666666666, "caster.oracle": 0, "fighter.clvl": 10, "fighter.deepest": 5, "fighter.gold": 3.874242424242424, "fighter.king": 0.3854166666666667, "fighter.oracle": 0, "gap": 0.18749999999999994, "stuck": 74}, "change": "bot: explored after 40 consecutive auto-explore steps without a new cell", "why": "second try at the shuttle; walking back across an explored 150x90 level to a far frontier is longer than 40 steps: 35-39 stuck, hard fail", "decision": "revert", "base": "balance/runs/025-income.json", "vsBase": "+NaN (+NaN\u2026+NaN)", "best": "17.35", "bestRun": "balance/runs/025-income.json"}
{"id": 21, "time": "2026-09-30T23:09:14+02:00", "name": "035-base-spent", "run": "balance/runs/035-base-spent.json", "rev": "79571fb", "dirty": true, "code": "dc82b60979", "bot": "28cc82d4ec", "first": 1, "seeds": 96, "turns": 20000, "changed": ["ManaPerEne: 1.2 \u2192 1.7", "GoldPerLvl: 3 \u2192 2", "QuestGoldPerLvl: 250 \u2192 100"], "rules": {"AffixLvlScale": 1, "ArmorCap": 0.5, "ArmorK": 50, "ArmorPerLvl": 10, "BoltCostLvl": 0.667, "BoltEnePow": 1, "BoltMul": 1, "BossHpLin": 0.22, "BudgetMul": 7, "ChampBase": 8, "ChampDmg": 1.3, "ChampHp": 2.2, "ChampPerDepth": 3, "DmgLin": 0.24, "DmgQuad": 0.02, "DropChance": 12, "GambleBonus": 1, "GamblePerDepth": 30, "GamblePrice": 120, "GoldChance": 30, "GoldPerLvl": 2, "HPPerLvl": 4, "HealCost": 0.5, "HpLin": 0.32, "HpQuad": 0.05, "ManaPerEne": 1.7, "ManaPerLvl": 2, "ManaPotion": 0.4, "MonArmorK": 120, "MonArmorPerLvl": 2, "MonToHitPerLvl": 3, "NovaMul": 1, "PackMul": 1, "PotionHeal": 0.5, "PotionPrice": 20, "PotionPricePerLvl": 4, "QuestGoldPerLvl": 100, "RareBonus": 0.2, "RerollPerDepth": 10, "RerollPrice": 50, "ScrollPrice": 40, "ScrollPricePerLvl": 6, "SellDiv": 12, "StrDiv": 60, "ToHitPerLvl": 0, "XPBase": 35, "XPExp": 1.8}, "score": 17.35287932110951, "scoreCI": [17.008704950405548, 21.203142897042884], "key": {"abyssDeath": 7, "caster.clvl": 13, "caster.deepest": 7, "caster.gold": 2.9681818181818183, "caster.king": 0.8125, "caster.oracle": 0, "fighter.clvl": 12, "fighter.deepest": 6, "fighter.gold": 4.713131313131313, "fighter.king": 0.6666666666666666, "fighter.oracle": 0, "gap": 0.14583333333333337, "stuck": 0}, "change": "code: auto-explore marks the cell it stands on as spent when unseen neighbours stay unseen from there and never targets it again (game.go autoStep, Level.Spent)", "why": "the shuttle fixed where it lives, for the o key too; bit-identical results on the 96 base seeds (score 17.35, no seed differs); the stuck seeds of #17 and #19 are re-run as #22 and #23", "decision": "keep", "base": "balance/runs/025-income.json", "vsBase": "+0.00 (+0.00\u2026+0.00)", "best": "17.35", "bestRun": "balance/runs/025-income.json"}
