{"id":42,"time":"2026-10-01T10:07:18+02:00","name":"059-corridor-portal","run":"balance/runs/059-corridor-portal.json","rev":"db71fc7","dirty":true,"code":"1603f24057","bot":"e4b972891d","first":1,"seeds":96,"turns":20000,"changed":null,"rules":{"AffixLvlScale":1,"ArmorCap":0.5,"ArmorK":50,"ArmorPerLvl":10,"BoltCostLvl":0.667,"BoltEnePow":1,"BoltMul":1,"BossHpLin":0.22,"BudgetMul":7,"ChampBase":8,"ChampDmg":1.3,"ChampHp":2.2,"ChampPerDepth":3,"DmgLin":0.24,"DmgQuad":0.02,"DropChance":12,"GambleBonus":1,"GamblePerDepth":30,"GamblePrice":120,"GoldChance":30,"GoldPerLvl":2,"HPPerLvl":4,"HealCost":0.5,"HpLin":0.32,"HpQuad":0.05,"ManaPerEne":1.7,"ManaPerLvl":2,"ManaPotion":0.4,"MonArmorK":120,"MonArmorPerLvl":2,"MonToHitPerLvl":3,"NovaMul":1,"PackMul":1,"PotionHeal":0.65,"PotionPrice":20,"PotionPricePerLvl":4,"QuestGoldPerLvl":100,"RareBonus":0.2,"RerollPerDepth":10,"RerollPrice":50,"ScrollPrice":40,"ScrollPricePerLvl":6,"SellDiv":12,"StrDiv":45,"ToHitPerLvl":0,"XPBase":35,"XPExp":1.8},"score":13.573369539908011,"scoreCI":[12.992584424628395,16.691973411584307],"key":{"abyssDeath":10,"caster.clvl":14,"caster.deepest":7,"caster.gold":3.0632034632034633,"caster.king":0.9375,"caster.oracle":0.0625,"fighter.clvl":13,"fighter.deepest":7,"fighter.gold":4.906060606060606,"fighter.king":0.8125,"fighter.oracle":0.020833333333333332,"gap":0.125,"stuck":0},"change":"code: readPortal opens the portal on the free cell nearest the hero (was nearest to x+1, so a crowded east side put it two cells away); bot: retreat() backs only into true corridors (\u003c=2 open sides), never a 3-sided cave nook; instrument: scrolls left at death","why":"paired at 96 seeds: score 18.02 -\u003e 13.57 (-4.44, -7.96..-0.81, sure); fighter deepest +0.47, clvl +0.83, kills +26, trips +2.5, potions/lvl +1.1 (all sure), king 0.74 -\u003e 0.81; caster oracle 0 -\u003e 0.06 (sure), king 0.88 -\u003e 0.94, clvl +0.59; grotto3 arrivals 1/2 -\u003e measurable for both; 0 stuck. Deaths become town trips: the escape now reaches the portal","decision":"keep","base":"balance/runs/057-baseline.json","vsBase":"-4.44 (-7.96…-0.81)","best":"13.57","bestRun":"balance/runs/059-corridor-portal.json"}
{"id":43,"time":"2026-10-01T10:12:27+02:00","name":"060-leave-line","run":"balance/runs/060-leave-line.json","rev":"db71fc7","dirty":true,"code":"243d81b580","bot":"c8cee9803e","first":1,"seeds":96,"turns":20000,"changed":null,"rules":{"AffixLvlScale":1,"ArmorCap":0.5,"ArmorK":50,"ArmorPerLvl":10,"BoltCostLvl":0.667,"BoltEnePow":1,"BoltMul":1,"BossHpLin":0.22,"BudgetMul":7,"ChampBase":8,"ChampDmg":1.3,"ChampHp":2.2,"ChampPerDepth":3,"DmgLin":0.24,"DmgQuad":0.02,"DropChance":12,"GambleBonus":1,"GamblePerDepth":30,"GamblePrice":120,"GoldChance":30,"GoldPerLvl":2,"HPPerLvl":4,"HealCost":0.5,"HpLin":0.32,"HpQuad":0.05,"ManaPerEne":1.7,"ManaPerLvl":2,"ManaPotion":0.4,"MonArmorK":120,"MonArmorPerLvl":2,"MonToHitPerLvl":3,"NovaMul":1,"PackMul":1,"PotionHeal":0.65,"PotionPrice":20,"PotionPricePerLvl":4,"QuestGoldPerLvl":100,"RareBonus":0.2,"RerollPerDepth":10,"RerollPrice":50,"ScrollPrice":40,"ScrollPricePerLvl":6,"SellDiv":12,"StrDiv":45,"ToHitPerLvl":0,"XPBase":35,"XPExp":1.8},"score":13.896842093108846,"scoreCI":[13.33324488278213,16.749794036267726],"key":{"abyssDeath":10,"caster.clvl":14,"caster.deepest":7,"caster.gold":3.1640151515151516,"caster.king":0.9270833333333334,"caster.oracle":0.041666666666666664,"fighter.clvl":13,"fighter.deepest":7,"fighter.gold":4.845959595959596,"fighter.king":0.7708333333333334,"fighter.oracle":0,"gap":0.15625,"stuck":0},"change":"bot: leave line rises with attackers (50% + 10 points per adjacent past the first) once the belt is empty; escape reads a fresh scroll unless the open portal is within 2 steps","why":"caster seed 2 read at 33% with 5 adjacent and died in the round after; fighter 3 walked 14 turns to a portal 8 cells off with 7 scrolls in the pack. Together: score 13.57 -\u003e 13.90 (noise), fighter deepest -0.31 (19 up/26 down), king 0.81 -\u003e 0.77, goldHeld -371 (sure): more trips, fewer kills per trip; split in #45","decision":"revert","base":"balance/runs/059-corridor-portal.json","vsBase":"+0.32 (-2.25…+3.08)","best":"13.57","bestRun":"balance/runs/059-corridor-portal.json"}
{"id":44,"time":"2026-10-01T10:12:28+02:00","name":"061-escape-near","run":"balance/runs/061-escape-near.json","rev":"db71fc7","dirty":true,"code":"b1adaa2fb3","bot":"10a0955e29","first":1,"seeds":96,"turns":20000,"changed":null,"rules":{"AffixLvlScale":1,"ArmorCap":0.5,"ArmorK":50,"ArmorPerLvl":10,"BoltCostLvl":0.667,"BoltEnePow":1,"BoltMul":1,"BossHpLin":0.22,"BudgetMul":7,"ChampBase":8,"ChampDmg":1.3,"ChampHp":2.2,"ChampPerDepth":3,"DmgLin":0.24,"DmgQuad":0.02,"DropChance":12,"GambleBonus":1,"GamblePerDepth":30,"GamblePrice":120,"GoldChance":30,"GoldPerLvl":2,"HPPerLvl":4,"HealCost":0.5,"HpLin":0.32,"HpQuad":0.05,"ManaPerEne":1.7,"ManaPerLvl":2,"ManaPotion":0.4,"MonArmorK":120,"MonArmorPerLvl":2,"MonToHitPerLvl":3,"NovaMul":1,"PackMul":1,"PotionHeal":0.65,"PotionPrice":20,"PotionPricePerLvl":4,"QuestGoldPerLvl":100,"RareBonus":0.2,"RerollPerDepth":10,"RerollPrice":50,"ScrollPrice":40,"ScrollPricePerLvl":6,"SellDiv":12,"StrDiv":45,"ToHitPerLvl":0,"XPBase":35,"XPExp":1.8},"score":13.319624757105501,"scoreCI":[12.77352965539751,16.78949933842488],"key":{"abyssDeath":10,"caster.clvl":14,"caster.deepest":7,"caster.gold":3.0793939393939396,"caster.king":0.9270833333333334,"caster.oracle":0.08333333333333333,"fighter.clvl":13,"fighter.deepest":7,"fighter.gold":4.880952380952381,"fighter.king":0.7708333333333334,"fighter.oracle":0.020833333333333332,"gap":0.15625,"stuck":0},"change":"bot: escape reads a fresh scroll unless the open portal is within 2 steps along known ground (was: walk to it when within 8 cells); the leave line stays at 50%","why":"the escape half of #44 alone: 7 fighter seeds and 16 caster seeds differ; score 13.57 -\u003e 13.32 (noise); deaths with a scroll in hand 61 -\u003e 36 (fighter), 45 -\u003e 31 (caster), as intended; fighter clvl -0.19 and king -0.04 on those 7 seeds (0 up), caster deepest +0.07. Deaths now end broke: 60/65 of 96 die with 0 scrolls and ~30g; the grotto economy is the wall","decision":"keep","base":"balance/runs/059-corridor-portal.json","vsBase":"-0.25 (-0.69…+0.65)","best":"13.32","bestRun":"balance/runs/061-escape-near.json"}
{"id":45,"time":"2026-10-01T10:15:54+02:00","name":"062-potionprice","run":"balance/runs/062-potionprice.json","rev":"db71fc7","dirty":true,"code":"b1adaa2fb3","bot":"10a0955e29","first":1,"seeds":96,"turns":20000,"changed":["PotionPricePerLvl: 4 → 2"],"rules":{"AffixLvlScale":1,"ArmorCap":0.5,"ArmorK":50,"ArmorPerLvl":10,"BoltCostLvl":0.667,"BoltEnePow":1,"BoltMul":1,"BossHpLin":0.22,"BudgetMul":7,"ChampBase":8,"ChampDmg":1.3,"ChampHp":2.2,"ChampPerDepth":3,"DmgLin":0.24,"DmgQuad":0.02,"DropChance":12,"GambleBonus":1,"GamblePerDepth":30,"GamblePrice":120,"GoldChance":30,"GoldPerLvl":2,"HPPerLvl":4,"HealCost":0.5,"HpLin":0.32,"HpQuad":0.05,"ManaPerEne":1.7,"ManaPerLvl":2,"ManaPotion":0.4,"MonArmorK":120,"MonArmorPerLvl":2,"MonToHitPerLvl":3,"NovaMul":1,"PackMul":1,"PotionHeal":0.65,"PotionPrice":20,"PotionPricePerLvl":2,"QuestGoldPerLvl":100,"RareBonus":0.2,"RerollPerDepth":10,"RerollPrice":50,"ScrollPrice":40,"ScrollPricePerLvl":6,"SellDiv":12,"StrDiv":45,"ToHitPerLvl":0,"XPBase":35,"XPExp":1.8},"score":14.18297001869033,"scoreCI":[13.602249079899531,16.745640924006064],"key":{"abyssDeath":10,"caster.clvl":14,"caster.deepest":7,"caster.gold":3.635497835497836,"caster.king":0.90625,"caster.oracle":0.0625,"fighter.clvl":13,"fighter.deepest":7,"fighter.gold":5.084343434343434,"fighter.king":0.8229166666666666,"fighter.oracle":0,"gap":0.08333333333333337,"stuck":0},"change":"rules: PotionPricePerLvl 4 -\u003e 2","why":"cheaper deep potions for the broke grotto trips: score 13.32 -\u003e 14.18 (noise), fighter king +0.05, caster -0.02, nothing in progress; surplus/lvl +69/+189 (sure) only widens the gold miss","decision":"revert","base":"balance/runs/061-escape-near.json","vsBase":"+0.86 (-2.23…+3.08)","best":"13.32","bestRun":"balance/runs/061-escape-near.json"}
{"id":46,"time":"2026-10-01T10:15:55+02:00","name":"063-champhp","run":"balance/runs/063-champhp.json","rev":"db71fc7","dirty":true,"code":"b1adaa2fb3","bot":"10a0955e29","first":1,"seeds":96,"turns":20000,"changed":["ChampHp: 2.2 → 1.8"],"rules":{"AffixLvlScale":1,"ArmorCap":0.5,"ArmorK":50,"ArmorPerLvl":10,"BoltCostLvl":0.667,"BoltEnePow":1,"BoltMul":1,"BossHpLin":0.22,"BudgetMul":7,"ChampBase":8,"ChampDmg":1.3,"ChampHp":1.8,"ChampPerDepth":3,"DmgLin":0.24,"DmgQuad":0.02,"DropChance":12,"GambleBonus":1,"GamblePerDepth":30,"GamblePrice":120,"GoldChance":30,"GoldPerLvl":2,"HPPerLvl":4,"HealCost":0.5,"HpLin":0.32,"HpQuad":0.05,"ManaPerEne":1.7,"ManaPerLvl":2,"ManaPotion":0.4,"MonArmorK":120,"MonArmorPerLvl":2,"MonToHitPerLvl":3,"NovaMul":1,"PackMul":1,"PotionHeal":0.65,"PotionPrice":20,"PotionPricePerLvl":4,"QuestGoldPerLvl":100,"RareBonus":0.2,"RerollPerDepth":10,"RerollPrice":50,"ScrollPrice":40,"ScrollPricePerLvl":6,"SellDiv":12,"StrDiv":45,"ToHitPerLvl":0,"XPBase":35,"XPExp":1.8},"score":13.862177852816902,"scoreCI":[13.403984840563771,15.075993712712094],"key":{"abyssDeath":10,"caster.clvl":14,"caster.deepest":7,"caster.gold":3.352727272727273,"caster.king":0.96875,"caster.oracle":0.052083333333333336,"fighter.clvl":13,"fighter.deepest":7,"fighter.gold":4.947186147186147,"fighter.king":0.8333333333333334,"fighter.oracle":0.03125,"gap":0.13541666666666663,"stuck":0},"change":"rules: ChampHp 2.2 -\u003e 1.8","why":"with the escape working, weaker champions now reach the fighter too: clvl +0.80 (sure), deepest +0.42, king 0.77 -\u003e 0.83; caster deepest +0.41 (sure), king 0.93 -\u003e 0.97 (over the band); oracle flat 0.02/0.08 -\u003e 0.03/0.05; score 13.32 -\u003e 13.86 (noise) because the caster's king overshoot pays for the fighter's gain. The lever works on both builds now; not kept alone, revisited with the pack-structure runs","decision":"revert","base":"balance/runs/061-escape-near.json","vsBase":"+0.54 (-2.47…+1.72)","best":"13.32","bestRun":"balance/runs/061-escape-near.json"}
{"id":47,"time":"2026-10-01T10:15:55+02:00","name":"064-goldperlvl","run":"balance/runs/064-goldperlvl.json","rev":"db71fc7","dirty":true,"code":"b1adaa2fb3","bot":"10a0955e29","first":1,"seeds":96,"turns":20000,"changed":["GoldPerLvl: 2 → 3"],"rules":{"AffixLvlScale":1,"ArmorCap":0.5,"ArmorK":50,"ArmorPerLvl":10,"BoltCostLvl":0.667,"BoltEnePow":1,"BoltMul":1,"BossHpLin":0.22,"BudgetMul":7,"ChampBase":8,"ChampDmg":1.3,"ChampHp":2.2,"ChampPerDepth":3,"DmgLin":0.24,"DmgQuad":0.02,"DropChance":12,"GambleBonus":1,"GamblePerDepth":30,"GamblePrice":120,"GoldChance":30,"GoldPerLvl":3,"HPPerLvl":4,"HealCost":0.5,"HpLin":0.32,"HpQuad":0.05,"ManaPerEne":1.7,"ManaPerLvl":2,"ManaPotion":0.4,"MonArmorK":120,"MonArmorPerLvl":2,"MonToHitPerLvl":3,"NovaMul":1,"PackMul":1,"PotionHeal":0.65,"PotionPrice":20,"PotionPricePerLvl":4,"QuestGoldPerLvl":100,"RareBonus":0.2,"RerollPerDepth":10,"RerollPrice":50,"ScrollPrice":40,"ScrollPricePerLvl":6,"SellDiv":12,"StrDiv":45,"ToHitPerLvl":0,"XPBase":35,"XPExp":1.8},"score":14.640421268405412,"scoreCI":[14.09692111128328,15.530536746343492],"key":{"abyssDeath":10,"caster.clvl":14,"caster.deepest":7,"caster.gold":4.042929292929293,"caster.king":0.9270833333333334,"caster.oracle":0.052083333333333336,"fighter.clvl":13,"fighter.deepest":7,"fighter.gold":5.826767676767677,"fighter.king":0.84375,"fighter.oracle":0.03125,"gap":0.08333333333333337,"stuck":0},"change":"rules: GoldPerLvl 2 -\u003e 3","why":"the fighter buys its way through the grotto: deepest +0.35, clvl +0.64, goldIn +2700, all sure, king 0.77 -\u003e 0.84; caster flat; surplus/lvl +303/+272 (sure) costs the gold band more than the progress earns: score 13.32 -\u003e 14.64 (noise). Income is the wrong lever while the band stands; what the grotto needs is cheaper survival, not more gold","decision":"revert","base":"balance/runs/061-escape-near.json","vsBase":"+1.32 (-1.94…+2.33)","best":"13.32","bestRun":"balance/runs/061-escape-near.json"}
{"id":48,"time":"2026-10-01T10:15:56+02:00","name":"065-hpperlvl","run":"balance/runs/065-hpperlvl.json","rev":"db71fc7","dirty":true,"code":"b1adaa2fb3","bot":"10a0955e29","first":1,"seeds":96,"turns":20000,"changed":["HPPerLvl: 4 → 6"],"rules":{"AffixLvlScale":1,"ArmorCap":0.5,"ArmorK":50,"ArmorPerLvl":10,"BoltCostLvl":0.667,"BoltEnePow":1,"BoltMul":1,"BossHpLin":0.22,"BudgetMul":7,"ChampBase":8,"ChampDmg":1.3,"ChampHp":2.2,"ChampPerDepth":3,"DmgLin":0.24,"DmgQuad":0.02,"DropChance":12,"GambleBonus":1,"GamblePerDepth":30,"GamblePrice":120,"GoldChance":30,"GoldPerLvl":2,"HPPerLvl":6,"HealCost":0.5,"HpLin":0.32,"HpQuad":0.05,"ManaPerEne":1.7,"ManaPerLvl":2,"ManaPotion":0.4,"MonArmorK":120,"MonArmorPerLvl":2,"MonToHitPerLvl":3,"NovaMul":1,"PackMul":1,"PotionHeal":0.65,"PotionPrice":20,"PotionPricePerLvl":4,"QuestGoldPerLvl":100,"RareBonus":0.2,"RerollPerDepth":10,"RerollPrice":50,"ScrollPrice":40,"ScrollPricePerLvl":6,"SellDiv":12,"StrDiv":45,"ToHitPerLvl":0,"XPBase":35,"XPExp":1.8},"score":13.71433126038105,"scoreCI":[12.762506687749198,14.654578539258122],"key":{"abyssDeath":10,"caster.clvl":14,"caster.deepest":7,"caster.gold":3.066666666666667,"caster.king":0.8958333333333334,"caster.oracle":0.0625,"fighter.clvl":13,"fighter.deepest":7,"fighter.gold":5.058441558441558,"fighter.king":0.8020833333333334,"fighter.oracle":0.020833333333333332,"gap":0.09375,"stuck":0},"change":"rules: HPPerLvl 4 -\u003e 6","why":"shared life: fighter deepest +0.25 (34 up/30 down), caster -0.11, potions/lvl -0.55 (sure) for the caster; score 13.32 -\u003e 13.71 (noise); +24 life at grotto1 is 9% and buys nothing measurable","decision":"revert","base":"balance/runs/061-escape-near.json","vsBase":"+0.39 (-2.90…+1.34)","best":"13.32","bestRun":"balance/runs/061-escape-near.json"}
{"id":49,"time":"2026-10-01T10:19:16+02:00","name":"066-packmul","run":"balance/runs/066-packmul.json","rev":"db71fc7","dirty":true,"code":"b1adaa2fb3","bot":"10a0955e29","first":1,"seeds":96,"turns":20000,"changed":["PackMul: 1 → 0.8"],"rules":{"AffixLvlScale":1,"ArmorCap":0.5,"ArmorK":50,"ArmorPerLvl":10,"BoltCostLvl":0.667,"BoltEnePow":1,"BoltMul":1,"BossHpLin":0.22,"BudgetMul":7,"ChampBase":8,"ChampDmg":1.3,"ChampHp":2.2,"ChampPerDepth":3,"DmgLin":0.24,"DmgQuad":0.02,"DropChance":12,"GambleBonus":1,"GamblePerDepth":30,"GamblePrice":120,"GoldChance":30,"GoldPerLvl":2,"HPPerLvl":4,"HealCost":0.5,"HpLin":0.32,"HpQuad":0.05,"ManaPerEne":1.7,"ManaPerLvl":2,"ManaPotion":0.4,"MonArmorK":120,"MonArmorPerLvl":2,"MonToHitPerLvl":3,"NovaMul":1,"PackMul":0.8,"PotionHeal":0.65,"PotionPrice":20,"PotionPricePerLvl":4,"QuestGoldPerLvl":100,"RareBonus":0.2,"RerollPerDepth":10,"RerollPrice":50,"ScrollPrice":40,"ScrollPricePerLvl":6,"SellDiv":12,"StrDiv":45,"ToHitPerLvl":0,"XPBase":35,"XPExp":1.8},"score":16.925361685425834,"scoreCI":[16.040549056275765,18.111359668578093],"key":{"abyssDeath":10,"caster.clvl":13,"caster.deepest":7,"caster.gold":2.9510101010101013,"caster.king":0.9375,"caster.oracle":0.0625,"fighter.clvl":12,"fighter.deepest":7,"fighter.gold":4.349494949494949,"fighter.king":0.8541666666666666,"fighter.oracle":0.041666666666666664,"gap":0.08333333333333337,"stuck":1},"change":"rules: PackMul 1 -\u003e 0.8 (spider 2-4 -\u003e 1-3, drowned 2-3 -\u003e 1-2, skeleton 2-4 -\u003e 1-3)","why":"fighter deepest +0.49 (sure), king 0.77 -\u003e 0.85, but score 13.32 -\u003e 16.93 (+0.16..+4.72, sure worse): caster clvl -0.85, goldIn -2035, trips -4 (all sure) as a third of the monsters and their XP go, and the crypt pack bands move further out","decision":"revert","base":"balance/runs/061-escape-near.json","vsBase":"+3.61 (+0.16…+4.72)","best":"13.32","bestRun":"balance/runs/061-escape-near.json"}
{"id":50,"time":"2026-10-01T10:19:16+02:00","name":"067-montohit","run":"balance/runs/067-montohit.json","rev":"db71fc7","dirty":true,"code":"b1adaa2fb3","bot":"10a0955e29","first":1,"seeds":96,"turns":20000,"changed":["MonToHitPerLvl: 3 → 2"],"rules":{"AffixLvlScale":1,"ArmorCap":0.5,"ArmorK":50,"ArmorPerLvl":10,"BoltCostLvl":0.667,"BoltEnePow":1,"BoltMul":1,"BossHpLin":0.22,"BudgetMul":7,"ChampBase":8,"ChampDmg":1.3,"ChampHp":2.2,"ChampPerDepth":3,"DmgLin":0.24,"DmgQuad":0.02,"DropChance":12,"GambleBonus":1,"GamblePerDepth":30,"GamblePrice":120,"GoldChance":30,"GoldPerLvl":2,"HPPerLvl":4,"HealCost":0.5,"HpLin":0.32,"HpQuad":0.05,"ManaPerEne":1.7,"ManaPerLvl":2,"ManaPotion":0.4,"MonArmorK":120,"MonArmorPerLvl":2,"MonToHitPerLvl":2,"NovaMul":1,"PackMul":1,"PotionHeal":0.65,"PotionPrice":20,"PotionPricePerLvl":4,"QuestGoldPerLvl":100,"RareBonus":0.2,"RerollPerDepth":10,"RerollPrice":50,"ScrollPrice":40,"ScrollPricePerLvl":6,"SellDiv":12,"StrDiv":45,"ToHitPerLvl":0,"XPBase":35,"XPExp":1.8},"score":14.009291174177243,"scoreCI":[13.219165268634377,15.04772963776352],"key":{"abyssDeath":10,"caster.clvl":14,"caster.deepest":7,"caster.gold":2.9445887445887444,"caster.king":0.9270833333333334,"caster.oracle":0.041666666666666664,"fighter.clvl":13,"fighter.deepest":7,"fighter.gold":5.004924242424242,"fighter.king":0.8229166666666666,"fighter.oracle":0.010416666666666666,"gap":0.10416666666666674,"stuck":0},"change":"rules: MonToHitPerLvl 3 -\u003e 2 (monster to-hit 76 -\u003e 69 at depth 7)","why":"fighter clvl +0.51, king +0.05 (38 up/27 down), caster flat, oracle 0.08 -\u003e 0.04; score 13.32 -\u003e 14.01 (noise); a 9% cut in blows landing at the grotto is not the wall","decision":"revert","base":"balance/runs/061-escape-near.json","vsBase":"+0.69 (-2.46…+1.73)","best":"13.32","bestRun":"balance/runs/061-escape-near.json"}
{"id":51,"time":"2026-10-01T10:19:17+02:00","name":"070-champdmg","run":"balance/runs/070-champdmg.json","rev":"db71fc7","dirty":true,"code":"b1adaa2fb3","bot":"10a0955e29","first":1,"seeds":96,"turns":20000,"changed":["ChampDmg: 1.3 → 1.2"],"rules":{"AffixLvlScale":1,"ArmorCap":0.5,"ArmorK":50,"ArmorPerLvl":10,"BoltCostLvl":0.667,"BoltEnePow":1,"BoltMul":1,"BossHpLin":0.22,"BudgetMul":7,"ChampBase":8,"ChampDmg":1.2,"ChampHp":2.2,"ChampPerDepth":3,"DmgLin":0.24,"DmgQuad":0.02,"DropChance":12,"GambleBonus":1,"GamblePerDepth":30,"GamblePrice":120,"GoldChance":30,"GoldPerLvl":2,"HPPerLvl":4,"HealCost":0.5,"HpLin":0.32,"HpQuad":0.05,"ManaPerEne":1.7,"ManaPerLvl":2,"ManaPotion":0.4,"MonArmorK":120,"MonArmorPerLvl":2,"MonToHitPerLvl":3,"NovaMul":1,"PackMul":1,"PotionHeal":0.65,"PotionPrice":20,"PotionPricePerLvl":4,"QuestGoldPerLvl":100,"RareBonus":0.2,"RerollPerDepth":10,"RerollPrice":50,"ScrollPrice":40,"ScrollPricePerLvl":6,"SellDiv":12,"StrDiv":45,"ToHitPerLvl":0,"XPBase":35,"XPExp":1.8},"score":13.699044479889588,"scoreCI":[12.968456132848312,14.670951050445181],"key":{"abyssDeath":10,"caster.clvl":14,"caster.deepest":7,"caster.gold":3.2075757575757575,"caster.king":0.9166666666666666,"caster.oracle":0.041666666666666664,"fighter.clvl":13,"fighter.deepest":7,"fighter.gold":4.933333333333334,"fighter.king":0.8229166666666666,"fighter.oracle":0.03125,"gap":0.09375,"stuck":0},"change":"rules: ChampDmg 1.3 -\u003e 1.2","why":"fighter clvl +0.43, king +0.05, caster flat, oracle 0.08 -\u003e 0.04; score +0.38 (noise); champion damage is not what ends the grotto runs","decision":"revert","base":"balance/runs/061-escape-near.json","vsBase":"+0.38 (-2.68…+1.26)","best":"13.32","bestRun":"balance/runs/061-escape-near.json"}
{"id":52,"time":"2026-10-01T10:19:17+02:00","name":"068-champ-leader","run":"balance/runs/068-champ-leader.json","rev":"db71fc7","dirty":true,"code":"b727adf809","bot":"10a0955e29","first":1,"seeds":96,"turns":20000,"changed":null,"rules":{"AffixLvlScale":1,"ArmorCap":0.5,"ArmorK":50,"ArmorPerLvl":10,"BoltCostLvl":0.667,"BoltEnePow":1,"BoltMul":1,"BossHpLin":0.22,"BudgetMul":7,"ChampBase":8,"ChampDmg":1.3,"ChampHp":2.2,"ChampPerDepth":3,"DmgLin":0.24,"DmgQuad":0.02,"DropChance":12,"GambleBonus":1,"GamblePerDepth":30,"GamblePrice":120,"GoldChance":30,"GoldPerLvl":2,"HPPerLvl":4,"HealCost":0.5,"HpLin":0.32,"HpQuad":0.05,"ManaPerEne":1.7,"ManaPerLvl":2,"ManaPotion":0.4,"MonArmorK":120,"MonArmorPerLvl":2,"MonToHitPerLvl":3,"NovaMul":1,"PackMul":1,"PotionHeal":0.65,"PotionPrice":20,"PotionPricePerLvl":4,"QuestGoldPerLvl":100,"RareBonus":0.2,"RerollPerDepth":10,"RerollPrice":50,"ScrollPrice":40,"ScrollPricePerLvl":6,"SellDiv":12,"StrDiv":45,"ToHitPerLvl":0,"XPBase":35,"XPExp":1.8},"score":11.557678959001016,"scoreCI":[11.157542349285528,14.339954067724166],"key":{"abyssDeath":10,"caster.clvl":13,"caster.deepest":7,"caster.gold":2.0535353535353535,"caster.king":0.9375,"caster.oracle":0.03125,"fighter.clvl":12,"fighter.deepest":7,"fighter.gold":3.365656565656566,"fighter.king":0.7916666666666666,"fighter.oracle":0,"gap":0.14583333333333337,"stuck":0},"change":"code: a champion pack is one champion leading normals (was: every member a champion), monsters.go populate","why":"score 13.32 -\u003e 11.56 (-4.83..+0.89) but all of it is the gold band: goldIn -2988/-4265 and surplus/lvl -435/-396 (sure) as two thirds of the champion drops and XP go, clvl -0.52/-1.09; deepest 6.44 -\u003e 6.49 and 7.12 -\u003e 7.01, oracle 0.02/0.08 -\u003e 0/0.03. The grotto kills at the same depth with one champion a pack as with three: champion packs are not the binding constraint. Code reverted","decision":"revert","base":"balance/runs/061-escape-near.json","vsBase":"-1.76 (-4.83…+0.89)","best":"13.32","bestRun":"balance/runs/061-escape-near.json"}
