{"id": 22, "time": "2026-09-30T23:10:06+02:00", "name": "037-strdiv", "run": "balance/runs/037-strdiv.json", "rev": "79571fb", "dirty": true, "code": "dc82b60979", "bot": "28cc82d4ec", "first": 1, "seeds": 96, "turns": 20000, "changed": ["StrDiv: 60 \u2192 45", "ManaPerEne: 1.2 \u2192 1.7", "GoldPerLvl: 3 \u2192 2", "QuestGoldPerLvl: 250 \u2192 100"], "rules": {"AffixLvlScale": 1, "ArmorCap": 0.5, "ArmorK": 50, "ArmorPerLvl": 10, "BoltCostLvl": 0.667, "BoltEnePow": 1, "BoltMul": 1, "BossHpLin": 0.22, "BudgetMul": 7, "ChampBase": 8, "ChampDmg": 1.3, "ChampHp": 2.2, "ChampPerDepth": 3, "DmgLin": 0.24, "DmgQuad": 0.02, "DropChance": 12, "GambleBonus": 1, "GamblePerDepth": 30, "GamblePrice": 120, "GoldChance": 30, "GoldPerLvl": 2, "HPPerLvl": 4, "HealCost": 0.5, "HpLin": 0.32, "HpQuad": 0.05, "ManaPerEne": 1.7, "ManaPerLvl": 2, "ManaPotion": 0.4, "MonArmorK": 120, "MonArmorPerLvl": 2, "MonToHitPerLvl": 3, "NovaMul": 1, "PackMul": 1, "PotionHeal": 0.5, "PotionPrice": 20, "PotionPricePerLvl": 4, "QuestGoldPerLvl": 100, "RareBonus": 0.2, "RerollPerDepth": 10, "RerollPrice": 50, "ScrollPrice": 40, "ScrollPricePerLvl": 6, "SellDiv": 12, "StrDiv": 45, "ToHitPerLvl": 0, "XPBase": 35, "XPExp": 1.8}, "score": 17.972676896201257, "scoreCI": [17.691462403192613, 21.184748300524383], "key": {"abyssDeath": 7, "caster.clvl": 13, "caster.deepest": 7, "caster.gold": 3.055050505050505, "caster.king": 0.8125, "caster.oracle": 0, "fighter.clvl": 12, "fighter.deepest": 7, "fighter.gold": 4.91010101010101, "fighter.king": 0.71875, "fighter.oracle": 0, "gap": 0.09375, "stuck": 2}, "change": "rules: StrDiv 60 -> 45 (melee multiplier 1 + STR/45)", "why": "the fighter's only build-specific lever besides melee to-hit and monster armor (both tried, no effect): +15% melee at crypt4, +17% at grotto1, +6% for a caster that rarely swings. Paired at 96 seeds: fighter king 0.67 -> 0.72 (21 up/16 down), clvl +0.57, deepest +0.24, caster unchanged, gap 0.15 -> 0.09; score +0.62 (noise) because fighter.kills.crypt4 2.94 -> 2.59 drops under the 3-5 band. The build gap was the target; kept", "decision": "keep", "base": "balance/runs/035-base-spent.json", "vsBase": "+0.62 (-2.59\u2026+3.06)", "best": "17.35", "bestRun": "balance/runs/025-income.json"}
{"id": 23, "time": "2026-09-30T23:10:07+02:00", "name": "036-income-sell", "run": "balance/runs/036-income-sell.json", "rev": "79571fb", "dirty": true, "code": "dc82b60979", "bot": "28cc82d4ec", "first": 1, "seeds": 96, "turns": 20000, "changed": ["ManaPerEne: 1.2 \u2192 1.7", "GoldPerLvl: 3 \u2192 2", "SellDiv: 12 \u2192 24", "QuestGoldPerLvl: 250 \u2192 100"], "rules": {"AffixLvlScale": 1, "ArmorCap": 0.5, "ArmorK": 50, "ArmorPerLvl": 10, "BoltCostLvl": 0.667, "BoltEnePow": 1, "BoltMul": 1, "BossHpLin": 0.22, "BudgetMul": 7, "ChampBase": 8, "ChampDmg": 1.3, "ChampHp": 2.2, "ChampPerDepth": 3, "DmgLin": 0.24, "DmgQuad": 0.02, "DropChance": 12, "GambleBonus": 1, "GamblePerDepth": 30, "GamblePrice": 120, "GoldChance": 30, "GoldPerLvl": 2, "HPPerLvl": 4, "HealCost": 0.5, "HpLin": 0.32, "HpQuad": 0.05, "ManaPerEne": 1.7, "ManaPerLvl": 2, "ManaPotion": 0.4, "MonArmorK": 120, "MonArmorPerLvl": 2, "MonToHitPerLvl": 3, "NovaMul": 1, "PackMul": 1, "PotionHeal": 0.5, "PotionPrice": 20, "PotionPricePerLvl": 4, "QuestGoldPerLvl": 100, "RareBonus": 0.2, "RerollPerDepth": 10, "RerollPrice": 50, "ScrollPrice": 40, "ScrollPricePerLvl": 6, "SellDiv": 24, "StrDiv": 60, "ToHitPerLvl": 0, "XPBase": 35, "XPExp": 1.8}, "score": null, "scoreCI": [0, 0], "fail": "3 stuck runs", "key": {"abyssDeath": 6, "caster.clvl": 12, "caster.deepest": 7, "caster.gold": 1.4252525252525252, "caster.king": 0.6979166666666666, "caster.oracle": 0, "fighter.clvl": 11, "fighter.deepest": 6, "fighter.gold": 2.9053030303030303, "fighter.king": 0.5729166666666666, "fighter.oracle": 0, "gap": 0.125, "stuck": 3}, "change": "rules: #16 again with the explore fix (income cut + SellDiv 24)", "why": "identical numbers to #16 and still 3 stuck runs: the stuck runs were not the frontier shuttle; traced next. Even scored, the cut costs power: caster deepest -0.58 and clvl -1.06 (sure), fighter king 0.67 -> 0.57; sells are the gear budget. Try pricing the sinks instead of cutting income", "decision": "revert", "base": "balance/runs/035-base-spent.json", "vsBase": "+NaN (+NaN\u2026+NaN)", "best": "17.35", "bestRun": "balance/runs/025-income.json"}
{"id": 24, "time": "2026-09-30T23:17:15+02:00", "name": "040-dmgshape", "run": "balance/runs/040-dmgshape.json", "rev": "79571fb", "dirty": true, "code": "7630da92d5", "bot": "d3e8954136", "first": 1, "seeds": 96, "turns": 20000, "changed": ["StrDiv: 60 \u2192 45", "ManaPerEne: 1.2 \u2192 1.7", "DmgLin: 0.24 \u2192 0.26", "DmgQuad: 0.02 \u2192 0.015", "GoldPerLvl: 3 \u2192 2", "QuestGoldPerLvl: 250 \u2192 100"], "rules": {"AffixLvlScale": 1, "ArmorCap": 0.5, "ArmorK": 50, "ArmorPerLvl": 10, "BoltCostLvl": 0.667, "BoltEnePow": 1, "BoltMul": 1, "BossHpLin": 0.22, "BudgetMul": 7, "ChampBase": 8, "ChampDmg": 1.3, "ChampHp": 2.2, "ChampPerDepth": 3, "DmgLin": 0.26, "DmgQuad": 0.015, "DropChance": 12, "GambleBonus": 1, "GamblePerDepth": 30, "GamblePrice": 120, "GoldChance": 30, "GoldPerLvl": 2, "HPPerLvl": 4, "HealCost": 0.5, "HpLin": 0.32, "HpQuad": 0.05, "ManaPerEne": 1.7, "ManaPerLvl": 2, "ManaPotion": 0.4, "MonArmorK": 120, "MonArmorPerLvl": 2, "MonToHitPerLvl": 3, "NovaMul": 1, "PackMul": 1, "PotionHeal": 0.5, "PotionPrice": 20, "PotionPricePerLvl": 4, "QuestGoldPerLvl": 100, "RareBonus": 0.2, "RerollPerDepth": 10, "RerollPrice": 50, "ScrollPrice": 40, "ScrollPricePerLvl": 6, "SellDiv": 12, "StrDiv": 45, "ToHitPerLvl": 0, "XPBase": 35, "XPExp": 1.8}, "score": 18.609081332377045, "scoreCI": [17.559298864957203, 21.322694670552885], "key": {"abyssDeath": 7, "caster.clvl": 13, "caster.deepest": 7, "caster.gold": 3.106060606060606, "caster.king": 0.8229166666666666, "caster.oracle": 0, "fighter.clvl": 12, "fighter.deepest": 7, "fighter.gold": 4.8106060606060606, "fighter.king": 0.71875, "fighter.oracle": 0, "gap": 0.10416666666666663, "stuck": 1}, "change": "rules: DmgQuad 0.02 -> 0.015, DmgLin 0.24 -> 0.26 on #24", "why": "flatter deep damage (-5% at grotto1, -13% at abyss2, +2% at crypt2): nothing moved (fighter king 6 up/6 down), score +0.64; the grotto wall is not a 5-10% number", "decision": "revert", "base": "balance/runs/038-best.json", "vsBase": "+0.64 (-2.62\u2026+3.08)", "best": "17.35", "bestRun": "balance/runs/025-income.json"}
{"id": 25, "time": "2026-09-30T23:17:16+02:00", "name": "041-hpshape", "run": "balance/runs/041-hpshape.json", "rev": "79571fb", "dirty": true, "code": "7630da92d5", "bot": "d3e8954136", "first": 1, "seeds": 96, "turns": 20000, "changed": ["StrDiv: 60 \u2192 45", "ManaPerEne: 1.2 \u2192 1.7", "HpLin: 0.32 \u2192 0.35", "HpQuad: 0.05 \u2192 0.04", "GoldPerLvl: 3 \u2192 2", "QuestGoldPerLvl: 250 \u2192 100"], "rules": {"AffixLvlScale": 1, "ArmorCap": 0.5, "ArmorK": 50, "ArmorPerLvl": 10, "BoltCostLvl": 0.667, "BoltEnePow": 1, "BoltMul": 1, "BossHpLin": 0.22, "BudgetMul": 7, "ChampBase": 8, "ChampDmg": 1.3, "ChampHp": 2.2, "ChampPerDepth": 3, "DmgLin": 0.24, "DmgQuad": 0.02, "DropChance": 12, "GambleBonus": 1, "GamblePerDepth": 30, "GamblePrice": 120, "GoldChance": 30, "GoldPerLvl": 2, "HPPerLvl": 4, "HealCost": 0.5, "HpLin": 0.35, "HpQuad": 0.04, "ManaPerEne": 1.7, "ManaPerLvl": 2, "ManaPotion": 0.4, "MonArmorK": 120, "MonArmorPerLvl": 2, "MonToHitPerLvl": 3, "NovaMul": 1, "PackMul": 1, "PotionHeal": 0.5, "PotionPrice": 20, "PotionPricePerLvl": 4, "QuestGoldPerLvl": 100, "RareBonus": 0.2, "RerollPerDepth": 10, "RerollPrice": 50, "ScrollPrice": 40, "ScrollPricePerLvl": 6, "SellDiv": 12, "StrDiv": 45, "ToHitPerLvl": 0, "XPBase": 35, "XPExp": 1.8}, "score": 18.94916758126489, "scoreCI": [17.065812201154557, 22.851233669946428], "key": {"abyssDeath": 10, "caster.clvl": 13, "caster.deepest": 7, "caster.gold": 3.2045454545454546, "caster.king": 0.8333333333333334, "caster.oracle": 0.010416666666666666, "fighter.clvl": 12, "fighter.deepest": 6, "fighter.gold": 4.566666666666666, "fighter.king": 0.6354166666666666, "fighter.oracle": 0, "gap": 0.19791666666666674, "stuck": 2}, "change": "rules: HpQuad 0.05 -> 0.04, HpLin 0.32 -> 0.35 on #24", "why": "flatter deep life: fighter king 0.72 -> 0.64, deepest -0.33, gap 0.09 -> 0.20, score +0.98; more early life for monsters costs the fighter, less deep life buys nothing measurable", "decision": "revert", "base": "balance/runs/038-best.json", "vsBase": "+0.98 (-2.69\u2026+4.47)", "best": "17.35", "bestRun": "balance/runs/025-income.json"}
{"id": 26, "time": "2026-09-30T23:17:16+02:00", "name": "039-sinks", "run": "balance/runs/039-sinks.json", "rev": "79571fb", "dirty": true, "code": "7630da92d5", "bot": "d3e8954136", "first": 1, "seeds": 96, "turns": 20000, "changed": ["StrDiv: 60 \u2192 45", "ManaPerEne: 1.2 \u2192 1.7", "GoldPerLvl: 3 \u2192 2", "SellDiv: 12 \u2192 16", "QuestGoldPerLvl: 250 \u2192 100", "RerollPrice: 50 \u2192 100", "RerollPerDepth: 10 \u2192 20", "GamblePrice: 120 \u2192 200", "GamblePerDepth: 30 \u2192 50"], "rules": {"AffixLvlScale": 1, "ArmorCap": 0.5, "ArmorK": 50, "ArmorPerLvl": 10, "BoltCostLvl": 0.667, "BoltEnePow": 1, "BoltMul": 1, "BossHpLin": 0.22, "BudgetMul": 7, "ChampBase": 8, "ChampDmg": 1.3, "ChampHp": 2.2, "ChampPerDepth": 3, "DmgLin": 0.24, "DmgQuad": 0.02, "DropChance": 12, "GambleBonus": 1, "GamblePerDepth": 50, "GamblePrice": 200, "GoldChance": 30, "GoldPerLvl": 2, "HPPerLvl": 4, "HealCost": 0.5, "HpLin": 0.32, "HpQuad": 0.05, "ManaPerEne": 1.7, "ManaPerLvl": 2, "ManaPotion": 0.4, "MonArmorK": 120, "MonArmorPerLvl": 2, "MonToHitPerLvl": 3, "NovaMul": 1, "PackMul": 1, "PotionHeal": 0.5, "PotionPrice": 20, "PotionPricePerLvl": 4, "QuestGoldPerLvl": 100, "RareBonus": 0.2, "RerollPerDepth": 20, "RerollPrice": 100, "ScrollPrice": 40, "ScrollPricePerLvl": 6, "SellDiv": 16, "StrDiv": 45, "ToHitPerLvl": 0, "XPBase": 35, "XPExp": 1.8}, "score": 15.89555088827355, "scoreCI": [13.212622685035434, 18.805777489189232], "key": {"abyssDeath": 7, "caster.clvl": 13, "caster.deepest": 7, "caster.gold": 1.3224242424242425, "caster.king": 0.7708333333333334, "caster.oracle": 0, "fighter.clvl": 11, "fighter.deepest": 6, "fighter.gold": 2.354090909090909, "fighter.king": 0.6458333333333334, "fighter.oracle": 0, "gap": 0.125, "stuck": 2}, "change": "rules: SellDiv 12 -> 16, GamblePrice 120 -> 200, GamblePerDepth 30 -> 50, RerollPrice 50 -> 100, RerollPerDepth 10 -> 20 on #24", "why": "gold bands 4.91/3.06 -> 2.35/1.32 and score 17.97 -> 15.90 (-2.08, -6.30..+0.61), but clvl -0.47/-0.71 sure and deepest -0.24/-0.30: the sell cut takes gear off the hero; retried as sink prices alone (#28) and with SellDiv 14 (#29)", "decision": "revert", "base": "balance/runs/038-best.json", "vsBase": "-2.08 (-6.30\u2026+0.61)", "best": "17.35", "bestRun": "balance/runs/025-income.json"}
{"id": 27, "time": "2026-09-30T23:21:04+02:00", "name": "042-base", "run": "balance/runs/042-base.json", "rev": "79571fb", "dirty": true, "code": "d0d0359d5b", "bot": "0d712d9564", "first": 1, "seeds": 96, "turns": 20000, "changed": ["StrDiv: 60 \u2192 45", "ManaPerEne: 1.2 \u2192 1.7", "GoldPerLvl: 3 \u2192 2", "QuestGoldPerLvl: 250 \u2192 100"], "rules": {"AffixLvlScale": 1, "ArmorCap": 0.5, "ArmorK": 50, "ArmorPerLvl": 10, "BoltCostLvl": 0.667, "BoltEnePow": 1, "BoltMul": 1, "BossHpLin": 0.22, "BudgetMul": 7, "ChampBase": 8, "ChampDmg": 1.3, "ChampHp": 2.2, "ChampPerDepth": 3, "DmgLin": 0.24, "DmgQuad": 0.02, "DropChance": 12, "GambleBonus": 1, "GamblePerDepth": 30, "GamblePrice": 120, "GoldChance": 30, "GoldPerLvl": 2, "HPPerLvl": 4, "HealCost": 0.5, "HpLin": 0.32, "HpQuad": 0.05, "ManaPerEne": 1.7, "ManaPerLvl": 2, "ManaPotion": 0.4, "MonArmorK": 120, "MonArmorPerLvl": 2, "MonToHitPerLvl": 3, "NovaMul": 1, "PackMul": 1, "PotionHeal": 0.5, "PotionPrice": 20, "PotionPricePerLvl": 4, "QuestGoldPerLvl": 100, "RareBonus": 0.2, "RerollPerDepth": 10, "RerollPrice": 50, "ScrollPrice": 40, "ScrollPricePerLvl": 6, "SellDiv": 12, "StrDiv": 45, "ToHitPerLvl": 0, "XPBase": 35, "XPExp": 1.8}, "score": null, "scoreCI": [0, 0], "fail": "3 stuck runs", "key": {"abyssDeath": 10, "caster.clvl": 13, "caster.deepest": 7, "caster.gold": 2.962121212121212, "caster.king": 0.84375, "caster.oracle": 0.010416666666666666, "fighter.clvl": 13, "fighter.deepest": 7, "fighter.gold": 4.755151515151515, "fighter.king": 0.7291666666666666, "fighter.oracle": 0, "gap": 0.11458333333333337, "stuck": 3}, "change": "bot: a frontier goal, once chosen, is kept until reached or spent (explore); Level.Spent set on every cell the hero stands on", "why": "fixes the marsh flip-flop of #22/#23 (caster seed 26 now reaches grotto1) but 3 fighter runs stuck: with dead frontier cells gone, auto-explore spends 300+ turns sweeping loot on a cleared level, and the stall rule counts only new cells, kills and level changes; fixed in #33 by counting pickups and the walk to the stairs", "decision": "revert", "base": "balance/runs/038-best.json", "vsBase": "+NaN (+NaN\u2026+NaN)", "best": "17.35", "bestRun": "balance/runs/025-income.json"}
{"id": 28, "time": "2026-09-30T23:21:04+02:00", "name": "043-sinks-only", "run": "balance/runs/043-sinks-only.json", "rev": "79571fb", "dirty": true, "code": "d0d0359d5b", "bot": "0d712d9564", "first": 1, "seeds": 96, "turns": 20000, "changed": ["StrDiv: 60 \u2192 45", "ManaPerEne: 1.2 \u2192 1.7", "GoldPerLvl: 3 \u2192 2", "QuestGoldPerLvl: 250 \u2192 100", "RerollPrice: 50 \u2192 100", "RerollPerDepth: 10 \u2192 20", "GamblePrice: 120 \u2192 200", "GamblePerDepth: 30 \u2192 50"], "rules": {"AffixLvlScale": 1, "ArmorCap": 0.5, "ArmorK": 50, "ArmorPerLvl": 10, "BoltCostLvl": 0.667, "BoltEnePow": 1, "BoltMul": 1, "BossHpLin": 0.22, "BudgetMul": 7, "ChampBase": 8, "ChampDmg": 1.3, "ChampHp": 2.2, "ChampPerDepth": 3, "DmgLin": 0.24, "DmgQuad": 0.02, "DropChance": 12, "GambleBonus": 1, "GamblePerDepth": 50, "GamblePrice": 200, "GoldChance": 30, "GoldPerLvl": 2, "HPPerLvl": 4, "HealCost": 0.5, "HpLin": 0.32, "HpQuad": 0.05, "ManaPerEne": 1.7, "ManaPerLvl": 2, "ManaPotion": 0.4, "MonArmorK": 120, "MonArmorPerLvl": 2, "MonToHitPerLvl": 3, "NovaMul": 1, "PackMul": 1, "PotionHeal": 0.5, "PotionPrice": 20, "PotionPricePerLvl": 4, "QuestGoldPerLvl": 100, "RareBonus": 0.2, "RerollPerDepth": 20, "RerollPrice": 100, "ScrollPrice": 40, "ScrollPricePerLvl": 6, "SellDiv": 12, "StrDiv": 45, "ToHitPerLvl": 0, "XPBase": 35, "XPExp": 1.8}, "score": null, "scoreCI": [0, 0], "fail": "3 stuck runs", "key": {"abyssDeath": 7, "caster.clvl": 13, "caster.deepest": 7, "caster.gold": 1.7654545454545454, "caster.king": 0.8541666666666666, "caster.oracle": 0, "fighter.clvl": 12, "fighter.deepest": 7, "fighter.gold": 2.7593939393939397, "fighter.king": 0.6354166666666666, "fighter.oracle": 0, "gap": 0.21875, "stuck": 3}, "change": "rules: GamblePrice 200, GamblePerDepth 50, RerollPrice 100, RerollPerDepth 20 on #24 (no sell cut)", "why": "fighter king 0.73 -> 0.64 and clvl -0.43, both sure, caster unchanged: gambling is the fighter's gear pipeline (it gambles the surplus, the caster buys potions); a dearer sink starves it. The gold band (0.8-1.5 gambles a level) conflicts with the fighter's progression under these rules", "decision": "revert", "base": "balance/runs/038-best.json", "vsBase": "+NaN (+NaN\u2026+NaN)", "best": "17.35", "bestRun": "balance/runs/025-income.json"}
{"id": 29, "time": "2026-09-30T23:21:04+02:00", "name": "044-sinks-sell14", "run": "balance/runs/044-sinks-sell14.json", "rev": "79571fb", "dirty": true, "code": "d0d0359d5b", "bot": "0d712d9564", "first": 1, "seeds": 96, "turns": 20000, "changed": ["StrDiv: 60 \u2192 45", "ManaPerEne: 1.2 \u2192 1.7", "GoldPerLvl: 3 \u2192 2", "SellDiv: 12 \u2192 14", "QuestGoldPerLvl: 250 \u2192 100", "RerollPrice: 50 \u2192 100", "RerollPerDepth: 10 \u2192 20", "GamblePrice: 120 \u2192 200", "GamblePerDepth: 30 \u2192 50"], "rules": {"AffixLvlScale": 1, "ArmorCap": 0.5, "ArmorK": 50, "ArmorPerLvl": 10, "BoltCostLvl": 0.667, "BoltEnePow": 1, "BoltMul": 1, "BossHpLin": 0.22, "BudgetMul": 7, "ChampBase": 8, "ChampDmg": 1.3, "ChampHp": 2.2, "ChampPerDepth": 3, "DmgLin": 0.24, "DmgQuad": 0.02, "DropChance": 12, "GambleBonus": 1, "GamblePerDepth": 50, "GamblePrice": 200, "GoldChance": 30, "GoldPerLvl": 2, "HPPerLvl": 4, "HealCost": 0.5, "HpLin": 0.32, "HpQuad": 0.05, "ManaPerEne": 1.7, "ManaPerLvl": 2, "ManaPotion": 0.4, "MonArmorK": 120, "MonArmorPerLvl": 2, "MonToHitPerLvl": 3, "NovaMul": 1, "PackMul": 1, "PotionHeal": 0.5, "PotionPrice": 20, "PotionPricePerLvl": 4, "QuestGoldPerLvl": 100, "RareBonus": 0.2, "RerollPerDepth": 20, "RerollPrice": 100, "ScrollPrice": 40, "ScrollPricePerLvl": 6, "SellDiv": 14, "StrDiv": 45, "ToHitPerLvl": 0, "XPBase": 35, "XPExp": 1.8}, "score": null, "scoreCI": [0, 0], "fail": "3 stuck runs", "key": {"abyssDeath": 7, "caster.clvl": 13, "caster.deepest": 7, "caster.gold": 1.4627272727272727, "caster.king": 0.8125, "caster.oracle": 0, "fighter.clvl": 12, "fighter.deepest": 6, "fighter.gold": 2.3085714285714287, "fighter.king": 0.5833333333333334, "fighter.oracle": 0, "gap": 0.22916666666666663, "stuck": 3}, "change": "rules: #28 plus SellDiv 14", "why": "fighter deepest -0.46, clvl -0.86, king -0.15, all sure; caster surplus -183 sure: same mechanism, worse", "decision": "revert", "base": "balance/runs/038-best.json", "vsBase": "+NaN (+NaN\u2026+NaN)", "best": "17.35", "bestRun": "balance/runs/025-income.json"}
{"id": 30, "time": "2026-09-30T23:21:04+02:00", "name": "046-potion-champ", "run": "balance/runs/046-potion-champ.json", "rev": "79571fb", "dirty": true, "code": "d0d0359d5b", "bot": "0d712d9564", "first": 1, "seeds": 96, "turns": 20000, "changed": ["StrDiv: 60 \u2192 45", "PotionHeal: 0.5 \u2192 0.65", "ManaPerEne: 1.2 \u2192 1.7", "ChampHp: 2.2 \u2192 1.8", "GoldPerLvl: 3 \u2192 2", "QuestGoldPerLvl: 250 \u2192 100"], "rules": {"AffixLvlScale": 1, "ArmorCap": 0.5, "ArmorK": 50, "ArmorPerLvl": 10, "BoltCostLvl": 0.667, "BoltEnePow": 1, "BoltMul": 1, "BossHpLin": 0.22, "BudgetMul": 7, "ChampBase": 8, "ChampDmg": 1.3, "ChampHp": 1.8, "ChampPerDepth": 3, "DmgLin": 0.24, "DmgQuad": 0.02, "DropChance": 12, "GambleBonus": 1, "GamblePerDepth": 30, "GamblePrice": 120, "GoldChance": 30, "GoldPerLvl": 2, "HPPerLvl": 4, "HealCost": 0.5, "HpLin": 0.32, "HpQuad": 0.05, "ManaPerEne": 1.7, "ManaPerLvl": 2, "ManaPotion": 0.4, "MonArmorK": 120, "MonArmorPerLvl": 2, "MonToHitPerLvl": 3, "NovaMul": 1, "PackMul": 1, "PotionHeal": 0.65, "PotionPrice": 20, "PotionPricePerLvl": 4, "QuestGoldPerLvl": 100, "RareBonus": 0.2, "RerollPerDepth": 10, "RerollPrice": 50, "ScrollPrice": 40, "ScrollPricePerLvl": 6, "SellDiv": 12, "StrDiv": 45, "ToHitPerLvl": 0, "XPBase": 35, "XPExp": 1.8}, "score": null, "scoreCI": [0, 0], "fail": "4 stuck runs", "key": {"abyssDeath": 10, "caster.clvl": 14, "caster.deepest": 7, "caster.gold": 3.31969696969697, "caster.king": 0.9166666666666666, "caster.oracle": 0.020833333333333332, "fighter.clvl": 12, "fighter.deepest": 7, "fighter.gold": 4.871969696969697, "fighter.king": 0.6770833333333334, "fighter.oracle": 0.010416666666666666, "gap": 0.23958333333333326, "stuck": 4}, "change": "rules: PotionHeal 0.65 + ChampHp 1.8 on #24", "why": "caster deepest +0.66, clvl +1.21, king 0.92 (sure), grotto3 8; fighter king 0.68 (-0.05): champions are what the fighter farms; weaker ones widen the gap to 0.24. Potions alone (#31) keep the caster's gain without it", "decision": "revert", "base": "balance/runs/038-best.json", "vsBase": "+NaN (+NaN\u2026+NaN)", "best": "17.35", "bestRun": "balance/runs/025-income.json"}
{"id": 31, "time": "2026-09-30T23:21:58+02:00", "name": "047-base", "run": "balance/runs/047-base.json", "rev": "79571fb", "dirty": true, "code": "751a9ee536", "bot": "be2688243a", "first": 1, "seeds": 96, "turns": 20000, "changed": ["StrDiv: 60 \u2192 45", "ManaPerEne: 1.2 \u2192 1.7", "GoldPerLvl: 3 \u2192 2", "QuestGoldPerLvl: 250 \u2192 100"], "rules": {"AffixLvlScale": 1, "ArmorCap": 0.5, "ArmorK": 50, "ArmorPerLvl": 10, "BoltCostLvl": 0.667, "BoltEnePow": 1, "BoltMul": 1, "BossHpLin": 0.22, "BudgetMul": 7, "ChampBase": 8, "ChampDmg": 1.3, "ChampHp": 2.2, "ChampPerDepth": 3, "DmgLin": 0.24, "DmgQuad": 0.02, "DropChance": 12, "GambleBonus": 1, "GamblePerDepth": 30, "GamblePrice": 120, "GoldChance": 30, "GoldPerLvl": 2, "HPPerLvl": 4, "HealCost": 0.5, "HpLin": 0.32, "HpQuad": 0.05, "ManaPerEne": 1.7, "ManaPerLvl": 2, "ManaPotion": 0.4, "MonArmorK": 120, "MonArmorPerLvl": 2, "MonToHitPerLvl": 3, "NovaMul": 1, "PackMul": 1, "PotionHeal": 0.5, "PotionPrice": 20, "PotionPricePerLvl": 4, "QuestGoldPerLvl": 100, "RareBonus": 0.2, "RerollPerDepth": 10, "RerollPrice": 50, "ScrollPrice": 40, "ScrollPricePerLvl": 6, "SellDiv": 12, "StrDiv": 45, "ToHitPerLvl": 0, "XPBase": 35, "XPExp": 1.8}, "score": 16.66282727601489, "scoreCI": [14.424991763685561, 20.811682824529683], "key": {"abyssDeath": 10, "caster.clvl": 13, "caster.deepest": 7, "caster.gold": 2.962121212121212, "caster.king": 0.84375, "caster.oracle": 0.010416666666666666, "fighter.clvl": 13, "fighter.deepest": 7, "fighter.gold": 4.755151515151515, "fighter.king": 0.75, "fighter.oracle": 0, "gap": 0.09375, "stuck": 0}, "change": "bot: gold and pack changes count as progress; the walk to known stairs counts as progress (stall rule)", "why": "with dead frontier cells spent, auto-explore sweeps loot across a cleared level for 300+ turns and then walks to the stairs; neither counted as progress and 3 fighter runs of #27 were called stuck mid-sweep. 0 stuck of 192 on seeds 1-96; fighter king 0.75, caster 0.84; score 16.66, the best scored on seeds 1-96", "decision": "keep", "base": "balance/runs/038-best.json", "vsBase": "-1.31 (-4.77\u2026+2.51)", "best": "16.66", "bestRun": "balance/runs/047-base.json"}
