{"id": 1, "time": "2026-09-30T22:31:24+02:00", "name": "000-baseline", "run": "balance/runs/000-baseline.json", "rev": "79571fb", "dirty": true, "code": "9d170e0430", "bot": "d1fecbda87", "first": 1, "seeds": 48, "turns": 20000, "changed": null, "rules": {"AffixLvlScale": 1, "ArmorCap": 0.5, "ArmorK": 50, "ArmorPerLvl": 10, "BoltEnePow": 1, "BoltMul": 1, "BossHpLin": 0.22, "BudgetMul": 7, "ChampBase": 8, "ChampDmg": 1.3, "ChampHp": 2.2, "ChampPerDepth": 3, "DmgLin": 0.24, "DmgQuad": 0.02, "DropChance": 12, "GambleBonus": 1, "GamblePerDepth": 30, "GamblePrice": 120, "GoldChance": 30, "GoldPerLvl": 3, "HPPerLvl": 4, "HealCost": 0.5, "HpLin": 0.32, "HpQuad": 0.05, "MonArmorK": 120, "MonArmorPerLvl": 2, "MonToHitPerLvl": 3, "NovaMul": 1, "PackMul": 1, "PotionHeal": 0.5, "PotionPrice": 20, "PotionPricePerLvl": 4, "QuestGoldPerLvl": 250, "RareBonus": 0.2, "RerollPerDepth": 10, "RerollPrice": 50, "ScrollPrice": 40, "ScrollPricePerLvl": 6, "StrDiv": 60, "ToHitPerLvl": 0, "XPBase": 35, "XPExp": 1.8}, "score": 21.807892212517483, "scoreCI": [17.900291479916753, 24.255278136993187], "key": {"abyssDeath": 7, "caster.clvl": 13, "caster.deepest": 7, "caster.gold": 4.13939393939394, "caster.king": 0.8333333333333334, "caster.oracle": 0, "fighter.clvl": 11, "fighter.deepest": 6, "fighter.gold": 6.4340909090909095, "fighter.king": 0.625, "fighter.oracle": 0, "gap": 0.20833333333333337, "stuck": 0}, "change": "none: defaults at 79571fb", "why": "starting point of the 2026-09-30 agent-driven pass", "decision": "baseline", "best": "21.81", "bestRun": "balance/runs/000-baseline.json"}
{"id": 2, "time": "2026-09-30T22:35:40+02:00", "name": "001-baseline-instr", "run": "balance/runs/001-baseline-instr.json", "rev": "79571fb", "dirty": true, "code": "79dad9f0b1", "bot": "d1fecbda87", "first": 1, "seeds": 48, "turns": 20000, "changed": null, "rules": {"AffixLvlScale": 1, "ArmorCap": 0.5, "ArmorK": 50, "ArmorPerLvl": 10, "BoltEnePow": 1, "BoltMul": 1, "BossHpLin": 0.22, "BudgetMul": 7, "ChampBase": 8, "ChampDmg": 1.3, "ChampHp": 2.2, "ChampPerDepth": 3, "DmgLin": 0.24, "DmgQuad": 0.02, "DropChance": 12, "GambleBonus": 1, "GamblePerDepth": 30, "GamblePrice": 120, "GoldChance": 30, "GoldPerLvl": 3, "HPPerLvl": 4, "HealCost": 0.5, "HpLin": 0.32, "HpQuad": 0.05, "MonArmorK": 120, "MonArmorPerLvl": 2, "MonToHitPerLvl": 3, "NovaMul": 1, "PackMul": 1, "PotionHeal": 0.5, "PotionPrice": 20, "PotionPricePerLvl": 4, "QuestGoldPerLvl": 250, "RareBonus": 0.2, "RerollPerDepth": 10, "RerollPrice": 50, "ScrollPrice": 40, "ScrollPricePerLvl": 6, "StrDiv": 60, "ToHitPerLvl": 0, "XPBase": 35, "XPExp": 1.8}, "score": 21.807892212517483, "scoreCI": [17.900291479916753, 24.255278136993187], "key": {"abyssDeath": 7, "caster.clvl": 13, "caster.deepest": 7, "caster.gold": 4.13939393939394, "caster.king": 0.8333333333333334, "caster.oracle": 0, "fighter.clvl": 11, "fighter.deepest": 6, "fighter.gold": 6.4340909090909095, "fighter.king": 0.625, "fighter.oracle": 0, "gap": 0.20833333333333337, "stuck": 0}, "change": "instrument: Stats.Death (killer rank, adjacent, awake, potions left), bot report and rows carry it", "why": "deaths need a cause before a knob moves: pack attrition vs burst vs resource exhaustion", "decision": "keep", "base": "balance/runs/000-baseline.json", "vsBase": "+0.00 (+0.00\u2026+0.00)", "best": "21.81", "bestRun": "balance/runs/000-baseline.json"}
{"id": 3, "time": "2026-09-30T22:38:23+02:00", "name": "003-bot-escape2", "run": "balance/runs/003-bot-escape2.json", "rev": "79571fb", "dirty": true, "code": "0b58fac353", "bot": "beecdd4cc2", "first": 1, "seeds": 48, "turns": 20000, "changed": null, "rules": {"AffixLvlScale": 1, "ArmorCap": 0.5, "ArmorK": 50, "ArmorPerLvl": 10, "BoltEnePow": 1, "BoltMul": 1, "BossHpLin": 0.22, "BudgetMul": 7, "ChampBase": 8, "ChampDmg": 1.3, "ChampHp": 2.2, "ChampPerDepth": 3, "DmgLin": 0.24, "DmgQuad": 0.02, "DropChance": 12, "GambleBonus": 1, "GamblePerDepth": 30, "GamblePrice": 120, "GoldChance": 30, "GoldPerLvl": 3, "HPPerLvl": 4, "HealCost": 0.5, "HpLin": 0.32, "HpQuad": 0.05, "MonArmorK": 120, "MonArmorPerLvl": 2, "MonToHitPerLvl": 3, "NovaMul": 1, "PackMul": 1, "PotionHeal": 0.5, "PotionPrice": 20, "PotionPricePerLvl": 4, "QuestGoldPerLvl": 250, "RareBonus": 0.2, "RerollPerDepth": 10, "RerollPrice": 50, "ScrollPrice": 40, "ScrollPricePerLvl": 6, "StrDiv": 60, "ToHitPerLvl": 0, "XPBase": 35, "XPExp": 1.8}, "score": 20.56278639241166, "scoreCI": [20.44901741522805, 22.862526079929765], "key": {"abyssDeath": 7, "caster.clvl": 13, "caster.deepest": 7, "caster.gold": 4.11991341991342, "caster.king": 0.8333333333333334, "caster.oracle": 0, "fighter.clvl": 12, "fighter.deepest": 7, "fighter.gold": 6.172222222222222, "fighter.king": 0.7083333333333334, "fighter.oracle": 0, "gap": 0.125, "stuck": 0}, "change": "bot: losing() leaves by portal at <50% life with an empty belt or <40% with one potion, while any threat is in view (was <35% and empty belt)", "why": "deaths came at 0 potions with 3-4 adjacent: the old call came too late for a two-turn portal exit; a first version that also fled at <50% with 3 adjacent while potions remained was worse (fighter king 62->35%, run 002) because a potion beats two exposed turns; this version: fighter king 62->71%, deepest +0.27, caster unchanged, not sure at 48 seeds but the bot now uses scrolls the way a player does", "decision": "keep", "base": "balance/runs/001-baseline-instr.json", "vsBase": "-1.25 (-3.06\u2026+2.81)", "best": "20.56", "bestRun": "balance/runs/003-bot-escape2.json"}
{"id": 4, "time": "2026-09-30T22:43:14+02:00", "name": "007-bot-nook-hp", "run": "balance/runs/007-bot-nook-hp.json", "rev": "79571fb", "dirty": true, "code": "2b27d5f72d", "bot": "cb63f97573", "first": 1, "seeds": 48, "turns": 20000, "changed": null, "rules": {"AffixLvlScale": 1, "ArmorCap": 0.5, "ArmorK": 50, "ArmorPerLvl": 10, "BoltEnePow": 1, "BoltMul": 1, "BossHpLin": 0.22, "BudgetMul": 7, "ChampBase": 8, "ChampDmg": 1.3, "ChampHp": 2.2, "ChampPerDepth": 3, "DmgLin": 0.24, "DmgQuad": 0.02, "DropChance": 12, "GambleBonus": 1, "GamblePerDepth": 30, "GamblePrice": 120, "GoldChance": 30, "GoldPerLvl": 3, "HPPerLvl": 4, "HealCost": 0.5, "HpLin": 0.32, "HpQuad": 0.05, "MonArmorK": 120, "MonArmorPerLvl": 2, "MonToHitPerLvl": 3, "NovaMul": 1, "PackMul": 1, "PotionHeal": 0.5, "PotionPrice": 20, "PotionPricePerLvl": 4, "QuestGoldPerLvl": 250, "RareBonus": 0.2, "RerollPerDepth": 10, "RerollPrice": 50, "ScrollPrice": 40, "ScrollPricePerLvl": 6, "StrDiv": 60, "ToHitPerLvl": 0, "XPBase": 35, "XPExp": 1.8}, "score": 21.1033445329698, "scoreCI": [17.92327820464766, 22.03601414652177], "key": {"abyssDeath": 7, "caster.clvl": 13, "caster.deepest": 7, "caster.gold": 4.393939393939394, "caster.king": 0.7708333333333334, "caster.oracle": 0, "fighter.clvl": 12, "fighter.deepest": 7, "fighter.gold": 6.482323232323232, "fighter.king": 0.75, "fighter.oracle": 0, "gap": 0.02083333333333337, "stuck": 0}, "change": "bot: hp() counts only the next turn's potion drain, not the whole pool; retreat() backs into a nook with fewer open sides (caves have no corridors), tried when the current cell has more than 3 open sides", "why": "trace of fighter seed 3: called 17 real life '38%' because 90 sat in the pool, read a portal and died on the spot; fought a six-spider pack in the open. Effect within noise (score 20.56 -> 21.10, fighter king +0.04, caster -0.06), kept as correctness of the player model", "decision": "keep", "base": "balance/runs/003-bot-escape2.json", "vsBase": "+0.54 (-3.96\u2026+1.22)", "best": "20.56", "bestRun": "balance/runs/003-bot-escape2.json"}
{"id": 5, "time": "2026-09-30T22:44:16+02:00", "name": "008-base-packlive", "run": "balance/runs/008-base-packlive.json", "rev": "79571fb", "dirty": true, "code": "2b27d5f72d", "bot": "cb63f97573", "first": 1, "seeds": 48, "turns": 20000, "changed": null, "rules": {"AffixLvlScale": 1, "ArmorCap": 0.5, "ArmorK": 50, "ArmorPerLvl": 10, "BoltEnePow": 1, "BoltMul": 1, "BossHpLin": 0.22, "BudgetMul": 7, "ChampBase": 8, "ChampDmg": 1.3, "ChampHp": 2.2, "ChampPerDepth": 3, "DmgLin": 0.24, "DmgQuad": 0.02, "DropChance": 12, "GambleBonus": 1, "GamblePerDepth": 30, "GamblePrice": 120, "GoldChance": 30, "GoldPerLvl": 3, "HPPerLvl": 4, "HealCost": 0.5, "HpLin": 0.32, "HpQuad": 0.05, "MonArmorK": 120, "MonArmorPerLvl": 2, "MonToHitPerLvl": 3, "NovaMul": 1, "PackMul": 1, "PotionHeal": 0.5, "PotionPrice": 20, "PotionPricePerLvl": 4, "QuestGoldPerLvl": 250, "RareBonus": 0.2, "RerollPerDepth": 10, "RerollPrice": 50, "ScrollPrice": 40, "ScrollPricePerLvl": 6, "StrDiv": 60, "ToHitPerLvl": 0, "XPBase": 35, "XPExp": 1.8}, "score": 23.69311286629584, "scoreCI": [20.71024146843768, 24.637714839758658], "key": {"abyssDeath": 7, "caster.clvl": 13, "caster.deepest": 7, "caster.gold": 4.393939393939394, "caster.king": 0.7708333333333334, "caster.oracle": 0, "fighter.clvl": 12, "fighter.deepest": 7, "fighter.gold": 6.482323232323232, "fighter.king": 0.75, "fighter.oracle": 0, "gap": 0.02083333333333337, "stuck": 0}, "change": "goals: packLive (live over pack size x speed, 8-12) and fight (packLive over turns to clear the pack, 1-2) scored; live (24-36) reported at weight 0", "why": "live vs one normal sat in band at grotto1 (27-32) while 45 of 96 runs died there: the typical grotto pack is 3-5 spiders at speed 130 (5.2 attacks a turn) against 2-3.5 elsewhere; the band's own rationale ('a pack of three lands in 8-12') is the pack-aware number. New baseline under these goals; score not comparable with #1-#4", "decision": "keep", "base": "balance/runs/003-bot-escape2.json", "vsBase": "-5.04 (-9.21\u2026-4.38)", "best": "23.69", "bestRun": "balance/runs/008-base-packlive.json"}
{"id": 6, "time": "2026-09-30T22:46:31+02:00", "name": "009-spider", "run": "balance/runs/009-spider.json", "rev": "79571fb", "dirty": true, "code": "fff1b928b7", "bot": "cb63f97573", "first": 1, "seeds": 48, "turns": 20000, "changed": null, "rules": {"AffixLvlScale": 1, "ArmorCap": 0.5, "ArmorK": 50, "ArmorPerLvl": 10, "BoltEnePow": 1, "BoltMul": 1, "BossHpLin": 0.22, "BudgetMul": 7, "ChampBase": 8, "ChampDmg": 1.3, "ChampHp": 2.2, "ChampPerDepth": 3, "DmgLin": 0.24, "DmgQuad": 0.02, "DropChance": 12, "GambleBonus": 1, "GamblePerDepth": 30, "GamblePrice": 120, "GoldChance": 30, "GoldPerLvl": 3, "HPPerLvl": 4, "HealCost": 0.5, "HpLin": 0.32, "HpQuad": 0.05, "MonArmorK": 120, "MonArmorPerLvl": 2, "MonToHitPerLvl": 3, "NovaMul": 1, "PackMul": 1, "PotionHeal": 0.5, "PotionPrice": 20, "PotionPricePerLvl": 4, "QuestGoldPerLvl": 250, "RareBonus": 0.2, "RerollPerDepth": 10, "RerollPrice": 50, "ScrollPrice": 40, "ScrollPricePerLvl": 6, "StrDiv": 60, "ToHitPerLvl": 0, "XPBase": 35, "XPExp": 1.8}, "score": 22.605068760925246, "scoreCI": [19.777203675277075, 23.647143896924668], "key": {"abyssDeath": 7, "caster.clvl": 13, "caster.deepest": 7, "caster.gold": 4.413419913419913, "caster.king": 0.7708333333333334, "caster.oracle": 0, "fighter.clvl": 12, "fighter.deepest": 7, "fighter.gold": 6.415151515151515, "fighter.king": 0.75, "fighter.oracle": 0, "gap": 0.02083333333333337, "stuck": 0}, "change": "code: Grotto Spider pack 3-5 -> 2-4, speed 130 -> 120 (monsters.go)", "why": "the typical grotto pack dealt 5.2 attacks a turn against 2-3.5 in every other area; packLive.grotto1 5.7/5.2 -> 8.9/8.3 (fighter/caster, band 8-12) and fight.grotto1 0.49/0.34 -> 1.03/0.71 as predicted; score 23.69 -> 22.61, within noise; arrivals at grotto3 still 0-1: the remaining grotto killers are champion packs (spider, ghoul, golem champions 25 of 56 grotto deaths) and the caster going dry", "decision": "keep", "base": "balance/runs/008-base-packlive.json", "vsBase": "-1.09 (-1.40\u2026+1.79)", "best": "22.61", "bestRun": "balance/runs/009-spider.json"}
{"id": 7, "time": "2026-09-30T22:46:31+02:00", "name": "010-spider-champ2", "run": "balance/runs/010-spider-champ2.json", "rev": "79571fb", "dirty": true, "code": "fff1b928b7", "bot": "cb63f97573", "first": 1, "seeds": 48, "turns": 20000, "changed": ["ChampPerDepth: 3 \u2192 2"], "rules": {"AffixLvlScale": 1, "ArmorCap": 0.5, "ArmorK": 50, "ArmorPerLvl": 10, "BoltEnePow": 1, "BoltMul": 1, "BossHpLin": 0.22, "BudgetMul": 7, "ChampBase": 8, "ChampDmg": 1.3, "ChampHp": 2.2, "ChampPerDepth": 2, "DmgLin": 0.24, "DmgQuad": 0.02, "DropChance": 12, "GambleBonus": 1, "GamblePerDepth": 30, "GamblePrice": 120, "GoldChance": 30, "GoldPerLvl": 3, "HPPerLvl": 4, "HealCost": 0.5, "HpLin": 0.32, "HpQuad": 0.05, "MonArmorK": 120, "MonArmorPerLvl": 2, "MonToHitPerLvl": 3, "NovaMul": 1, "PackMul": 1, "PotionHeal": 0.5, "PotionPrice": 20, "PotionPricePerLvl": 4, "QuestGoldPerLvl": 250, "RareBonus": 0.2, "RerollPerDepth": 10, "RerollPrice": 50, "ScrollPrice": 40, "ScrollPricePerLvl": 6, "StrDiv": 60, "ToHitPerLvl": 0, "XPBase": 35, "XPExp": 1.8}, "score": 21.886793638946326, "scoreCI": [18.86477624454846, 23.17547447033639], "key": {"abyssDeath": 7, "caster.clvl": 12, "caster.deepest": 7, "caster.gold": 3.837373737373737, "caster.king": 0.75, "caster.oracle": 0, "fighter.clvl": 12, "fighter.deepest": 6, "fighter.gold": 6.234343434343435, "fighter.king": 0.7083333333333334, "fighter.oracle": 0, "gap": 0.04166666666666663, "stuck": 1}, "change": "rules: ChampPerDepth 3 -> 2 on top of #6", "why": "champion packs 29% -> 22% at grotto1; score 21.89 vs 22.61, fighter grotto3 1, caster grotto1 30 vs 32: nothing moved beyond noise and champion XP/loot is the fighter's progression engine (run 004 at 1.5 was worse); try weaker champions instead of fewer", "decision": "revert", "base": "balance/runs/009-spider.json", "vsBase": "-0.72 (-3.89\u2026+2.28)", "best": "22.61", "bestRun": "balance/runs/009-spider.json"}
{"id": 8, "time": "2026-09-30T22:52:20+02:00", "name": "017-manalvl4", "run": "balance/runs/017-manalvl4.json", "rev": "79571fb", "dirty": true, "code": "218167147e", "bot": "cb63f97573", "first": 1, "seeds": 96, "turns": 20000, "changed": ["ManaPerLvl: 2 \u2192 4"], "rules": {"AffixLvlScale": 1, "ArmorCap": 0.5, "ArmorK": 50, "ArmorPerLvl": 10, "BoltCostLvl": 0.667, "BoltEnePow": 1, "BoltMul": 1, "BossHpLin": 0.22, "BudgetMul": 7, "ChampBase": 8, "ChampDmg": 1.3, "ChampHp": 2.2, "ChampPerDepth": 3, "DmgLin": 0.24, "DmgQuad": 0.02, "DropChance": 12, "GambleBonus": 1, "GamblePerDepth": 30, "GamblePrice": 120, "GoldChance": 30, "GoldPerLvl": 3, "HPPerLvl": 4, "HealCost": 0.5, "HpLin": 0.32, "HpQuad": 0.05, "ManaPerEne": 1.2, "ManaPerLvl": 4, "ManaPotion": 0.4, "MonArmorK": 120, "MonArmorPerLvl": 2, "MonToHitPerLvl": 3, "NovaMul": 1, "PackMul": 1, "PotionHeal": 0.5, "PotionPrice": 20, "PotionPricePerLvl": 4, "QuestGoldPerLvl": 250, "RareBonus": 0.2, "RerollPerDepth": 10, "RerollPrice": 50, "ScrollPrice": 40, "ScrollPricePerLvl": 6, "StrDiv": 60, "ToHitPerLvl": 0, "XPBase": 35, "XPExp": 1.8}, "score": 16.704210651197066, "scoreCI": [15.245744550459326, 20.03587786781447], "key": {"abyssDeath": 10, "caster.clvl": 13, "caster.deepest": 7, "caster.gold": 4.539393939393939, "caster.king": 0.8020833333333334, "caster.oracle": 0.020833333333333332, "fighter.clvl": 11, "fighter.deepest": 6, "fighter.gold": 5.94040404040404, "fighter.king": 0.5520833333333334, "fighter.oracle": 0, "gap": 0.25, "stuck": 2}, "change": "rules: ManaPerLvl 2 -> 4", "why": "caster grotto3 1 -> 5, abyss1 2, score 20.29 -> 16.70 at 96 seeds, but fighter king 0.68 -> 0.55 sure (12 up/24 down paired): the fighter spends the bigger pool on ranged bolts that pull whole packs; a shared hero stat is the wrong lever for a caster problem", "decision": "revert", "base": "balance/runs/020-base96.json", "vsBase": "-3.59 (-6.25\u2026+0.25)", "best": "21.44", "bestRun": "balance/runs/009-spider.json"}
{"id": 9, "time": "2026-09-30T22:52:20+02:00", "name": "018-boltcurve", "run": "balance/runs/018-boltcurve.json", "rev": "79571fb", "dirty": true, "code": "218167147e", "bot": "cb63f97573", "first": 1, "seeds": 96, "turns": 20000, "changed": ["BoltMul: 1 \u2192 0.75", "BoltEnePow: 1 \u2192 1.2"], "rules": {"AffixLvlScale": 1, "ArmorCap": 0.5, "ArmorK": 50, "ArmorPerLvl": 10, "BoltCostLvl": 0.667, "BoltEnePow": 1.2, "BoltMul": 0.75, "BossHpLin": 0.22, "BudgetMul": 7, "ChampBase": 8, "ChampDmg": 1.3, "ChampHp": 2.2, "ChampPerDepth": 3, "DmgLin": 0.24, "DmgQuad": 0.02, "DropChance": 12, "GambleBonus": 1, "GamblePerDepth": 30, "GamblePrice": 120, "GoldChance": 30, "GoldPerLvl": 3, "HPPerLvl": 4, "HealCost": 0.5, "HpLin": 0.32, "HpQuad": 0.05, "ManaPerEne": 1.2, "ManaPerLvl": 2, "ManaPotion": 0.4, "MonArmorK": 120, "MonArmorPerLvl": 2, "MonToHitPerLvl": 3, "NovaMul": 1, "PackMul": 1, "PotionHeal": 0.5, "PotionPrice": 20, "PotionPricePerLvl": 4, "QuestGoldPerLvl": 250, "RareBonus": 0.2, "RerollPerDepth": 10, "RerollPrice": 50, "ScrollPrice": 40, "ScrollPricePerLvl": 6, "StrDiv": 60, "ToHitPerLvl": 0, "XPBase": 35, "XPExp": 1.8}, "score": 19.051332622143335, "scoreCI": [16.42619980820099, 21.880825535971518], "key": {"abyssDeath": 10, "caster.clvl": 13, "caster.deepest": 7, "caster.gold": 4.543434343434344, "caster.king": 0.78125, "caster.oracle": 0.020833333333333332, "fighter.clvl": 11, "fighter.deepest": 6, "fighter.gold": 5.833939393939394, "fighter.king": 0.5416666666666666, "fighter.oracle": 0, "gap": 0.23958333333333337, "stuck": 1}, "change": "rules: BoltEnePow 1 -> 1.2, BoltMul 1 -> 0.75", "why": "flattens the caster's damage curve (same early, +30% at grotto, +45% deep); caster grotto3 1 -> 8, score 20.29 -> 19.05 (noise), fighter king 0.68 -> 0.54 again: the fighter's own bolt got weaker (7.6-12 vs 8-13) and it still pulls with it; revisit once the fighter stops bolt-pulling", "decision": "revert", "base": "balance/runs/020-base96.json", "vsBase": "-1.24 (-4.88\u2026+2.66)", "best": "21.44", "bestRun": "balance/runs/009-spider.json"}
{"id": 10, "time": "2026-09-30T22:52:21+02:00", "name": "019-mana-curve", "run": "balance/runs/019-mana-curve.json", "rev": "79571fb", "dirty": true, "code": "218167147e", "bot": "cb63f97573", "first": 1, "seeds": 96, "turns": 20000, "changed": ["BoltMul: 1 \u2192 0.75", "BoltEnePow: 1 \u2192 1.2", "ManaPerLvl: 2 \u2192 4"], "rules": {"AffixLvlScale": 1, "ArmorCap": 0.5, "ArmorK": 50, "ArmorPerLvl": 10, "BoltCostLvl": 0.667, "BoltEnePow": 1.2, "BoltMul": 0.75, "BossHpLin": 0.22, "BudgetMul": 7, "ChampBase": 8, "ChampDmg": 1.3, "ChampHp": 2.2, "ChampPerDepth": 3, "DmgLin": 0.24, "DmgQuad": 0.02, "DropChance": 12, "GambleBonus": 1, "GamblePerDepth": 30, "GamblePrice": 120, "GoldChance": 30, "GoldPerLvl": 3, "HPPerLvl": 4, "HealCost": 0.5, "HpLin": 0.32, "HpQuad": 0.05, "ManaPerEne": 1.2, "ManaPerLvl": 4, "ManaPotion": 0.4, "MonArmorK": 120, "MonArmorPerLvl": 2, "MonToHitPerLvl": 3, "NovaMul": 1, "PackMul": 1, "PotionHeal": 0.5, "PotionPrice": 20, "PotionPricePerLvl": 4, "QuestGoldPerLvl": 250, "RareBonus": 0.2, "RerollPerDepth": 10, "RerollPrice": 50, "ScrollPrice": 40, "ScrollPricePerLvl": 6, "StrDiv": 60, "ToHitPerLvl": 0, "XPBase": 35, "XPExp": 1.8}, "score": 21.752862644499217, "scoreCI": [20.164238896123386, 24.178585271277946], "key": {"abyssDeath": 10, "caster.clvl": 13, "caster.deepest": 7, "caster.gold": 5.323737373737374, "caster.king": 0.8020833333333334, "caster.oracle": 0.010416666666666666, "fighter.clvl": 12, "fighter.deepest": 6, "fighter.gold": 6.188888888888888, "fighter.king": 0.53125, "fighter.oracle": 0, "gap": 0.27083333333333337, "stuck": 1}, "change": "rules: ManaPerLvl 4 + BoltEnePow 1.2 + BoltMul 0.75", "why": "score 21.75 vs 20.29: the two caster levers do not add; fighter king 0.53", "decision": "revert", "base": "balance/runs/020-base96.json", "vsBase": "+1.46 (-1.89\u2026+5.57)", "best": "21.44", "bestRun": "balance/runs/009-spider.json"}
{"id": 11, "time": "2026-09-30T22:55:02+02:00", "name": "021-base96-nopull", "run": "balance/runs/021-base96-nopull.json", "rev": "79571fb", "dirty": true, "code": "87b8c1e18f", "bot": "afb91e0336", "first": 1, "seeds": 96, "turns": 20000, "changed": null, "rules": {"AffixLvlScale": 1, "ArmorCap": 0.5, "ArmorK": 50, "ArmorPerLvl": 10, "BoltCostLvl": 0.667, "BoltEnePow": 1, "BoltMul": 1, "BossHpLin": 0.22, "BudgetMul": 7, "ChampBase": 8, "ChampDmg": 1.3, "ChampHp": 2.2, "ChampPerDepth": 3, "DmgLin": 0.24, "DmgQuad": 0.02, "DropChance": 12, "GambleBonus": 1, "GamblePerDepth": 30, "GamblePrice": 120, "GoldChance": 30, "GoldPerLvl": 3, "HPPerLvl": 4, "HealCost": 0.5, "HpLin": 0.32, "HpQuad": 0.05, "ManaPerEne": 1.2, "ManaPerLvl": 2, "ManaPotion": 0.4, "MonArmorK": 120, "MonArmorPerLvl": 2, "MonToHitPerLvl": 3, "NovaMul": 1, "PackMul": 1, "PotionHeal": 0.5, "PotionPrice": 20, "PotionPricePerLvl": 4, "QuestGoldPerLvl": 250, "RareBonus": 0.2, "RerollPerDepth": 10, "RerollPrice": 50, "ScrollPrice": 40, "ScrollPricePerLvl": 6, "StrDiv": 60, "ToHitPerLvl": 0, "XPBase": 35, "XPExp": 1.8}, "score": 21.776465661223767, "scoreCI": [19.817894029676147, 24.177567244526365], "key": {"abyssDeath": 7, "caster.clvl": 13, "caster.deepest": 7, "caster.gold": 4.393939393939394, "caster.king": 0.8020833333333334, "caster.oracle": 0, "fighter.clvl": 12, "fighter.deepest": 6, "fighter.gold": 6.132323232323232, "fighter.king": 0.625, "fighter.oracle": 0, "gap": 0.17708333333333337, "stuck": 1}, "change": "bot: fighter bolts only awake targets (no bolt-pulling sleepers)", "why": "hypothesis for the fighter's loss under more mana (#12): bolts wake whole camps. Fighter king 0.68 -> 0.62 (noise, 13 up/18 down), score 20.29 -> 21.78; no predicted effect, so the simpler bot stays", "decision": "revert", "base": "balance/runs/020-base96.json", "vsBase": "+1.48 (-0.39\u2026+3.59)", "best": "21.44", "bestRun": "balance/runs/009-spider.json"}
