{"id":63,"time":"2026-10-01T10:46:27+02:00","name":"082-sleeper-memory-only","run":"balance/runs/082-sleeper-memory-only.json","rev":"db71fc7","dirty":true,"code":"e072715b4b","bot":"55c68a5c7b","first":1,"seeds":96,"turns":20000,"changed":null,"rules":{"AffixLvlScale":1,"ArmorCap":0.5,"ArmorK":50,"ArmorPerLvl":10,"BoltCostLvl":0.667,"BoltEnePow":1,"BoltMul":1,"BossHpLin":0.22,"BudgetMul":7,"ChampBase":8,"ChampDmg":1.3,"ChampHp":2.2,"ChampPerDepth":3,"DmgLin":0.24,"DmgQuad":0.02,"DropChance":12,"GambleBonus":1,"GamblePerDepth":30,"GamblePrice":120,"GoldChance":30,"GoldPerLvl":2,"HPPerLvl":4,"HealCost":0.5,"HpLin":0.32,"HpQuad":0.05,"ManaPerEne":1.7,"ManaPerLvl":2,"ManaPotion":0.4,"MonArmorK":120,"MonArmorPerLvl":2,"MonToHitPerLvl":3,"NovaMul":1,"PackMul":1,"PotionHeal":0.65,"PotionPrice":20,"PotionPricePerLvl":4,"QuestGoldPerLvl":100,"RareBonus":0.2,"RerollPerDepth":10,"RerollPrice":50,"ScrollPrice":40,"ScrollPricePerLvl":6,"SellDiv":12,"StrDiv":45,"ToHitPerLvl":0,"WakeRange":16,"XPBase":35,"XPExp":1.8},"score":13.801777903211992,"scoreCI":[12.506146720319357,15.916128308192329],"key":{"abyssDeath":10,"caster.clvl":14,"caster.deepest":7,"caster.gold":2.7313131313131316,"caster.king":0.9375,"caster.oracle":0.0625,"fighter.clvl":13,"fighter.deepest":7,"fighter.gold":4.737878787878788,"fighter.king":0.71875,"fighter.oracle":0.020833333333333332,"gap":0.21875,"stuck":0},"change":"bot: sleeper memory alone, no lost-prey rule","why":"caster flat (deepest -0.02), fighter king 0.78 -\u003e 0.72 (12 up/18 down), 0 stuck, score 13.80 (noise); superseded by the memory of every monster seen (#085)","decision":"revert","base":"balance/runs/071-reserve2.json","vsBase":"+0.61 (-1.29…+2.04)","best":"13.19","bestRun":"balance/runs/071-reserve2.json"}
{"id":64,"time":"2026-10-01T10:46:28+02:00","name":"083-sleeper-prey","run":"balance/runs/083-sleeper-prey.json","rev":"db71fc7","dirty":true,"code":"c8d3b9dcb1","bot":"a9f62c59dd","first":1,"seeds":96,"turns":20000,"changed":null,"rules":{"AffixLvlScale":1,"ArmorCap":0.5,"ArmorK":50,"ArmorPerLvl":10,"BoltCostLvl":0.667,"BoltEnePow":1,"BoltMul":1,"BossHpLin":0.22,"BudgetMul":7,"ChampBase":8,"ChampDmg":1.3,"ChampHp":2.2,"ChampPerDepth":3,"DmgLin":0.24,"DmgQuad":0.02,"DropChance":12,"GambleBonus":1,"GamblePerDepth":30,"GamblePrice":120,"GoldChance":30,"GoldPerLvl":2,"HPPerLvl":4,"HealCost":0.5,"HpLin":0.32,"HpQuad":0.05,"ManaPerEne":1.7,"ManaPerLvl":2,"ManaPotion":0.4,"MonArmorK":120,"MonArmorPerLvl":2,"MonToHitPerLvl":3,"NovaMul":1,"PackMul":1,"PotionHeal":0.65,"PotionPrice":20,"PotionPricePerLvl":4,"QuestGoldPerLvl":100,"RareBonus":0.2,"RerollPerDepth":10,"RerollPrice":50,"ScrollPrice":40,"ScrollPricePerLvl":6,"SellDiv":12,"StrDiv":45,"ToHitPerLvl":0,"WakeRange":16,"XPBase":35,"XPExp":1.8},"score":13.509006763597826,"scoreCI":[12.933269596442807,15.55508516021579],"key":{"abyssDeath":10,"caster.clvl":14,"caster.deepest":7,"caster.gold":2.8025974025974025,"caster.king":0.9166666666666666,"caster.oracle":0.03125,"fighter.clvl":13,"fighter.deepest":7,"fighter.gold":4.650505050505051,"fighter.king":0.78125,"fighter.oracle":0.010416666666666666,"gap":0.13541666666666663,"stuck":2},"change":"bot: a prey remembered asleep stays a threat out of sight (chased to its cell)","why":"caster 2044 still stuck and 2 new stuck on seeds 1-96, 3 on 2001-2096 (#084): chasing what is not in view walks into the unknown; the stuck class was an awake spider, not a sleeper","decision":"revert","base":"balance/runs/071-reserve2.json","vsBase":"+0.31 (-0.51…+0.97)","best":"13.19","bestRun":"balance/runs/071-reserve2.json"}
{"id":65,"time":"2026-10-01T10:46:28+02:00","name":"085-known","run":"balance/runs/085-known.json","rev":"db71fc7","dirty":true,"code":"3af189f065","bot":"10b2271869","first":1,"seeds":96,"turns":20000,"changed":null,"rules":{"AffixLvlScale":1,"ArmorCap":0.5,"ArmorK":50,"ArmorPerLvl":10,"BoltCostLvl":0.667,"BoltEnePow":1,"BoltMul":1,"BossHpLin":0.22,"BudgetMul":7,"ChampBase":8,"ChampDmg":1.3,"ChampHp":2.2,"ChampPerDepth":3,"DmgLin":0.24,"DmgQuad":0.02,"DropChance":12,"GambleBonus":1,"GamblePerDepth":30,"GamblePrice":120,"GoldChance":30,"GoldPerLvl":2,"HPPerLvl":4,"HealCost":0.5,"HpLin":0.32,"HpQuad":0.05,"ManaPerEne":1.7,"ManaPerLvl":2,"ManaPotion":0.4,"MonArmorK":120,"MonArmorPerLvl":2,"MonToHitPerLvl":3,"NovaMul":1,"PackMul":1,"PotionHeal":0.65,"PotionPrice":20,"PotionPricePerLvl":4,"QuestGoldPerLvl":100,"RareBonus":0.2,"RerollPerDepth":10,"RerollPrice":50,"ScrollPrice":40,"ScrollPricePerLvl":6,"SellDiv":12,"StrDiv":45,"ToHitPerLvl":0,"WakeRange":16,"XPBase":35,"XPExp":1.8},"score":13.249605288993338,"scoreCI":[12.799983278539747,15.50640877882971],"key":{"abyssDeath":10,"caster.clvl":14,"caster.deepest":7,"caster.gold":2.8025974025974025,"caster.king":0.9270833333333334,"caster.oracle":0.052083333333333336,"fighter.clvl":13,"fighter.deepest":7,"fighter.gold":4.715151515151515,"fighter.king":0.7916666666666666,"fighter.oracle":0.010416666666666666,"gap":0.13541666666666674,"stuck":0},"change":"bot: every monster in view is remembered where it stands (a sleeper until seen awake, dead or gone from its cell; one awake for 3 turns after its last sighting) and paths go around remembered cells from any cell (remember, known, held, pass)","why":"the route no longer depends on which cell a monster shows from: fighter 30's wobble gone; seeds 1-96 flat (fighter deepest 6.50 -\u003e 6.50, caster 7.30 -\u003e 7.27, 6-13 seeds differ), 0 stuck; seeds 2001-2096 (#086) flat, 2 stuck (caster 2017 marsh, 2044 grotto1: a different loop, see #089)","decision":"keep","base":"balance/runs/071-reserve2.json","vsBase":"+0.06 (-0.84…+1.00)","best":"13.19","bestRun":"balance/runs/071-reserve2.json"}
{"id":66,"time":"2026-10-01T10:46:29+02:00","name":"087-chase-memory","run":"balance/runs/087-chase-memory.json","rev":"db71fc7","dirty":true,"code":"14f4b1f739","bot":"838cbceab5","first":1,"seeds":96,"turns":20000,"changed":null,"rules":{"AffixLvlScale":1,"ArmorCap":0.5,"ArmorK":50,"ArmorPerLvl":10,"BoltCostLvl":0.667,"BoltEnePow":1,"BoltMul":1,"BossHpLin":0.22,"BudgetMul":7,"ChampBase":8,"ChampDmg":1.3,"ChampHp":2.2,"ChampPerDepth":3,"DmgLin":0.24,"DmgQuad":0.02,"DropChance":12,"GambleBonus":1,"GamblePerDepth":30,"GamblePrice":120,"GoldChance":30,"GoldPerLvl":2,"HPPerLvl":4,"HealCost":0.5,"HpLin":0.32,"HpQuad":0.05,"ManaPerEne":1.7,"ManaPerLvl":2,"ManaPotion":0.4,"MonArmorK":120,"MonArmorPerLvl":2,"MonToHitPerLvl":3,"NovaMul":1,"PackMul":1,"PotionHeal":0.65,"PotionPrice":20,"PotionPricePerLvl":4,"QuestGoldPerLvl":100,"RareBonus":0.2,"RerollPerDepth":10,"RerollPrice":50,"ScrollPrice":40,"ScrollPricePerLvl":6,"SellDiv":12,"StrDiv":45,"ToHitPerLvl":0,"WakeRange":16,"XPBase":35,"XPExp":1.8},"score":null,"scoreCI":[0,0],"fail":"3 stuck runs","key":{"abyssDeath":10,"caster.clvl":13,"caster.deepest":7,"caster.gold":2.637710437710438,"caster.king":0.8333333333333334,"caster.oracle":0.052083333333333336,"fighter.clvl":13,"fighter.deepest":7,"fighter.gold":4.833333333333333,"fighter.king":0.8229166666666666,"fighter.oracle":0.03125,"gap":0.020833333333333336,"stuck":3},"change":"bot: prey kept while remembered, chased to where it was last seen","why":"caster 2044: an awake spider 3 cells off, visible from one cell only, unable to reach the hero; the chase step took it out of view and the loot pulled back. Chasing by memory fixes the seed but is surely worse: caster clvl -0.91, kills -27, king -0.09 (sure) on seeds 1-96; fighter king 0.82 -\u003e 0.67 (sure) on 2001-2096 (#088); 3 and 5 stuck. Walking after what is out of view walks into more","decision":"revert","base":"balance/runs/071-reserve2.json","vsBase":"+NaN (+NaN…+NaN)","best":"13.19","bestRun":"balance/runs/071-reserve2.json"}
{"id":67,"time":"2026-10-01T10:46:29+02:00","name":"089-wobble","run":"balance/runs/089-wobble.json","rev":"db71fc7","dirty":true,"code":"34e274c670","bot":"b8c74bbb0b","first":1,"seeds":96,"turns":20000,"changed":null,"rules":{"AffixLvlScale":1,"ArmorCap":0.5,"ArmorK":50,"ArmorPerLvl":10,"BoltCostLvl":0.667,"BoltEnePow":1,"BoltMul":1,"BossHpLin":0.22,"BudgetMul":7,"ChampBase":8,"ChampDmg":1.3,"ChampHp":2.2,"ChampPerDepth":3,"DmgLin":0.24,"DmgQuad":0.02,"DropChance":12,"GambleBonus":1,"GamblePerDepth":30,"GamblePrice":120,"GoldChance":30,"GoldPerLvl":2,"HPPerLvl":4,"HealCost":0.5,"HpLin":0.32,"HpQuad":0.05,"ManaPerEne":1.7,"ManaPerLvl":2,"ManaPotion":0.4,"MonArmorK":120,"MonArmorPerLvl":2,"MonToHitPerLvl":3,"NovaMul":1,"PackMul":1,"PotionHeal":0.65,"PotionPrice":20,"PotionPricePerLvl":4,"QuestGoldPerLvl":100,"RareBonus":0.2,"RerollPerDepth":10,"RerollPrice":50,"ScrollPrice":40,"ScrollPricePerLvl":6,"SellDiv":12,"StrDiv":45,"ToHitPerLvl":0,"WakeRange":16,"XPBase":35,"XPExp":1.8},"score":13.187150620434718,"scoreCI":[12.276902440393052,15.099902162718516],"key":{"abyssDeath":10,"caster.clvl":14,"caster.deepest":7,"caster.gold":2.689177489177489,"caster.king":0.9375,"caster.oracle":0.052083333333333336,"fighter.clvl":13,"fighter.deepest":7,"fighter.gold":4.66,"fighter.king":0.78125,"fighter.oracle":0.03125,"gap":0.15625,"stuck":0},"change":"bot: wobble() notices six turns of A, B, A, B, A, B and leaves every enemy in view be for 40 turns; an ignored enemy adjacent is a threat all the same","why":"the generic net for the two-goal loop (an enemy that shows from one cell, loot the other way): all seven stuck seeds of #084/#088 now die normally; seeds 1-96 flat (score 13.19 -\u003e 13.19, fighter king 0.78, caster 0.94), 0 stuck; seeds 2001-2096 (#090) fighter deepest +0.23, clvl +0.36, king 0.82 -\u003e 0.86 (28 up/19 down), caster flat, 0 stuck of 192","decision":"keep","base":"balance/runs/071-reserve2.json","vsBase":"-0.01 (-2.00…+1.08)","best":"13.19","bestRun":"balance/runs/089-wobble.json"}
{"id":68,"time":"2026-10-01T10:46:30+02:00","name":"090-val-wobble","run":"balance/runs/090-val-wobble.json","rev":"db71fc7","dirty":true,"code":"34e274c670","bot":"b8c74bbb0b","first":2001,"seeds":96,"turns":20000,"changed":null,"rules":{"AffixLvlScale":1,"ArmorCap":0.5,"ArmorK":50,"ArmorPerLvl":10,"BoltCostLvl":0.667,"BoltEnePow":1,"BoltMul":1,"BossHpLin":0.22,"BudgetMul":7,"ChampBase":8,"ChampDmg":1.3,"ChampHp":2.2,"ChampPerDepth":3,"DmgLin":0.24,"DmgQuad":0.02,"DropChance":12,"GambleBonus":1,"GamblePerDepth":30,"GamblePrice":120,"GoldChance":30,"GoldPerLvl":2,"HPPerLvl":4,"HealCost":0.5,"HpLin":0.32,"HpQuad":0.05,"ManaPerEne":1.7,"ManaPerLvl":2,"ManaPotion":0.4,"MonArmorK":120,"MonArmorPerLvl":2,"MonToHitPerLvl":3,"NovaMul":1,"PackMul":1,"PotionHeal":0.65,"PotionPrice":20,"PotionPricePerLvl":4,"QuestGoldPerLvl":100,"RareBonus":0.2,"RerollPerDepth":10,"RerollPrice":50,"ScrollPrice":40,"ScrollPricePerLvl":6,"SellDiv":12,"StrDiv":45,"ToHitPerLvl":0,"WakeRange":16,"XPBase":35,"XPExp":1.8},"score":13.709551245605011,"scoreCI":[13.100010935374225,14.899502518749236],"key":{"abyssDeath":10,"caster.clvl":14,"caster.deepest":7,"caster.gold":2.9204545454545454,"caster.king":0.9583333333333334,"caster.oracle":0.041666666666666664,"fighter.clvl":13,"fighter.deepest":7,"fighter.gold":4.6328282828282825,"fighter.king":0.8645833333333334,"fighter.oracle":0.010416666666666666,"gap":0.09375,"stuck":0},"change":"validation: the final bot (monster memory, wobble guard) on seeds 2001-2096, defaults","why":"vs the earlier bot of #051: score 13.58 -\u003e 13.71 (noise), fighter deepest +0.23, clvl +0.36, king +0.04, caster flat; 0 stuck of 192 (was 1). The control for the WakeRange re-validation (#092)","decision":"keep","base":"balance/runs/077-val-control.json","vsBase":"+0.13 (-1.47…+1.10)","best":"13.19","bestRun":"balance/runs/089-wobble.json"}
{"id":69,"time":"2026-10-01T10:48:52+02:00","name":"091-wake10-final","run":"balance/runs/091-wake10-final.json","rev":"db71fc7","dirty":true,"code":"34e274c670","bot":"b8c74bbb0b","first":1,"seeds":96,"turns":20000,"changed":["WakeRange: 16 → 10"],"rules":{"AffixLvlScale":1,"ArmorCap":0.5,"ArmorK":50,"ArmorPerLvl":10,"BoltCostLvl":0.667,"BoltEnePow":1,"BoltMul":1,"BossHpLin":0.22,"BudgetMul":7,"ChampBase":8,"ChampDmg":1.3,"ChampHp":2.2,"ChampPerDepth":3,"DmgLin":0.24,"DmgQuad":0.02,"DropChance":12,"GambleBonus":1,"GamblePerDepth":30,"GamblePrice":120,"GoldChance":30,"GoldPerLvl":2,"HPPerLvl":4,"HealCost":0.5,"HpLin":0.32,"HpQuad":0.05,"ManaPerEne":1.7,"ManaPerLvl":2,"ManaPotion":0.4,"MonArmorK":120,"MonArmorPerLvl":2,"MonToHitPerLvl":3,"NovaMul":1,"PackMul":1,"PotionHeal":0.65,"PotionPrice":20,"PotionPricePerLvl":4,"QuestGoldPerLvl":100,"RareBonus":0.2,"RerollPerDepth":10,"RerollPrice":50,"ScrollPrice":40,"ScrollPricePerLvl":6,"SellDiv":12,"StrDiv":45,"ToHitPerLvl":0,"WakeRange":10,"XPBase":35,"XPExp":1.8},"score":13.835662357395483,"scoreCI":[13.267642256465253,14.492054405808922],"key":{"abyssDeath":10,"caster.clvl":14,"caster.deepest":7,"caster.gold":2.783982683982684,"caster.king":0.9479166666666666,"caster.oracle":0.041666666666666664,"fighter.clvl":13,"fighter.deepest":7,"fighter.gold":5.24969696969697,"fighter.king":0.9166666666666666,"fighter.oracle":0.03125,"gap":0.03125,"stuck":0},"change":"rules: WakeRange 16 -\u003e 10 on the final bot, seeds 1-96","why":"paired: fighter deepest +0.73, clvl +1.25, kills +44, king 0.78 -\u003e 0.92 (all sure); caster deepest +0.22, king 0.95; gap 0.16 -\u003e 0.03; grotto3 arrivals 9/19 -\u003e 16/15, abyss 3/4; 0 stuck. Score 13.19 -\u003e 13.84 (noise): fighter.king and fighter.gold overshoot their bands by what the grotto gives back. The recommended rule, as a design choice","decision":"keep","base":"balance/runs/089-wobble.json","vsBase":"+0.65 (-1.10…+1.75)","best":"13.19","bestRun":"balance/runs/089-wobble.json"}
{"id":70,"time":"2026-10-01T10:48:53+02:00","name":"092-val-wake10-final","run":"balance/runs/092-val-wake10-final.json","rev":"db71fc7","dirty":true,"code":"34e274c670","bot":"b8c74bbb0b","first":2001,"seeds":96,"turns":20000,"changed":["WakeRange: 16 → 10"],"rules":{"AffixLvlScale":1,"ArmorCap":0.5,"ArmorK":50,"ArmorPerLvl":10,"BoltCostLvl":0.667,"BoltEnePow":1,"BoltMul":1,"BossHpLin":0.22,"BudgetMul":7,"ChampBase":8,"ChampDmg":1.3,"ChampHp":2.2,"ChampPerDepth":3,"DmgLin":0.24,"DmgQuad":0.02,"DropChance":12,"GambleBonus":1,"GamblePerDepth":30,"GamblePrice":120,"GoldChance":30,"GoldPerLvl":2,"HPPerLvl":4,"HealCost":0.5,"HpLin":0.32,"HpQuad":0.05,"ManaPerEne":1.7,"ManaPerLvl":2,"ManaPotion":0.4,"MonArmorK":120,"MonArmorPerLvl":2,"MonToHitPerLvl":3,"NovaMul":1,"PackMul":1,"PotionHeal":0.65,"PotionPrice":20,"PotionPricePerLvl":4,"QuestGoldPerLvl":100,"RareBonus":0.2,"RerollPerDepth":10,"RerollPrice":50,"ScrollPrice":40,"ScrollPricePerLvl":6,"SellDiv":12,"StrDiv":45,"ToHitPerLvl":0,"WakeRange":10,"XPBase":35,"XPExp":1.8},"score":13.5775584510785,"scoreCI":[12.652843438835019,14.266130859601263],"key":{"abyssDeath":10,"caster.clvl":14,"caster.deepest":7,"caster.gold":2.8904761904761904,"caster.king":0.9583333333333334,"caster.oracle":0.052083333333333336,"fighter.clvl":14,"fighter.deepest":7,"fighter.gold":4.967099567099567,"fighter.king":0.8854166666666666,"fighter.oracle":0.020833333333333332,"gap":0.07291666666666674,"stuck":0},"change":"validation: WakeRange 10 on the final bot, fresh seeds 2001-2096","why":"paired vs #58: fighter deepest +0.32 (34 up/20 down), clvl +0.58, king 0.86 -\u003e 0.89, oracle 0.01 -\u003e 0.02; caster deepest +0.15, king 0.96, oracle 0.04 -\u003e 0.05; grotto3 arrivals 8/16 -\u003e 15/20, abyss 1/3 -\u003e 2/5; goldIn +1558 (sure); score 13.71 -\u003e 13.58 (noise); 0 stuck of 192. Same direction as seeds 1-96, about half the size: the pick holds","decision":"keep","base":"balance/runs/090-val-wobble.json","vsBase":"-0.13 (-1.58…+0.89)","best":"13.19","bestRun":"balance/runs/089-wobble.json"}
{"id":71,"time":"2026-10-03T20:55:04+02:00","name":"093-baseline-pre-wanderer","run":"balance/runs/093-baseline-pre-wanderer.json","rev":"b9a1a41","dirty":false,"code":"f29b92b378","bot":"159d3bde9b","first":1,"seeds":96,"turns":20000,"changed":null,"rules":{"AffixLvlScale":1,"ArmorCap":0.5,"ArmorK":50,"ArmorPerLvl":10,"BoltCostLvl":0.667,"BoltEnePow":1,"BoltMul":1,"BossHpLin":0.22,"BudgetMul":7,"ChampBase":8,"ChampDmg":1.3,"ChampHp":2.2,"ChampPerDepth":3,"DmgLin":0.24,"DmgQuad":0.02,"DropChance":12,"GambleBonus":1,"GamblePerDepth":30,"GamblePrice":120,"GoldChance":30,"GoldPerLvl":2,"HPPerLvl":4,"HealCost":0.5,"HpLin":0.32,"HpQuad":0.05,"ManaPerEne":1.7,"ManaPerLvl":2,"ManaPotion":0.4,"MonArmorK":120,"MonArmorPerLvl":2,"MonToHitPerLvl":3,"NovaMul":1,"PackMul":1,"PotionHeal":0.65,"PotionPrice":20,"PotionPricePerLvl":4,"QuestGoldPerLvl":100,"RareBonus":0.2,"RerollPerDepth":10,"RerollPrice":50,"ScrollPrice":40,"ScrollPricePerLvl":6,"SellDiv":12,"StrDiv":45,"ToHitPerLvl":0,"WakeRange":10,"XPBase":35,"XPExp":1.8},"score":13.835662357395483,"scoreCI":[13.267642256465253,14.492054405808922],"key":{"abyssDeath":10,"caster.clvl":14,"caster.deepest":7,"caster.gold":2.783982683982684,"caster.king":0.9479166666666666,"caster.oracle":0.041666666666666664,"fighter.clvl":13,"fighter.deepest":7,"fighter.gold":5.24969696969697,"fighter.king":0.9166666666666666,"fighter.oracle":0.03125,"gap":0.03125,"stuck":0},"change":"baseline before the Last Wanderer boss","why":"slice 1 of the final boss adds a boss to abyss3; this is the before run","decision":"baseline","base":"balance/runs/089-wobble.json","vsBase":"+0.65 (-1.10…+1.75)","best":"13.19","bestRun":"balance/runs/089-wobble.json"}
{"id":72,"time":"2026-10-03T21:01:18+02:00","name":"094-wanderer-slice1","run":"balance/runs/094-wanderer-slice1.json","rev":"b9a1a41","dirty":true,"code":"6b8bf12dfe","bot":"159d3bde9b","first":1,"seeds":96,"turns":20000,"changed":null,"rules":{"AffixLvlScale":1,"ArmorCap":0.5,"ArmorK":50,"ArmorPerLvl":10,"BoltCostLvl":0.667,"BoltEnePow":1,"BoltMul":1,"BossHpLin":0.22,"BudgetMul":7,"ChampBase":8,"ChampDmg":1.3,"ChampHp":2.2,"ChampPerDepth":3,"DmgLin":0.24,"DmgQuad":0.02,"DropChance":12,"GambleBonus":1,"GamblePerDepth":30,"GamblePrice":120,"GoldChance":30,"GoldPerLvl":2,"HPPerLvl":4,"HealCost":0.5,"HpLin":0.32,"HpQuad":0.05,"ManaPerEne":1.7,"ManaPerLvl":2,"ManaPotion":0.4,"MonArmorK":120,"MonArmorPerLvl":2,"MonToHitPerLvl":3,"NovaMul":1,"PackMul":1,"PotionHeal":0.65,"PotionPrice":20,"PotionPricePerLvl":4,"QuestGoldPerLvl":100,"RareBonus":0.2,"RerollPerDepth":10,"RerollPrice":50,"ScrollPrice":40,"ScrollPricePerLvl":6,"SellDiv":12,"StrDiv":45,"ToHitPerLvl":0,"WakeRange":10,"XPBase":35,"XPExp":1.8},"score":13.835662357395483,"scoreCI":[13.267642256465253,14.492054405808922],"key":{"abyssDeath":10,"caster.clvl":14,"caster.deepest":7,"caster.gold":2.783982683982684,"caster.king":0.9479166666666666,"caster.oracle":0.041666666666666664,"fighter.clvl":13,"fighter.deepest":7,"fighter.gold":5.24969696969697,"fighter.king":0.9166666666666666,"fighter.oracle":0.03125,"gap":0.03125,"stuck":0},"change":"the Last Wanderer on abyss3: light-drinking boss, Hearth Below chamber, sealed way down","why":"slice 1 of the final boss; no bot run reaches abyss3 today, so the metrics are unchanged by construction","decision":"keep","base":"balance/runs/093-baseline-pre-wanderer.json","vsBase":"+0.00 (+0.00…+0.00)","best":"13.19","bestRun":"balance/runs/089-wobble.json"}
{"id":73,"time":"2026-10-03T21:42:41+02:00","name":"095-wanderer-slice2","run":"balance/runs/095-wanderer-slice2.json","rev":"b9a1a41","dirty":true,"code":"8834aa3158","bot":"159d3bde9b","first":1,"seeds":96,"turns":20000,"changed":null,"rules":{"AffixLvlScale":1,"ArmorCap":0.5,"ArmorK":50,"ArmorPerLvl":10,"BoltCostLvl":0.667,"BoltEnePow":1,"BoltMul":1,"BossHpLin":0.22,"BudgetMul":7,"ChampBase":8,"ChampDmg":1.3,"ChampHp":2.2,"ChampPerDepth":3,"DmgLin":0.24,"DmgQuad":0.02,"DropChance":12,"GambleBonus":1,"GamblePerDepth":30,"GamblePrice":120,"GoldChance":30,"GoldPerLvl":2,"HPPerLvl":4,"HealCost":0.5,"HpLin":0.32,"HpQuad":0.05,"ManaPerEne":1.7,"ManaPerLvl":2,"ManaPotion":0.4,"MonArmorK":120,"MonArmorPerLvl":2,"MonToHitPerLvl":3,"NovaMul":1,"PackMul":1,"PotionHeal":0.65,"PotionPrice":20,"PotionPricePerLvl":4,"QuestGoldPerLvl":100,"RareBonus":0.2,"RerollPerDepth":10,"RerollPrice":50,"ScrollPrice":40,"ScrollPricePerLvl":6,"SellDiv":12,"StrDiv":45,"ToHitPerLvl":0,"WakeRange":10,"XPBase":35,"XPExp":1.8},"score":13.835662357395483,"scoreCI":[13.267642256465253,14.492054405808922],"key":{"abyssDeath":10,"caster.clvl":14,"caster.deepest":7,"caster.gold":2.783982683982684,"caster.king":0.9479166666666666,"caster.oracle":0.041666666666666664,"fighter.clvl":13,"fighter.deepest":7,"fighter.gold":5.24969696969697,"fighter.king":0.9166666666666666,"fighter.oracle":0.03125,"gap":0.03125,"stuck":0},"change":"the Last Wanderer follows: through the town portal (which collapses), any stairs, and his own red portal at half life","why":"slice 2 of the final boss; no bot run reaches abyss3, so the metrics are unchanged by construction","decision":"keep","base":"balance/runs/094-wanderer-slice1.json","vsBase":"+0.00 (+0.00…+0.00)","best":"13.19","bestRun":"balance/runs/089-wobble.json"}
