{"id":85,"time":"2026-10-10T16:14:20+02:00","name":"110-dmgshape","run":"balance/runs/110-dmgshape.json","rev":"07dcbcc","dirty":true,"code":"2665468546","bot":"82a412040b","first":1,"seeds":96,"turns":20000,"changed":["DmgLin: 0.24 → 0.34","DmgQuad: 0.02 → 0.01"],"rules":{"AffixLvlScale":1,"ArmorCap":0.5,"ArmorK":50,"ArmorPerLvl":10,"BoltCostLvl":0.667,"BoltEnePow":1,"BoltMul":1,"BossHpLin":0.22,"BudgetMul":7,"ChampBase":8,"ChampDmg":1.3,"ChampHp":2.2,"ChampPerDepth":3,"DmgLin":0.34,"DmgQuad":0.01,"DropChance":12,"GambleBonus":1,"GamblePerDepth":30,"GamblePrice":120,"GoldChance":30,"GoldPerLvl":2,"HPPerLvl":4,"HealCost":0.5,"HpLin":0.32,"HpQuad":0.05,"ManaPerEne":1.7,"ManaPerLvl":2,"ManaPotion":0.4,"MonArmorK":120,"MonArmorPerLvl":2,"MonToHitPerLvl":3,"NovaMul":1,"PackMul":1,"PotionHeal":0.65,"PotionPrice":20,"PotionPricePerLvl":4,"QuestGoldPerLvl":100,"RareBonus":0.2,"RerollPerDepth":10,"RerollPrice":50,"ScrollPrice":40,"ScrollPricePerLvl":6,"SellDiv":12,"StrDiv":45,"ToHitPerLvl":0,"WakeRange":10,"WandererDmg":1,"WandererHp":2.8,"XPBase":35,"XPExp":1.8},"score":12.921784487072934,"scoreCI":[12.114825347414719,14.095882196281426],"key":{"abyssDeath":10,"caster.clvl":18,"caster.deepest":8,"caster.gold":3.4075757575757577,"caster.king":0.9583333333333334,"caster.oracle":0.15625,"fighter.clvl":18,"fighter.deepest":8,"fighter.gold":7.01010101010101,"fighter.king":0.8333333333333334,"fighter.oracle":0.125,"gap":0.125,"stuck":0},"change":"DmgLin 0.24 -\u003e 0.34, DmgQuad 0.02 -\u003e 0.01: monster damage +10% at the crypt, +6% at the grotto, 0 at lvl 11","why":"the crypt pack bands move a little (packLive crypt4 19.4-\u003e16.3, 17.4-\u003e14.4) but the grotto pays: fighter clvl -1.4 and kills -53 (sure), oracle 0.19-\u003e0.12, caster deepest -0.41 (sure); the score gain (-0.43) is the gold band falling with income","decision":"revert","base":"balance/runs/109-baseline.json","vsBase":"-0.43 (-1.69…+1.18)","best":"13.19","bestRun":"balance/runs/089-wobble.json"}
{"id":86,"time":"2026-10-10T16:14:20+02:00","name":"111-hpshape","run":"balance/runs/111-hpshape.json","rev":"07dcbcc","dirty":true,"code":"2665468546","bot":"82a412040b","first":1,"seeds":96,"turns":20000,"changed":["HpLin: 0.32 → 0.42","HpQuad: 0.05 → 0.035"],"rules":{"AffixLvlScale":1,"ArmorCap":0.5,"ArmorK":50,"ArmorPerLvl":10,"BoltCostLvl":0.667,"BoltEnePow":1,"BoltMul":1,"BossHpLin":0.22,"BudgetMul":7,"ChampBase":8,"ChampDmg":1.3,"ChampHp":2.2,"ChampPerDepth":3,"DmgLin":0.24,"DmgQuad":0.02,"DropChance":12,"GambleBonus":1,"GamblePerDepth":30,"GamblePrice":120,"GoldChance":30,"GoldPerLvl":2,"HPPerLvl":4,"HealCost":0.5,"HpLin":0.42,"HpQuad":0.035,"ManaPerEne":1.7,"ManaPerLvl":2,"ManaPotion":0.4,"MonArmorK":120,"MonArmorPerLvl":2,"MonToHitPerLvl":3,"NovaMul":1,"PackMul":1,"PotionHeal":0.65,"PotionPrice":20,"PotionPricePerLvl":4,"QuestGoldPerLvl":100,"RareBonus":0.2,"RerollPerDepth":10,"RerollPrice":50,"ScrollPrice":40,"ScrollPricePerLvl":6,"SellDiv":12,"StrDiv":45,"ToHitPerLvl":0,"WakeRange":10,"WandererDmg":1,"WandererHp":2.8,"XPBase":35,"XPExp":1.8},"score":12.108569966618166,"scoreCI":[11.22661114161911,13.412401138597874],"key":{"abyssDeath":11,"caster.clvl":19,"caster.deepest":8,"caster.gold":3.7204545454545452,"caster.king":0.9479166666666666,"caster.oracle":0.2604166666666667,"fighter.clvl":18,"fighter.deepest":8,"fighter.gold":7.332121212121212,"fighter.king":0.875,"fighter.oracle":0.19791666666666666,"gap":0.07291666666666663,"stuck":0},"change":"HpLin 0.32 -\u003e 0.42, HpQuad 0.05 -\u003e 0.035: monster life +8% at crypt2, -1% at grotto1, -5% at lvl 11","why":"score 13.35-\u003e12.11 (noise, -2.49..+0.29) all from caster oracle 0.20-\u003e0.26; the crypt bands do not move (packLive within 0.4), fighter surplus -184 (sure); the shape cannot reach the crypt without touching the deep game, kept out of the pick","decision":"revert","base":"balance/runs/109-baseline.json","vsBase":"-1.24 (-2.49…+0.29)","best":"13.19","bestRun":"balance/runs/089-wobble.json"}
{"id":87,"time":"2026-10-10T16:14:21+02:00","name":"112-champbase","run":"balance/runs/112-champbase.json","rev":"07dcbcc","dirty":true,"code":"2665468546","bot":"82a412040b","first":1,"seeds":96,"turns":20000,"changed":["ChampBase: 8 → 12"],"rules":{"AffixLvlScale":1,"ArmorCap":0.5,"ArmorK":50,"ArmorPerLvl":10,"BoltCostLvl":0.667,"BoltEnePow":1,"BoltMul":1,"BossHpLin":0.22,"BudgetMul":7,"ChampBase":12,"ChampDmg":1.3,"ChampHp":2.2,"ChampPerDepth":3,"DmgLin":0.24,"DmgQuad":0.02,"DropChance":12,"GambleBonus":1,"GamblePerDepth":30,"GamblePrice":120,"GoldChance":30,"GoldPerLvl":2,"HPPerLvl":4,"HealCost":0.5,"HpLin":0.32,"HpQuad":0.05,"ManaPerEne":1.7,"ManaPerLvl":2,"ManaPotion":0.4,"MonArmorK":120,"MonArmorPerLvl":2,"MonToHitPerLvl":3,"NovaMul":1,"PackMul":1,"PotionHeal":0.65,"PotionPrice":20,"PotionPricePerLvl":4,"QuestGoldPerLvl":100,"RareBonus":0.2,"RerollPerDepth":10,"RerollPrice":50,"ScrollPrice":40,"ScrollPricePerLvl":6,"SellDiv":12,"StrDiv":45,"ToHitPerLvl":0,"WakeRange":10,"WandererDmg":1,"WandererHp":2.8,"XPBase":35,"XPExp":1.8},"score":14.887419572778775,"scoreCI":[13.833227813972767,15.715081115300894],"key":{"abyssDeath":11,"caster.clvl":19,"caster.deepest":8,"caster.gold":4.213468013468013,"caster.king":0.9479166666666666,"caster.oracle":0.15625,"fighter.clvl":19,"fighter.deepest":8,"fighter.gold":8.364242424242423,"fighter.king":0.8958333333333334,"fighter.oracle":0.17708333333333334,"gap":0.05208333333333326,"stuck":0},"change":"ChampBase 8 -\u003e 12: champion packs 12% at depth 0 (crypt2 21%, grotto1 33%)","why":"surely worse where it counts: caster oracle 0.20-\u003e0.16, caster surplus +251 (sure) and fighter kills.crypt4 -0.45 (sure): more champions feed the fighter and hurt the caster, the 2026-09 lesson again","decision":"revert","base":"balance/runs/109-baseline.json","vsBase":"+1.54 (-0.19…+2.97)","best":"13.19","bestRun":"balance/runs/089-wobble.json"}
{"id":88,"time":"2026-10-10T16:14:54+02:00","name":"113-manapotion","run":"balance/runs/113-manapotion.json","rev":"07dcbcc","dirty":true,"code":"2665468546","bot":"82a412040b","first":1,"seeds":96,"turns":20000,"changed":["ManaPotion: 0.4 → 0.6"],"rules":{"AffixLvlScale":1,"ArmorCap":0.5,"ArmorK":50,"ArmorPerLvl":10,"BoltCostLvl":0.667,"BoltEnePow":1,"BoltMul":1,"BossHpLin":0.22,"BudgetMul":7,"ChampBase":8,"ChampDmg":1.3,"ChampHp":2.2,"ChampPerDepth":3,"DmgLin":0.24,"DmgQuad":0.02,"DropChance":12,"GambleBonus":1,"GamblePerDepth":30,"GamblePrice":120,"GoldChance":30,"GoldPerLvl":2,"HPPerLvl":4,"HealCost":0.5,"HpLin":0.32,"HpQuad":0.05,"ManaPerEne":1.7,"ManaPerLvl":2,"ManaPotion":0.6,"MonArmorK":120,"MonArmorPerLvl":2,"MonToHitPerLvl":3,"NovaMul":1,"PackMul":1,"PotionHeal":0.65,"PotionPrice":20,"PotionPricePerLvl":4,"QuestGoldPerLvl":100,"RareBonus":0.2,"RerollPerDepth":10,"RerollPrice":50,"ScrollPrice":40,"ScrollPricePerLvl":6,"SellDiv":12,"StrDiv":45,"ToHitPerLvl":0,"WakeRange":10,"WandererDmg":1,"WandererHp":2.8,"XPBase":35,"XPExp":1.8},"score":13.19291571396971,"scoreCI":[12.285372253718522,15.139859143866872],"key":{"abyssDeath":11,"caster.clvl":19,"caster.deepest":9,"caster.gold":5.187205387205387,"caster.king":0.9791666666666666,"caster.oracle":0.34375,"fighter.clvl":18,"fighter.deepest":8,"fighter.gold":7.706060606060606,"fighter.king":0.9479166666666666,"fighter.oracle":0.20833333333333334,"gap":0.13541666666666666,"stuck":1},"change":"ManaPotion 0.4 -\u003e 0.6: a mana potion restores 60% of the pool","why":"candidate, parked until the bot fixes are in: caster oracle 0.20-\u003e0.34 (sure, +0.04..+0.25), deepest +0.55, clvl +1.0, trips -4.8 (all sure); the caster gold band takes it back (3.8-\u003e5.2) so the score is flat (-0.16)","decision":"revert","base":"balance/runs/109-baseline.json","vsBase":"-0.16 (-1.51…+2.08)","best":"13.19","bestRun":"balance/runs/089-wobble.json"}
{"id":89,"time":"2026-10-10T16:14:54+02:00","name":"114-boltcost","run":"balance/runs/114-boltcost.json","rev":"07dcbcc","dirty":true,"code":"2665468546","bot":"82a412040b","first":1,"seeds":96,"turns":20000,"changed":["BoltCostLvl: 0.667 → 0.4"],"rules":{"AffixLvlScale":1,"ArmorCap":0.5,"ArmorK":50,"ArmorPerLvl":10,"BoltCostLvl":0.4,"BoltEnePow":1,"BoltMul":1,"BossHpLin":0.22,"BudgetMul":7,"ChampBase":8,"ChampDmg":1.3,"ChampHp":2.2,"ChampPerDepth":3,"DmgLin":0.24,"DmgQuad":0.02,"DropChance":12,"GambleBonus":1,"GamblePerDepth":30,"GamblePrice":120,"GoldChance":30,"GoldPerLvl":2,"HPPerLvl":4,"HealCost":0.5,"HpLin":0.32,"HpQuad":0.05,"ManaPerEne":1.7,"ManaPerLvl":2,"ManaPotion":0.4,"MonArmorK":120,"MonArmorPerLvl":2,"MonToHitPerLvl":3,"NovaMul":1,"PackMul":1,"PotionHeal":0.65,"PotionPrice":20,"PotionPricePerLvl":4,"QuestGoldPerLvl":100,"RareBonus":0.2,"RerollPerDepth":10,"RerollPrice":50,"ScrollPrice":40,"ScrollPricePerLvl":6,"SellDiv":12,"StrDiv":45,"ToHitPerLvl":0,"WakeRange":10,"WandererDmg":1,"WandererHp":2.8,"XPBase":35,"XPExp":1.8},"score":14.292300369431768,"scoreCI":[13.332282450180392,15.492275662805424],"key":{"abyssDeath":11,"caster.clvl":19,"caster.deepest":9,"caster.gold":5.2287878787878785,"caster.king":0.9583333333333334,"caster.oracle":0.25,"fighter.clvl":18,"fighter.deepest":8,"fighter.gold":7.5181818181818185,"fighter.king":0.9166666666666666,"fighter.oracle":0.15625,"gap":0.09375,"stuck":0},"change":"BoltCostLvl 0.667 -\u003e 0.4: Firebolt 13 mana at lvl 19 instead of 18","why":"half of ManaPotion 0.6 on the same seeds: caster oracle 0.20-\u003e0.25 (not sure), trips -7 and surplus +539 (sure), score +0.94 (noise); the cheaper bolt mostly saves trips, the bigger mana potion wins fights","decision":"revert","base":"balance/runs/109-baseline.json","vsBase":"+0.94 (-0.37…+2.29)","best":"13.19","bestRun":"balance/runs/089-wobble.json"}
{"id":90,"time":"2026-10-10T16:15:12+02:00","name":"115-strdiv","run":"balance/runs/115-strdiv.json","rev":"07dcbcc","dirty":true,"code":"2665468546","bot":"82a412040b","first":1,"seeds":96,"turns":20000,"changed":["StrDiv: 45 → 40"],"rules":{"AffixLvlScale":1,"ArmorCap":0.5,"ArmorK":50,"ArmorPerLvl":10,"BoltCostLvl":0.667,"BoltEnePow":1,"BoltMul":1,"BossHpLin":0.22,"BudgetMul":7,"ChampBase":8,"ChampDmg":1.3,"ChampHp":2.2,"ChampPerDepth":3,"DmgLin":0.24,"DmgQuad":0.02,"DropChance":12,"GambleBonus":1,"GamblePerDepth":30,"GamblePrice":120,"GoldChance":30,"GoldPerLvl":2,"HPPerLvl":4,"HealCost":0.5,"HpLin":0.32,"HpQuad":0.05,"ManaPerEne":1.7,"ManaPerLvl":2,"ManaPotion":0.4,"MonArmorK":120,"MonArmorPerLvl":2,"MonToHitPerLvl":3,"NovaMul":1,"PackMul":1,"PotionHeal":0.65,"PotionPrice":20,"PotionPricePerLvl":4,"QuestGoldPerLvl":100,"RareBonus":0.2,"RerollPerDepth":10,"RerollPrice":50,"ScrollPrice":40,"ScrollPricePerLvl":6,"SellDiv":12,"StrDiv":40,"ToHitPerLvl":0,"WakeRange":10,"WandererDmg":1,"WandererHp":2.8,"XPBase":35,"XPExp":1.8},"score":13.077640457758061,"scoreCI":[11.860610236386483,14.11074480978252],"key":{"abyssDeath":11,"caster.clvl":19,"caster.deepest":8,"caster.gold":3.653939393939394,"caster.king":0.96875,"caster.oracle":0.20833333333333334,"fighter.clvl":18,"fighter.deepest":8,"fighter.gold":7.7526170798898075,"fighter.king":0.90625,"fighter.oracle":0.20833333333333334,"gap":0.0625,"stuck":2},"change":"StrDiv 45 -\u003e 40: melee damage 1 + STR/40","why":"noise everywhere (score -0.27, deepest +0.18, oracle +0.02); the fighter drinks fewer potions (-0.72 a level, sure) and nothing else moves: its grotto deaths are pack fights, not damage","decision":"revert","base":"balance/runs/109-baseline.json","vsBase":"-0.27 (-1.71…+1.13)","best":"13.19","bestRun":"balance/runs/089-wobble.json"}
{"id":91,"time":"2026-10-10T16:16:53+02:00","name":"116-portal-blocked","run":"balance/runs/116-portal-blocked.json","rev":"07dcbcc","dirty":true,"code":"c815c13102","bot":"0c6621d835","first":1,"seeds":96,"turns":20000,"changed":null,"rules":{"AffixLvlScale":1,"ArmorCap":0.5,"ArmorK":50,"ArmorPerLvl":10,"BoltCostLvl":0.667,"BoltEnePow":1,"BoltMul":1,"BossHpLin":0.22,"BudgetMul":7,"ChampBase":8,"ChampDmg":1.3,"ChampHp":2.2,"ChampPerDepth":3,"DmgLin":0.24,"DmgQuad":0.02,"DropChance":12,"GambleBonus":1,"GamblePerDepth":30,"GamblePrice":120,"GoldChance":30,"GoldPerLvl":2,"HPPerLvl":4,"HealCost":0.5,"HpLin":0.32,"HpQuad":0.05,"ManaPerEne":1.7,"ManaPerLvl":2,"ManaPotion":0.4,"MonArmorK":120,"MonArmorPerLvl":2,"MonToHitPerLvl":3,"NovaMul":1,"PackMul":1,"PotionHeal":0.65,"PotionPrice":20,"PotionPricePerLvl":4,"QuestGoldPerLvl":100,"RareBonus":0.2,"RerollPerDepth":10,"RerollPrice":50,"ScrollPrice":40,"ScrollPricePerLvl":6,"SellDiv":12,"StrDiv":45,"ToHitPerLvl":0,"WakeRange":10,"WandererDmg":1,"WandererHp":2.8,"XPBase":35,"XPExp":1.8},"score":12.604041516807294,"scoreCI":[11.707069536789678,14.137014113237795],"key":{"abyssDeath":11,"caster.clvl":19,"caster.deepest":9,"caster.gold":3.7542087542087543,"caster.king":0.96875,"caster.oracle":0.2708333333333333,"fighter.clvl":18,"fighter.deepest":8,"fighter.gold":7.787878787878788,"fighter.king":0.8854166666666666,"fighter.oracle":0.1875,"gap":0.08333333333333337,"stuck":0},"change":"bot: a hostile standing on the open portal (or a wall of them before it) blocks it; with a scroll in hand the bot reads a fresh one beside itself instead of fighting through","why":"probe over seeds 1-96: in 31 of 192 deaths a monster stood on the portal the bot was walking to, 20 of them with scrolls in hand; caster deepest +0.28 (sure), oracle 0.20-\u003e0.27, fighter unchanged; score 13.35-\u003e12.60 (noise)","decision":"keep","base":"balance/runs/109-baseline.json","vsBase":"-0.75 (-1.55…+0.24)","best":"12.60","bestRun":"balance/runs/116-portal-blocked.json"}
{"id":92,"time":"2026-10-10T16:19:18+02:00","name":"117-shop-spent","run":"balance/runs/117-shop-spent.json","rev":"07dcbcc","dirty":true,"code":"bd2fcd4181","bot":"66b2c4291b","first":1,"seeds":96,"turns":20000,"changed":null,"rules":{"AffixLvlScale":1,"ArmorCap":0.5,"ArmorK":50,"ArmorPerLvl":10,"BoltCostLvl":0.667,"BoltEnePow":1,"BoltMul":1,"BossHpLin":0.22,"BudgetMul":7,"ChampBase":8,"ChampDmg":1.3,"ChampHp":2.2,"ChampPerDepth":3,"DmgLin":0.24,"DmgQuad":0.02,"DropChance":12,"GambleBonus":1,"GamblePerDepth":30,"GamblePrice":120,"GoldChance":30,"GoldPerLvl":2,"HPPerLvl":4,"HealCost":0.5,"HpLin":0.32,"HpQuad":0.05,"ManaPerEne":1.7,"ManaPerLvl":2,"ManaPotion":0.4,"MonArmorK":120,"MonArmorPerLvl":2,"MonToHitPerLvl":3,"NovaMul":1,"PackMul":1,"PotionHeal":0.65,"PotionPrice":20,"PotionPricePerLvl":4,"QuestGoldPerLvl":100,"RareBonus":0.2,"RerollPerDepth":10,"RerollPrice":50,"ScrollPrice":40,"ScrollPricePerLvl":6,"SellDiv":12,"StrDiv":45,"ToHitPerLvl":0,"WakeRange":10,"WandererDmg":1,"WandererHp":2.8,"XPBase":35,"XPExp":1.8},"score":13.432754549590502,"scoreCI":[12.455720304049693,14.581346242599007],"key":{"abyssDeath":11,"caster.clvl":19,"caster.deepest":8,"caster.gold":3.3641873278236916,"caster.king":0.9583333333333334,"caster.oracle":0.21875,"fighter.clvl":18,"fighter.deepest":8,"fighter.gold":7.8784511784511775,"fighter.king":0.90625,"fighter.oracle":0.14583333333333334,"gap":0.07291666666666666,"stuck":0},"change":"bot: up to 4 rerolls and 4 gambles a trip while the purse allows, instead of one of each","why":"gold held at death -1032 (sure) and nothing bought with it: gear on arrival flat to slightly worse at every checkpoint, fighter oracle 0.19-\u003e0.15, caster deepest -0.31 (not sure), score +0.83; a gamble at depth rarely beats gear that is already the best of a level's drops, as the 2026-10-01 pass found","decision":"revert","base":"balance/runs/116-portal-blocked.json","vsBase":"+0.83 (-0.71…+1.98)","best":"12.60","bestRun":"balance/runs/116-portal-blocked.json"}
{"id":93,"time":"2026-10-10T16:24:04+02:00","name":"118-manapotion-bot","run":"balance/runs/118-manapotion-bot.json","rev":"07dcbcc","dirty":true,"code":"c815c13102","bot":"0c6621d835","first":1,"seeds":96,"turns":20000,"changed":["ManaPotion: 0.4 → 0.6"],"rules":{"AffixLvlScale":1,"ArmorCap":0.5,"ArmorK":50,"ArmorPerLvl":10,"BoltCostLvl":0.667,"BoltEnePow":1,"BoltMul":1,"BossHpLin":0.22,"BudgetMul":7,"ChampBase":8,"ChampDmg":1.3,"ChampHp":2.2,"ChampPerDepth":3,"DmgLin":0.24,"DmgQuad":0.02,"DropChance":12,"GambleBonus":1,"GamblePerDepth":30,"GamblePrice":120,"GoldChance":30,"GoldPerLvl":2,"HPPerLvl":4,"HealCost":0.5,"HpLin":0.32,"HpQuad":0.05,"ManaPerEne":1.7,"ManaPerLvl":2,"ManaPotion":0.6,"MonArmorK":120,"MonArmorPerLvl":2,"MonToHitPerLvl":3,"NovaMul":1,"PackMul":1,"PotionHeal":0.65,"PotionPrice":20,"PotionPricePerLvl":4,"QuestGoldPerLvl":100,"RareBonus":0.2,"RerollPerDepth":10,"RerollPrice":50,"ScrollPrice":40,"ScrollPricePerLvl":6,"SellDiv":12,"StrDiv":45,"ToHitPerLvl":0,"WakeRange":10,"WandererDmg":1,"WandererHp":2.8,"XPBase":35,"XPExp":1.8},"score":13.018649457651064,"scoreCI":[12.046107877334679,15.138557013487342],"key":{"abyssDeath":11,"caster.clvl":20,"caster.deepest":9,"caster.gold":5.116804407713499,"caster.king":0.9791666666666666,"caster.oracle":0.40625,"fighter.clvl":19,"fighter.deepest":9,"fighter.gold":7.66060606060606,"fighter.king":0.9479166666666666,"fighter.oracle":0.23958333333333334,"gap":0.16666666666666666,"stuck":0},"change":"ManaPotion 0.4 -\u003e 0.6, re-measured on the fixed bot","why":"caster oracle 0.27-\u003e0.41, deepest +0.51, clvl +1.0, trips -5.9 (all sure); fighter oracle 0.19-\u003e0.24 (not sure); caster gold 3.75-\u003e5.12 and gap 0.17 take the score back (+0.41, noise); 0.5 does the same for the caster for less gold (#95), so 0.5 is the candidate","decision":"revert","base":"balance/runs/116-portal-blocked.json","vsBase":"+0.41 (-1.10…+2.82)","best":"12.60","bestRun":"balance/runs/116-portal-blocked.json"}
{"id":94,"time":"2026-10-10T16:24:06+02:00","name":"119-manapotion5","run":"balance/runs/119-manapotion5.json","rev":"07dcbcc","dirty":true,"code":"fafcf09542","bot":"0c6621d835","first":1,"seeds":96,"turns":20000,"changed":["ManaPotion: 0.4 → 0.5"],"rules":{"AffixLvlScale":1,"ArmorCap":0.5,"ArmorK":50,"ArmorPerLvl":10,"BoltCostLvl":0.667,"BoltEnePow":1,"BoltMul":1,"BossHpLin":0.22,"BudgetMul":7,"ChampBase":8,"ChampDmg":1.3,"ChampHp":2.2,"ChampPerDepth":3,"DmgLin":0.24,"DmgQuad":0.02,"DropChance":12,"GambleBonus":1,"GamblePerDepth":30,"GamblePrice":120,"GoldChance":30,"GoldPerLvl":2,"HPPerLvl":4,"HealCost":0.5,"HpLin":0.32,"HpQuad":0.05,"ManaPerEne":1.7,"ManaPerLvl":2,"ManaPotion":0.5,"MonArmorK":120,"MonArmorPerLvl":2,"MonToHitPerLvl":3,"NovaMul":1,"PackMul":1,"PotionHeal":0.65,"PotionPrice":20,"PotionPricePerLvl":4,"QuestGoldPerLvl":100,"RareBonus":0.2,"RerollPerDepth":10,"RerollPrice":50,"ScrollPrice":40,"ScrollPricePerLvl":6,"SellDiv":12,"StrDiv":45,"ToHitPerLvl":0,"WakeRange":10,"WandererDmg":1,"WandererHp":2.8,"XPBase":35,"XPExp":1.8},"score":14.251740900980007,"scoreCI":[12.293090415977684,16.065379839122137],"key":{"abyssDeath":11,"caster.clvl":19,"caster.deepest":9,"caster.gold":4.334242424242424,"caster.king":0.9583333333333334,"caster.oracle":0.4166666666666667,"fighter.clvl":18,"fighter.deepest":8,"fighter.gold":7.810858585858586,"fighter.king":0.9166666666666666,"fighter.oracle":0.16666666666666666,"gap":0.25,"stuck":0},"change":"ManaPotion 0.4 -\u003e 0.5: a mana potion restores half the pool","why":"candidate for the pick, parked for the fresh-seed validation: caster oracle 0.27-\u003e0.42 (sure), trips -4 (sure), surplus +258 (sure) against +524 at 0.6; the fighter's oracle rate wobbles 0.17-0.24 across these runs (noise), which is what the gap goal (0.25 here, 0.17 at 0.6) measures","decision":"revert","base":"balance/runs/116-portal-blocked.json","vsBase":"+1.65 (-0.82…+3.85)","best":"12.60","bestRun":"balance/runs/116-portal-blocked.json"}
{"id":95,"time":"2026-10-10T16:24:07+02:00","name":"120-shotmul","run":"balance/runs/120-shotmul.json","rev":"07dcbcc","dirty":true,"code":"fafcf09542","bot":"0c6621d835","first":1,"seeds":96,"turns":20000,"changed":["ShotMul: 0.8 → 0.6"],"rules":{"AffixLvlScale":1,"ArmorCap":0.5,"ArmorK":50,"ArmorPerLvl":10,"BoltCostLvl":0.667,"BoltEnePow":1,"BoltMul":1,"BossHpLin":0.22,"BudgetMul":7,"ChampBase":8,"ChampDmg":1.3,"ChampHp":2.2,"ChampPerDepth":3,"DmgLin":0.24,"DmgQuad":0.02,"DropChance":12,"GambleBonus":1,"GamblePerDepth":30,"GamblePrice":120,"GoldChance":30,"GoldPerLvl":2,"HPPerLvl":4,"HealCost":0.5,"HpLin":0.32,"HpQuad":0.05,"ManaPerEne":1.7,"ManaPerLvl":2,"ManaPotion":0.4,"MonArmorK":120,"MonArmorPerLvl":2,"MonToHitPerLvl":3,"NovaMul":1,"PackMul":1,"PotionHeal":0.65,"PotionPrice":20,"PotionPricePerLvl":4,"QuestGoldPerLvl":100,"RareBonus":0.2,"RerollPerDepth":10,"RerollPrice":50,"ScrollPrice":40,"ScrollPricePerLvl":6,"SellDiv":12,"ShotMul":0.6,"StrDiv":45,"ToHitPerLvl":0,"WakeRange":10,"WandererDmg":1,"WandererHp":2.8,"XPBase":35,"XPExp":1.8},"score":12.946402370808292,"scoreCI":[12.278363288487068,14.373209228439851],"key":{"abyssDeath":11,"caster.clvl":19,"caster.deepest":8,"caster.gold":3.7037037037037037,"caster.king":0.96875,"caster.oracle":0.2916666666666667,"fighter.clvl":18,"fighter.deepest":8,"fighter.gold":7.796296296296297,"fighter.king":0.875,"fighter.oracle":0.125,"gap":0.16666666666666669,"stuck":1},"change":"ShotMul 0.8 -\u003e 0.6 (new knob: a monster's shot as a fraction of its blow; 0.8 is the old 4/5)","why":"the Kindling and abyss1 floor trials do not move (2/48 and 0/48 par heroes survive, as at 0.8) and the eval is noise (+0.34); eight imps at 60% are still 80 a turn: the depth-10 wall is how many ranged packs converge in an open cave, not what one shot does","decision":"revert","base":"balance/runs/116-portal-blocked.json","vsBase":"+0.34 (-1.03…+2.59)","best":"12.60","bestRun":"balance/runs/116-portal-blocked.json"}
